title,company,location,job description
b'Data Science Chapter Lead',b'Vistaprint',"b'Waltham, MA, US'","b'About Vistaprint\n\nWe are Vistaprint, a member of the Cimpress family (NASDAQ: CMPR), the world leader for mass-customized marketing products, serving almost 20 million small and medium sized businesses locally in 20+ countries. Working across the globe in a truly international team, we are shaping the digital revolution in printing and mass customization. Over the past 25 years, we grew from startup to $2.75 billion in annual revenue and are confident that we still have a huge, multi-year growth opportunity ahead of us. Our confidence is driven by two primary factors: firstly, ~80% of the market segment for small businesses\xe2\x80\x99 marketing materials is still served through traditional offline channels, often lacking the convenience and cost advantages from greater scale that we can offer our customers. Secondly, there is a significant opportunity to accelerate our activity in adjacent product segments such as packaging, apparel, signage, or corporate line of business accounts. We are a profitable business with an entrepreneurial mindset, and throughout our history we have proven our commitment to investing for long-term horizons.\n\nSince our inception, Vistaprint has sought to disrupt our market and to build a transformational and enduring business. Over the past 20 years, we\xe2\x80\x99 have reinvented ourselves frequently in service of this mission. Change is in our DNA.\n\nOPPORTUNITY\n\nIt is an exciting time to join Vistaprint as our founder, Robert Keane, recently stepped back in to lead Vistaprint as CEO and, is building out a new executive team. Together with all employees, we are renewing the company\xe2\x80\x99s focus on delighting customers, fostering an entrepreneurial culture and accelerating our world-class capabilities.\n\nWe have a tremendous opportunity in front of us. Vistaprint\xe2\x80\x99s vision of helping small business owners live their dreams is exciting and inspirational. In order to capitalize on our opportunity, we have embarked on a transformation journey to deliver \xe2\x80\x9cjaw-dropping customer value\xe2\x80\x9d. This transformation journey will lead us to achieve world-class technology, services, and innovation, and create an environment where our team members are inspired and enabled to do their best work.\n\nWinning big in Data and Analytics is among our key priorities. Therefore, we recently hired a Chief Data Officer and are building the respective organization. Mission of this newly established team is to transform Vistaprint with industry-leading data products into one of the world\xe2\x80\x99s most iconic Data and Analytics (DnA)-driven companies. We do this to\nEnable jaw-dropping, seamless, and fully personalized customer experience\nFuel profitable growth with analytics capabilities across our entire value chain\nAttract and retain top notch data science, analytics, and business-translator talent.\nThe newly established CDO organization will consist of cross-functional product teams that sit in 5 domains (pricing/promotion/personalization, channel platform/digital advertising, core business/customer modeling, manufacturing/supply chain, E2E customer experience). Next to the domains, there are chapters with specialized talent that works for the product teams. One of this chapters is Data Science, where we are recruiting for the chapter lead.\n\nTo enable top-notch data science and analytics capabilities, we have made major multi-year investments in a cloud-based, service-oriented and data-rich technology platform. The new platform has already launched in one country and will be rolled out across Europe during 2020, unlocking significant capability and hence, opportunity for growth.\n\nPosition Summary\n\nIn support of this transformation, we are hiring for a newly created Data Science Chapter Lead position who will manage a team of data scientists responsible for the overarching goals of (i) developing best-in-class models and algorithms to create new data products and/or improve existing ones and (ii) establishing a data science community within Vistaprint, to foster exchange between various data capability chapters.\n\nKEY RELATIONSHIPS\n\nReports to\n\nSebastian Klapdor, EVP and Chief Data Officer\n\n(member of the Vistaprint Executive Team)\n\nDirect reports\n\nAll members of Data Science chapter (currently ~10 people to be ramped up to 50 in the next 24 months).\n\nOther Key Relationships\n\nCDO Domain and Chapter Leads\n\nVistaprint Executive Team\n\nKey Responsibilities\n\nDirectly reporting to the Chief Data Officer and as member of the CDO leadership team, the Data Science Chapter Lead will take a core role in Vistaprint\xe2\x80\x99s transformation towards a highly data-driven organization by leading a team of data scientists deploying best-in-class models and algorithms. Besides fostering exchange between the various data capability chapters by establishing a data science community within Vistaprint, the Data Science Chapter Lead is steering the development of both new data products and new methodologies applied to existing products. As the Data Science Chapter Lead, he/she will be responsible for:\nShaping the initial growth of Data Science at Vistaprint through recruiting, staffing, training and retention of the Data Science Chapter team\nSetting up a data science community within Vistaprint, allowing knowledge transfer between all data capability chapters\nWorking closely with colleagues from other data capability chapters to facilitate data exploration and fast prototyping\nBuilding and leading a data science innovation lab for early stage idea exploration and testing jointly with business stakeholders\nDeveloping complex models and algorithms that drive innovation throughout the organization, such as state-of-the-art dynamic pricing models\nPrototype to production:\nDesigning, developing and implementing product prototypes that are piloted and converted to products the use of which is institutionalized within the business\nWorking closely with the business to collect feedback, incorporating in the product, as well as maintaining and improving its functionality over time\nIn conjunction with other stakeholders, establish an end to end Data Science technology platform to enable rapid prototyping, smooth delivery to production (including data processing), and agile improvement of models once in production\nEstablishing a data science \xe2\x80\x9cbrand\xe2\x80\x9d for Vistaprint in relevant Data Science communities\n\nDESIRED OUTCOMES\nAcquisition and retention of ~50 data scientists over the next 24 months\nAdoption of leading data science practices incl. CICD, model lifecycle management, quality assurance\nFostering a healthy Data Science culture driven by agile practices and business value\n\nIdeal Experience\nMSc/PhD in computer science, statistics, or operations research or related technical discipline (e.g. math, physics)\nCertifications in statistics, data mining and machine learning a plus\n5+ years of experience in a management role with direct people leadership\n10+ years of experience in a data science related field (e.g., machine learning, optimization, statistics): exceptional track record of developing analytical models in a wide range of situations and with varying levels of data architecture / availability\nFamiliarity with latest Data Science, Analytics and Technology trends and their impact on business strategies and operations\nDeep knowledge in relevant application domains for e-commerce and manufacturing (e.g., personalization, attribution modeling, programmatic advertising)\nStrong understanding of statistics, structured and unstructured data analysis, predictive modeling techniques and good command of emerging methodologies like Artificial Intelligence\nRecognized thought leader and innovator in the development of new tools, methodologies and problem solving approaches\nArticulate, persuasive, communicator. Commands the room, handles executive and difficult audiences well. Skilled at defining, motivating and driving change at executive levels and across the broader community of stakeholders.\n\nLEADERSHIP CAPABILITIES\nDriving Results: an excellent understanding of costs and benefits and an ability to use that understanding to prioritize activities.\nCustomer Mindset: Ideally brings experience in serving and innovating on behalf of small business customers\nDriving Change: Highly trusted individual; excellent communication and interpersonal skills; experience with change management to help change mindsets and behaviors across the organization\nBuilding Capability:\nSelf-starter, hands-on entrepreneurial mindset; comfortable to take controlled risks and drive experimentation and learning\nAbility to scale and devise processes that support fast, decentralized decision making\nLeading People: Confident, engaging people leader, able to communicate a vision and bring people along on the journey'"
b'Senior Data Scientist',b'Zebra Technologies',"b'Burlington, MA, US'","b'Overview\n\nAt Zebra, we\xe2\x80\x99re reinventing how businesses operate at the enterprise edge - helping them run faster, smarter, and more connected than ever before.\nA dynamic community of builders, doers and problem solvers, we each play a unique role - shaping new technologies, bringing solutions to market, and partnering with companies on the front line of business.\nBeing a part of Zebra means making your mark as we make digital transformation a reality.\nIt means growing into a leader at a leading company that makes a distinct difference - because together, we\xe2\x80\x99ve only just begun.\nBuild Today. Create Tomorrow.\nJoin a team of builders, doers and problem solvers.\nJoin Zebra.\nWe are seeking a data scientist with expertise in machine learning and its use in identifying opportunities in customer data! If you love data, curious about analyzing and finding problems, and identifying solutions then this job is for you! The successful candidate will be a member of a close-knit team of data analysts, data scientists, and software developers analyzing large, multidimensional datasets from internal and external sources. The ideal person will develop and apply novel models on customer data in order to help identify areas to increase profits and reduce losses.\n\nResponsibilities\n\nDesigns and implementation of regression based predictive models incorporating diverse data types\nIntegrates state-of-the-art machine learning algorithms as well as the development of new methods\nPartners with experimentalists to translate models into testable hypotheses\nDevelops tools to support analysis and visualization of large datasets\nDevelops, codes software programs, implements industry standard auto ML models (Speech, Computer vision, Text Data), Statistical models, relevant ML models (devices/machine acquired data), AI models and algorithms\nIdentifies significant foresights based on predictive ML models from large data and metadata sources; interprets and communicates foresights, insights and findings from experiments to product managers, service managers, business partners and business managers\nMakes use of Rapid Development Tools (Business Intelligence Tools, Graphics Libraries, Data modelling tools) to optimally communicate research findings using visual graphics, Data Models, machine learning model features, feature engineering / transformations to relevant stakeholders\nAnalyze, review and track trends and tools in Data Science, Machine Learning, Augmented Intelligence, Artificial Intelligence and IoT space to help in making build/buy/partner recommendations\nInteracts with Cross-Functional teams to identify questions and issues for data engineering, machine learning models feature engineering\nEvaluates and makes recommendations to evolve data collection mechanism for Data capture to improve efficacy of machine learning models prediction\nHelps efficiently maintain cloud Infrastructure for research, staging and beta/pilot environment (from costs perspective for working with huge data sets)\nMentors, guides, and indirectly leads less experienced Data Scientist peers\nDrives innovation by encouraging open, high energy, collaborative environment; lead participation in innovation summit and expos, recommend relevant training and conference for employees to attend, publish papers and patent disclosures\nMeets with customers, partners, product managers and business leaders to present findings, predictions, foresights; Gather customer specific requirements of business problems/processes; Identify data collection constraints and alternatives for implementation of models\n\n\nQualifications\n\nBachelor\xe2\x80\x99s degree required. Master\xe2\x80\x99s preferred\nStrong background in statistics, machine learning, deep learning and programming required\n5+ years experience required\nExperience in solving large-scale real-world industry problems, preferably in collaboration with cross-functional, multi-disciplinary teams\nKnowledge of statistical programming techniques and languages (e.g., R, Python, Java, etc.)\nWorking knowledge of common machine learning and deep learning approaches (e.g. regression, clustering, classification, dimensionality reduction, supervised and unsupervised techniques, Bayesian reasoning, boosting, random forests, deep learning) and data analysis packages\nPrior experience with Tensorflow\nPrior experience in Natural Language Processing using NLTK\nRetail industry experience desired\nExperience using cloud compute (e.g. Google Cloud Platform, AWS, Azure)\nFamiliarity with NoSQL databases, graphical analyses, and large-scale data processing frameworks (e.g. Apache Spark)\nSolid understanding of data structures, software design and architecture\nAbility to work independently and take initiative, but also a co-operative team player\n\nZebra is an equal opportunity/affirmative action employer committed to a diverse and inclusive workplace. All qualified applicants will receive consideration for employment without regard to race, color, religion, sex, pregnancy, ancestry, marital status, age, sexual orientation, gender identity, national origin, disability status, protected veteran status or any other basis prohibited by law. If you are an individual with a disability and need assistance in applying for a position, please contact us at workplace.accommodations@zebra.com .\n\nThe EEO is the Law poster is available here https//www.zebra.com/content/dam/zebra/compliance/eeoisthelawposter.pdf\n\nThe EEO is the Law poster supplement is available here https//www.zebra.com/content/dam/zebra/compliance/ginasupplement.pdf\n\nZebra is a federal contractor and is committed to an alcohol and drug free workplace. As a result, all U.S. based employees are subject to the Drug and Alcohol Free Workplace Policy and Procedure.'"
"b'Data Scientist, Junior'",b'The AI Institute',"b'Massachusetts, United States'","b'The principle is as follows: we help you find a position as a Data Scientist with one of our partner companies (often consulting firms). The hiring company finances the 3-month training course with us for an amount of USD 10800. The hiring company (entity paying for your training) then provides you with an employment letter for April, 2020. The training with The AI Institute begins on January 1, 2020 for 3 months.\n\nThe Bootcamp shall begin on the 1st of May 2020 - The objective of this training is to provide scientific graduates with the tools, knowledge, technical and human skills required or useful to become an operational project manager on any project within the fields of in Data Science and Artificial Intelligence transformation, and to know how to implement such knowledge in the business world, in particular:\n\nDefinition: Understanding Data Science; Artificial Intelligence; Machine Learning and Deep Learning (neural networks): definitions and objectives; discovering theoretical principles and foundations; discovering programming tools (Python, Tensorflow).\n\nTools:\nMaster the main Data Science tools, statistical methods and their applications in digital data processing and analysis; R; Python and algorithm language workshops; SAS workshops; AWS workshops.\nPass the Base Programmer SAS certification, the software most used by statisticians.\nPass the AWS Foundational certification to know how to deploy your solutions on the cloud.\n\nTechnical foundation:\nMaster the main techniques of Machine Learning, Deep Learning and Neural Networks - understand how they work and know how to implement them; data mining applications; practical workshops on Keras and Tensorflow frameworks.\nTechnologies: mastering AI technologies specific to image, video and natural language processing, including convolutional neural networks, particularly through Python and Tensorflow project workshops.\n\nBusiness cases:\nKnow and understand the fields of application of AI in companies through the analysis of many business cases of various implementations (economic sectors, objectives, input data, constraints...) to know where its use is possible, with which means, risks and prospects of success.\n\nProject development: Know and understand how to build and carry out innovation projects in AI; analyze pre-required data, generate innovative ideas, take into account regulations, identify resources and expertise, build an infrastructure, lead a prototype, manage iterations...\n\nIn order to register for this training, all you have to do is send in your CV and motivation letter to admission@theaiinstitute.ai or fx@theaiinstitute.ai, or apply through LinkedIn jobs, and the team will schedule a call explaining further regarding the deposit payment, and the employment opportunities available with us or our network based on your profile.'"
b'Data Scientist',"b'Aetna, a CVS Health Company'","b'Wellesley, MA, US'","b""Job Description\n\nIt\xe2\x80\x99s a new day in health care.\n\nCombining CVS Health and Aetna was a transformative moment for our company and our industry, establishing CVS Health as the nation\xe2\x80\x99s premier health innovation company. Through our health services, insurance plans and community pharmacists, we\xe2\x80\x99re pioneering a bold new approach to total health. As a CVS Health colleague, you\xe2\x80\x99ll be at the center of it all.\n\nWe offer a diverse work experience that empowers colleagues for career success. In addition to skill and experience, we also seek to attract and retain colleagues whose beliefs and behaviors are in alignment with our core values of collaboration, innovation, caring, integrity and accountability.\nFundamental Components\nParticipates in the development, validation and delivery of algorithms, statistical models and reporting tools. Solves moderately complex analytical problems.\nDevelops, validates and executes algorithms and predictive models to investigate problems, detect patterns and recommend solutions.\nExplores, examines and interprets large volumes of data in various forms. Performs analyses of structured and unstructured data to solve moderately complex business problems. utilizing advanced statistical techniques and mathematical analyses.\nDevelops data structures and pipelines to organize, collect and standardize data that helps generate insights and addresses reporting needs.\nUses data visualization techniques to effectively communicate analytical results and support business decisions.\nCreates and evaluates the data needs of assigned projects and assures the integrity of the data. Explores existing data and recommends additional sources of data for improvements.\nDocuments projects including business objectives, data gathering and processing, detailed set of results and analytical metrics.\n\nBackground Experience\nDemonstrates good written and verbal communication skills.\nAble to present information to various audiences.\nEffectively resolves problems and roadblocks as they occur.\nDemonstrates proficiency in several areas of data modeling, machine learning algorithms, statistical analysis, data engineering and data visualization.\nAbility to work with large data sets from multiple data sources.3 years of relevant programming or analytic experience.\nMasters degree preferred.Bachelor's degree or equivalent work experience in Mathematics, Statistics, Computer Science, Business Analytics, Economics, Physics, Engineering, or related discipline.\nJob Group\nData & Analytics\nPrimary Location (City, State)\nMA-Wellesley\nAdditional Locations\nMA-Wellesley\nPotential Telework Position\nNo\n\nPercent Of Travel Required\n\n0 - 10%\nFull or Part Time\nFull Time\n\nSupervisory Responsibilities\n\nNo\nEEO Statement\nAetna is an Equal Opportunity, Affirmative Action Employer\n\nBenefits Program\n\nBenefit eligibility may vary by position.\nCandidate Privacy Information\nAetna takes our candidate's data privacy seriously. At no time will any Aetna recruiter or employee request any financial or personal information (Social Security Number, Credit card information for direct deposit, etc.) from you via e-mail. Any requests for information will be discussed prior and will be conducted through a secure website provided by the recruiter. Should you be asked for such information, please notify us immediately.\nResource Group\n2\nInitiative Group\n104\nReq#\n69731BR"""
b'Data Scientist (Consumer Labs)',b'NortonLifeLock',"b'Cambridge, MA, US'","b'Data Scientist (Consumer Labs)\n\nUSA - Massachusetts, Cambridge\n\nWe Are Hiring For a Data Scientist\n\nCome work on groundbreaking next-gen products in the Consumer Labs of the Consumer Business Unit (LifeLock + Norton).\n\nWe are looking for a DATA SCIENTIST who will help us discover the information hidden in vast amounts of network traffic data, customer transaction data, user and device behavior data so that we can make more accurate and predictive decisions to deliver better privacy and security related services and products. Your primary focus will be in applying data mining techniques, doing statistical analysis, and building high-quality prediction systems integrated with our products.\n\nQualifications\nWorking knowledge of machine learning techniques and algorithms\nWorking knowledge of common statistical modeling techniques and algorithms\nWorking knowledge of data scientific tools such as R, MatLab.\nMinimum of 2 years of industry experience\n\n\nNortonLifeLock is proud to be an equal opportunity employer. We celebrate diversity and are committed to creating an inclusive and accessible environment for all employees. All employment decisions are based on merit, experience, and business needs, without regard to race, color, national origin, age, religion, sex, pregnancy (including childbirth or related medical conditions), genetic information, disability (physical or mental), medical condition, marital status, sexual orientation, gender identity or gender expression, military or veteran status, or any other consideration made unlawful by federal, state, or local law. NortonLifeLock strictly prohibits unlawful discrimination based on such protected characteristics and seeks to recruit the most talented candidates from diverse cultures and backgrounds.\n\nWe also consider for employment qualified individuals with arrest and conviction records. In addition, NortonLifeLock will not discharge or in any other manner discriminate against employees or applicants because they have inquired about, discussed, or disclosed their own pay or the pay of another employee or applicant. Learn more about pay transparency .\n\nEEO is the law. Applicants and employees of NortonLifeLock Inc. are protected under Federal law from discrimination. See the EEO poster and supplement .\n\nPosted 25 Days Ago Full time 49587\n\nNortonLifeLock Inc. (NASDAQ: NLOCK) is a global leader in consumer Cyber Safety. NortonLifeLock is dedicated to helping secure the devices, identities*, online privacy, and home and family needs of its nearly 50 million consumers, providing them with a trusted ally in a complex digital world. For more information, please visit NortonLifeLock.com or connect with us on Facebook , Twitter , LinkedIn , Instagram and YouTube .\n\nNortonLifeLock is committed to requests for reasonable accommodations to assist you in applying for positions at NortonLifeLock including resume submissions. If you need to request an accommodation, please contact HR Service Exchange .\n\nLifeLock identity theft protection is not available in all countries.\n\nData Scientist | USA - Massachusetts, Cambridge'"
