title,company,location,job description
b'Data Analyst',b'Brooksource',"b'Boston, Massachusetts'","b""Data Analyst\n\n\nBoston, MA\n\n\nAs the Data Analyst for this Management Consulting firm, you will be responsible for utilizing tools such as SQL and Tableau to turn abstract information from data analyses into appealing, understandable visualizations. You will be supporting both marketing and leadership teams with insights surfaced from data and metrics to make business decisions and measure progress on enterprise-level initiatives.\n\n\nMinimum Qualifications:\n Bachelor\xe2\x80\x99s Degree in Computer Science, Information Technology\n 3+ years\xe2\x80\x99 experience with data aggregation, data visualization, business intelligence\n1+ years experience with Tableau, commensurate experience with Qlikview or Spotfire or PowerBI is acceptable\n3+ years\xe2\x80\x99 experience running complex SQL queries\nData visualization experience within a Marketing group is preferred\n\n\nResponsibilities:\nUtilize SQL, Tableau to turn abstract information from data into understandable visualization\n Supervise complex substantive analysis on large data sets\nTransform data sets into simple visuals and dashboards that answer business questions\nUncover new knowledge and discover new insight that supports better-informed business decisions\nPresent outcomes and conclusions to both technical and non-technical audiences\n\n\nWhat\xe2\x80\x99s in it for you:\nOpportunity to work in the up and coming Seaport district of Boston\nBe a part of a new, dynamic team less than a year old\n\n\n\nABOUT EIGHT ELEVEN:\n   At Eight Eleven, our business is people. Relationships are at the center of what we do. A successful partnership is only as strong as the relationship built. We\xe2\x80\x99re your trusted partner for IT hiring, recruiting and staffing needs.\n\n   For over 16 years, Eight Eleven has established and maintained relationships that are designed to meet your IT staffing needs. Whether it\xe2\x80\x99s contract, contract-to-hire, or permanent placement work, we customize our search based upon your company's unique initiatives, culture and technologies. With our national team of recruiters placed at 21 major hubs around the nation, Eight Eleven finds the people best-suited for your business. When you work with us, we work with you. That\xe2\x80\x99s the Eight Eleven promise.\n\n   Eight Eleven Group provides equal employment opportunities (EEO) to all employees and applicants for employment without regard to race, color, religion, national origin, age, sex, citizenship, disability, genetic information, gender, sexual orientation, gender identity, marital status, amnesty or status as a covered veteran in accordance with applicable federal, state, and local laws."""
b'Data Scientist -Boston',b'PALNAR',"b'Boston, MA, US'","b""Our Direct Client is seeking a hands-on data scientist with financial or healthcare services industry experience. The associate's key differentiating abilities will be outstanding data science, programming and problem-solving skills. Absolutely critical is individual's ability to carry an initiative from ideation to execution. ONLY W2Full Time MUST HAVES include AI learning- Machine learning, numeric data is used Deep learning multi layer- LC Python, scikit-learn, nltk are a must The Expertise We're Looking For A natural programmer, with demonstrated industry experience statistics, machine learning, data modeling and building associated pipelines - Experience with one or more of the following toolsframeworks python, scikit-learn, nltk, pandas, NumPy, R, PySpark, Scala, SQLbig data tools, TensorFlow, PyTorch, etc. 3 years of data science experience in financial, healthcare or digital services industries. Analytic Skills In addition to core regression, classification and time series skills that accompany the data science role, experience with AB testing, causal inference and experimentation methods are preferred Education At least one advanced degree (Master or PhD level) in a technical or mathematically-oriented discipline, e.g., coursework or experience in fields such as statistics, machine learning, computer science, applied mathematics, econometrics, engineering, etc. The Purpose of Your Role You will work with peer data scientists and business stakeholders to provide data analysis, machine learning and analytic thought leadership, develop Machine Learning and or Deep Learning based Models and production-quality machine learning pipelines for specific use cases. You will also work closely with Product Managers and on various aspects of model pipeline rollouts. Our Direct Client is seeking a hands-on data scientist with financial or healthcare services industry experience. The associate's key differentiating abilities will be outstanding data science, programming and problem-solving skills. Absolutely critical is individual's ability to carry an initiative from ideation to execution. ONLY W2Full Time MUST HAVES include AI learning- Machine learning, numeric data is used Deep learning multi layer- LC Python, scikit-learn, nltk are a must The Expertise We're Looking For A natural programmer, with demonstrated industry experience statistics, machine learning, data modeling and building associated pipelines - Experience with one or more of the following toolsframeworks python, scikit-learn, nltk, pandas, NumPy, R, PySpark, Scala, SQLbig data tools, TensorFlow, PyTorch, etc. 3 years of data science experience in financial, healthcare or digital services industries. Analytic Skills In addition to core regression, classification and time series skills that accompany the data science role, experience with AB testing, causal inference and experimentation methods are preferred Education At least one advanced degree (Master or PhD level) in a technical or mathematically-oriented discipline, e.g., coursework or experience in fields such as statistics, machine learning, computer science, applied mathematics, econometrics, engineering, etc. The Purpose of Your Role You will work with peer data scientists and business stakeholders to provide data analysis, machine learning and analytic thought leadership, develop Machine Learning and or Deep Learning based Models and production-quality machine learning pipelines for specific use cases. You will also work closely with Product Managers and on various aspects of model pipeline rollouts."""
b'Principal Data Scientist',b'Intelletec',"b'Boston, Massachusetts, United States'","b""PRINCIPAL DATA SCIENTIST\n\nIntelletec has teamed up with one of the US's Leading Healthcare firms. They are going through a massive transformation and are looking for a Principal Data Scientist to join the leadership team in the NYC, Boston or Connecticut office.\n\nThe Principal Data Scientist will have a broad impact and true ownership. You will provide strategic leadership for the development, validation, and delivery of algorithms and statistical models. Acting as the analytic team lead for highly complex projects involving multiple resources and tasks, providing individual mentoring in support of company objectives.\n\nRESPONSIBILITIES\nWork with C-level stakeholders and articulate machine learning concepts in non-technical terms\nLead team of 2-3 Data Scientists on the development and delivery of predictive analytics solutions to drive behavior change or customer experience across channels\nConsult with business partners to understand problems and goals, understand the business value, and translate into business opportunities to be captured through predictive analytics solutions\nDevelop advanced algorithms and statistical predictive models and determines analytical approaches and modeling techniques to evaluate scenarios and potential future outcomes\nThink creatively to identify opportunities for digital innovation\nEvaluate externally developed technology solutions\nCommunicate new ideas and methods to the broader team\nIncrease efficiency through both tactical and strategic technology implementations\n\nSKILLS AND EXPERIENCE\nYou are a go-getter and self-starter with an entrepreneurial spirit\n6 or more years of progressively complex related experience\nDemonstrates advanced in-depth specialization in mathematical analysis methods, machine learning, statistical analyses, and predictive modeling\nComprehensive knowledge of the health care industry, products, systems, business strategies, and products\nExpertise in advanced analytics tools and languages to analyze large data sets from multiple data sources\nSuperior ability to communicate technical ideas and results to non-technical clients in written and verbal form\nAdvanced in-depth specialization in mathematical analysis methods, machine learning, statistical analyses, and predictive modeling\nExpertise in using R or Python to manipulate large data sets and develop statistical models\n\nON OFFER\nVery competitive pay, bonus, full medical, dental & vision benefits and more\nA tight-knit team of passionate people and a tech-first business\nAutonomy and end-to-end ownership\nOpportunity for fast growth & promotion"""
"b'Data Scientist, Office of Data Science'",b'Liberty Mutual Insurance',"b'Boston, MA, US'","b'Help shape the future of Data Science across Liberty!\n\nAs a technical member of the Office of Data Science (ODS), Enablement & Collaboration unit, you will work with a team of data science (DS) and machine learning (ML) experts to solve Liberty\xe2\x80\x99s most challenging data science problems.\n\nThe ODS was created to provide additional centralized support and expertise to DS teams across the global organization. Our projects focus on key areas of interest to multiple teams, bleeding edge research and experimentation, common tool development, and establishing best practices to ensure the scientific community at Liberty is well-positioned to rapidly meet the challenges of modern industry.\n\nIf you are interested in making an impact on an entire culture at a Fortune 100 company, the ODS is the place for you!\n\nAs a centralized group, our project scope is vast. Possible projects include:\nDesign new language models (NLP/NLU) to understand and build predictions or summaries from customer calls, claim notes, web chats, medical records, and beyond.\nDetect property hazards from aerial imagery, customer photos, geospatial data, etc. using computer vision (CV).\nExplore the advantages and limitations of privacy-preserving ML, to accelerate experimentation and better protect our customers\xe2\x80\x99 data.\nPush the boundaries in fundamental experimentation to boost and augment small-sample or rare-event data, transfer learning, and similar techniques.\nEngage in theoretical research in collaboration with MIT, via Liberty\xe2\x80\x99s investment in the MIT Quest for Intelligence, to shape the future of AI\n\nResponsibilities\nWork on cross-functional R&D teams, including ODS and business-unit data scientists/analysts, doing hands on ML research in areas such as computer vision, natural language processing, interpretable ML, and privacy preserving ML.\nAccelerate the deployment of reproducible ML models by helping the business set and apply current best practices, including the use of open source software, container-based or serverless cloud platforms, and self-service operating models.\nDevelop common DS/ML tools and infrastructure across the business.\nSet the standards for statistical testing and experimental design, as well as other quality standards such as testing coverage, code review, etc. for data science\nWork with product owners and business units across Liberty to identify new opportunities where the ODS can accelerate research and development of DS and ML tools and techniques\nThe actual internal level/grade for this role will depend on the candidate\xe2\x80\x99s overall experience and skill level.\n\nQualifications\nBachelor\xe2\x80\x99s degree in Statistics, Economics, Computer Science, or any quantitative discipline with relevant work experience, required; advanced degree a definite plus.\nExtensive experience analyzing data and a broad understanding of core statistical and ML techniques.\nDemonstrated experience in deep learning, computer vision, natural language processing, and/or interpretable machine learning.\nDemonstrated proficiency in R or Python required.\nPossess strong analytical, strategic, project management, decision-making and problem-solving skills.\nDemonstrated ability to perform high quality work both independently and collaboratively.\n\nBenefits\n\nWe value your hard work, integrity and commitment to positive change. In return for your service, it\xe2\x80\x99s our privilege to offer you benefits and rewards that support your life and well-being. To learn more about our benefit offerings please visit: https://LMI.co/Benefits\n\nOverview\n\nAt Liberty Mutual, we give motivated, accomplished professionals the opportunity to help us redefine what insurance means; to work for a global leader with a deep sense of humanity and a focus on improving and protecting everyday lives. We create an inspired, collaborative environment, where people can take ownership of their work; push breakthrough ideas; and feel confident that their contributions will be valued and their growth championed.\n\nWe\xe2\x80\x99re dedicated to doing the right thing for our employees, because we know that their fulfillment and success leads us to great places. Life. Happiness. Innovation. Impact. Advancement. Whatever their pursuit, talented people find their path at Liberty Mutual.'"
b'Data Scientist',b'Amazon',"b'Cambridge, MA, US'","b""Description\n\nInterested in Amazon Echo? We\xe2\x80\x99re building the speech and language solutions behind Amazon Echo and other Amazon products and services. Come join us!\n\nYou Will\n\nAs a Data Scientist in our Applied Modeling team, you will be responsible for data-driven improvements to our machine learning models. Your work will directly impact our customers in the form of products and services that make use of speech and language technology.\nEnsure data quality throughout all stages of collection/acquisition, annotation and processing, including such areas as data sourcing/collection, ground truth generation, normalization, transformation, etc.\nClean, analyze and select data to achieve goals\nAnalyze model performance to provide insights\nCollaborate with colleagues from science, engineering and business backgrounds\nPresent proposals and results in a clear manner backed by data and coupled with actionable conclusions\nWork with engineers to develop efficient data infrastructure for both offline and online use cases\n\nBasic Qualifications\nBachelor's Degree\n3+ years of experience with data scripting languages (e.g SQL, Python, R etc.) or statistical/mathematical software (e.g. R, SAS, or Matlab)\n2 years working as a Data Scientist\nMaster's degree in a relevant field\n3+ years experience with various data analysis and visualization tools\nExperience in Python or another scripting language; command line usage\nExperience with statistical modeling / machine learning and parameters that affect their performance\nPreferred Qualifications\nPhD\xe2\x80\x99s in a relevant field\nTrack record of diving into data to discover hidden patterns and of conducting error/deviation analysis\nAbility to develop experimental and analytic plans for data modeling processes, ability to accurately determine cause and effect relations\nUnderstanding of relevant statistical measures such as confidence intervals, significance of error measurements, development and evaluation data sets, etc.\nStrong attention to detail\nExceptional level of organization\nComfortable working in a fast paced, highly collaborative, dynamic work environment\nAmazon is an Equal Opportunity Employer \xe2\x80\x93 Minority / Women / Disability / Veteran / Gender Identity / Sexual Orientation / Age\n\n\nCompany - Amazon.com Services LLC\nJob ID: A1090583"""
b'Lead Data Scientist',b'athenahealth',"b'Newton, Massachusetts, United States'","b'This individual will serve as technical leader for athenahealth\xe2\x80\x99s data scientists focused on machine learning, predictive analytics and related projects. Athena is a highly data driven company, and we (the analytics division) also empower our clients to be data-driven through reports, dashboards and insights.  In many cases, the most impactful insights come from the right model applied to the right metric and communicated through the right channel.  As a Data Science leader you will guide a team of data scientists, helping them identify the most impactful use cases, the most relevant models, best technologies for implementation, and clearest modes of communication for the application at hand.  \n  Keywords applicable to you include:  DEEP LEARNING !!  Neural networks (NN), principle component analysis (PCA), natural language processing (NLP),Bayesian learning and inference, time series analysis, Markov chains, hidden Markov models, dynamic Bayesian networks; anomaly detection; stochastic methods\n\nHelp leadership assess the business value and required investment of new AI projects\nMeasure and communicate incremental value created by ML/AI approaches\nCreate and maintain strategic roadmaps for AI projects: connecting the right algorithms, technologies, data sets, and skill sets to maximize likelihood of project success\nPropose architectural requirements for model deployment and maintenance in production\nHelp develop data science training and competency development, determining best practices and work standards.  \nEvaluate the latest ML technologies and techniques, and determine how to incorporate these into our strategy.\n\nTypical Qualifications\n\nAdvanced degree (PHD, MS) in relevant field, e.g., physics, math, or computer science\nExcellent verbal communication and business acumen\n10 years of professional experience in data science or related role\nExperience collaborating with cross-functional teams\nHealthcare experience preferred, but not required\nExperience with the development and deployment of ML  and predictive models\nExperience with modern data science tools, e.g., Tensorflow, keras, Spark,H2O, Scikit-Learn, etc.\nAWS experience preferred\n\n  Multiple Data Scientist Roles at athenahealth\nJoin us to use cutting edge machine learning to unbreak healthcare in the US.\n  In the US, physicians face huge informational challenges \xe2\x80\x93 from dealing with mountains of formulaic email to wrestling with arcane insurance rules to finding at-risk patients in their large client pools.  \n  Athenahealth\xe2\x80\x99s Data Science group is using advanced machine learning and AI to develop a new generation of smart tools that can help physicians by reducing their paperwork, finding at-risk patients, providing key information at the right time, and overall allowing physicians to focus on what\xe2\x80\x99s important: spending time with patients.\n  We\xe2\x80\x99re seeking experienced data scientists who love machine learning and complex data and who care about making a positive impact on the world by fielding real ML-driven systems.\n  Positions are available at multiple levels of seniority. Candidates should have a MS or PhD in a related field and 3+ years of experience or BS with 5+ years\xe2\x80\x99 experience.\n\nKey ideas include:\nDeep Learning, Deep neural networks (DNN), information extraction, natural language processing (NLP), learning to rank, Bayesian learning and inference, time series analysis, Markov chains, hidden Markov models, principle component analysis (PCA), anomaly detection, user modeling, stochastic methods, scaling, performance.\n '"
b'Data Science Manager',b'X4 Group Ltd',"b'Boston, Massachusetts, United States'","b'A leading Boston based Automotive company at the forefront of automotive safety is looking to hire a Data Science Manager with extensive experience leading data science teams to join them on a permanent basis. The company is well established, have secured an exceptional amount of funding and are continuing to grow at a rapid rate.\n\nAs a Data Science Manager you will be responsible for leading a team of 15-20 data scientists at all experience levels, helping to develop the team members and overseeing projects.\n  Requirements\nMSc or PhD in computer science, mathematics or similar subject\nMinimum of 10 years industry experience in data science/machine learning\n5+ years experience managing teams of scientists/engineers\nExperience leading teams of 10+ scientists/engineers\nStrong hands on capability with the ability to ""roll your sleeves up""\nExperience in both a research and production environment\nExcellent machine learning, statistical and Python knowledge\n\nThe company is offering a competitive salary with industry leading benefits including bonus and stock and are looking to get someone started immediately with remote interviews commencing from Monday 30th March. Candidates must be US citizens or green card holders to be eligible.'"
b'Data Analyst/Migration (contract)',b'Alexander Technology Group',"b'Manchester, New Hampshire, United States'","b'The Alexander Technology Group is looking for a Data Analyst for a client in the Manchester, NH area.  This is a contract role but applicants must be on-site and local.\nRequirements:\n  Essential Duties and Responsibilities\n\nSkills and Qualifications - \nAnalyzes field mappings, extracts, and other artifacts to identify key changes in data structure due to migration.\nWorks with technical and business resources to understand and capture changes in data usage between source and destination systems.\nPowerBI\nETL/SSIS\nERWIN for data modeling\n\nIf interested, please send resume to Jpolombo@alexandertg.com'"
b'Data Scientist Intern',"b'FocusKPI, Inc.'","b'Boston, MA, US'","b""FocusKPI is looking for a data scientist intern to join us in our talent database project. This is a hands-on internship with training support. If you're seeking an internship that may turn into a full-time job, this is a great fit for you!\n\nDue to the current situation, you need to work remotely for the following weeks. You may work on-site after that or keep working at home. Our team is located in Boston, MA.\n\nResponsibilities\nCollaborate with project managers to comprehend and translate business requirements into technical solutions.\nCollaborate with other engineers in an Agile environment to launch new features and iterate on existing ones.\nProvide knowledge and skills in machine learning, statistical analysis, and varied data sets.\n\nQualifications\nDegree in Statistics, Mathematics, Computer Science, Information Systems, Business Analytics, or related field.\nExperience with data science techniques including machine learning / predictive modeling/data visualization/statistical and mathematical analyses is a plus.\nStrong knowledge of SQL/NoSQL databases, Python, R, PHP.\nStrong communication skills.\n\nThank you for applying!\n\nFocusKPI Hiring Team\n\nAbout FocusKPI\n\nFocusKPI Inc. is an analytics consulting business providing solutions such as CRM customization, Risk Management, Business Intelligence, Advanced/Operational/Web/Digital Analytics as well as Human Resources for our clients.\n\nwYnXoHw8L8"""
