title,company,location,job description
b'Principal Data Scientist',b'Intelletec',"b'Boston, Massachusetts, United States'","b""PRINCIPAL DATA SCIENTIST\n\nIntelletec has teamed up with one of the US's Leading Healthcare firms. They are going through a massive transformation and are looking for a Principal Data Scientist to join the leadership team in the NYC, Boston or Connecticut office.\n\nThe Principal Data Scientist will have a broad impact and true ownership. You will provide strategic leadership for the development, validation, and delivery of algorithms and statistical models. Acting as the analytic team lead for highly complex projects involving multiple resources and tasks, providing individual mentoring in support of company objectives.\n\nRESPONSIBILITIES\nWork with C-level stakeholders and articulate machine learning concepts in non-technical terms\nLead team of 2-3 Data Scientists on the development and delivery of predictive analytics solutions to drive behavior change or customer experience across channels\nConsult with business partners to understand problems and goals, understand the business value, and translate into business opportunities to be captured through predictive analytics solutions\nDevelop advanced algorithms and statistical predictive models and determines analytical approaches and modeling techniques to evaluate scenarios and potential future outcomes\nThink creatively to identify opportunities for digital innovation\nEvaluate externally developed technology solutions\nCommunicate new ideas and methods to the broader team\nIncrease efficiency through both tactical and strategic technology implementations\n\nSKILLS AND EXPERIENCE\nYou are a go-getter and self-starter with an entrepreneurial spirit\n6 or more years of progressively complex related experience\nDemonstrates advanced in-depth specialization in mathematical analysis methods, machine learning, statistical analyses, and predictive modeling\nComprehensive knowledge of the health care industry, products, systems, business strategies, and products\nExpertise in advanced analytics tools and languages to analyze large data sets from multiple data sources\nSuperior ability to communicate technical ideas and results to non-technical clients in written and verbal form\nAdvanced in-depth specialization in mathematical analysis methods, machine learning, statistical analyses, and predictive modeling\nExpertise in using R or Python to manipulate large data sets and develop statistical models\n\nON OFFER\nVery competitive pay, bonus, full medical, dental & vision benefits and more\nA tight-knit team of passionate people and a tech-first business\nAutonomy and end-to-end ownership\nOpportunity for fast growth & promotion"""
"b'Data Scientist, Office of Data Science'",b'Liberty Mutual Insurance',"b'Boston, MA, US'","b'Help shape the future of Data Science across Liberty!\n\nAs a technical member of the Office of Data Science (ODS), Enablement & Collaboration unit, you will work with a team of data science (DS) and machine learning (ML) experts to solve Liberty\xe2\x80\x99s most challenging data science problems.\n\nThe ODS was created to provide additional centralized support and expertise to DS teams across the global organization. Our projects focus on key areas of interest to multiple teams, bleeding edge research and experimentation, common tool development, and establishing best practices to ensure the scientific community at Liberty is well-positioned to rapidly meet the challenges of modern industry.\n\nIf you are interested in making an impact on an entire culture at a Fortune 100 company, the ODS is the place for you!\n\nAs a centralized group, our project scope is vast. Possible projects include:\nDesign new language models (NLP/NLU) to understand and build predictions or summaries from customer calls, claim notes, web chats, medical records, and beyond.\nDetect property hazards from aerial imagery, customer photos, geospatial data, etc. using computer vision (CV).\nExplore the advantages and limitations of privacy-preserving ML, to accelerate experimentation and better protect our customers\xe2\x80\x99 data.\nPush the boundaries in fundamental experimentation to boost and augment small-sample or rare-event data, transfer learning, and similar techniques.\nEngage in theoretical research in collaboration with MIT, via Liberty\xe2\x80\x99s investment in the MIT Quest for Intelligence, to shape the future of AI\n\nResponsibilities\nWork on cross-functional R&D teams, including ODS and business-unit data scientists/analysts, doing hands on ML research in areas such as computer vision, natural language processing, interpretable ML, and privacy preserving ML.\nAccelerate the deployment of reproducible ML models by helping the business set and apply current best practices, including the use of open source software, container-based or serverless cloud platforms, and self-service operating models.\nDevelop common DS/ML tools and infrastructure across the business.\nSet the standards for statistical testing and experimental design, as well as other quality standards such as testing coverage, code review, etc. for data science\nWork with product owners and business units across Liberty to identify new opportunities where the ODS can accelerate research and development of DS and ML tools and techniques\nThe actual internal level/grade for this role will depend on the candidate\xe2\x80\x99s overall experience and skill level.\n\nQualifications\nBachelor\xe2\x80\x99s degree in Statistics, Economics, Computer Science, or any quantitative discipline with relevant work experience, required; advanced degree a definite plus.\nExtensive experience analyzing data and a broad understanding of core statistical and ML techniques.\nDemonstrated experience in deep learning, computer vision, natural language processing, and/or interpretable machine learning.\nDemonstrated proficiency in R or Python required.\nPossess strong analytical, strategic, project management, decision-making and problem-solving skills.\nDemonstrated ability to perform high quality work both independently and collaboratively.\n\nBenefits\n\nWe value your hard work, integrity and commitment to positive change. In return for your service, it\xe2\x80\x99s our privilege to offer you benefits and rewards that support your life and well-being. To learn more about our benefit offerings please visit: https://LMI.co/Benefits\n\nOverview\n\nAt Liberty Mutual, we give motivated, accomplished professionals the opportunity to help us redefine what insurance means; to work for a global leader with a deep sense of humanity and a focus on improving and protecting everyday lives. We create an inspired, collaborative environment, where people can take ownership of their work; push breakthrough ideas; and feel confident that their contributions will be valued and their growth championed.\n\nWe\xe2\x80\x99re dedicated to doing the right thing for our employees, because we know that their fulfillment and success leads us to great places. Life. Happiness. Innovation. Impact. Advancement. Whatever their pursuit, talented people find their path at Liberty Mutual.'"
b'Data Scientist',b'Amazon',"b'Cambridge, MA, US'","b""Description\n\nInterested in Amazon Echo? We\xe2\x80\x99re building the speech and language solutions behind Amazon Echo and other Amazon products and services. Come join us!\n\nYou Will\n\nAs a Data Scientist in our Applied Modeling team, you will be responsible for data-driven improvements to our machine learning models. Your work will directly impact our customers in the form of products and services that make use of speech and language technology.\nEnsure data quality throughout all stages of collection/acquisition, annotation and processing, including such areas as data sourcing/collection, ground truth generation, normalization, transformation, etc.\nClean, analyze and select data to achieve goals\nAnalyze model performance to provide insights\nCollaborate with colleagues from science, engineering and business backgrounds\nPresent proposals and results in a clear manner backed by data and coupled with actionable conclusions\nWork with engineers to develop efficient data infrastructure for both offline and online use cases\n\nBasic Qualifications\nBachelor's Degree\n3+ years of experience with data scripting languages (e.g SQL, Python, R etc.) or statistical/mathematical software (e.g. R, SAS, or Matlab)\n2 years working as a Data Scientist\nMaster's degree in a relevant field\n3+ years experience with various data analysis and visualization tools\nExperience in Python or another scripting language; command line usage\nExperience with statistical modeling / machine learning and parameters that affect their performance\nPreferred Qualifications\nPhD\xe2\x80\x99s in a relevant field\nTrack record of diving into data to discover hidden patterns and of conducting error/deviation analysis\nAbility to develop experimental and analytic plans for data modeling processes, ability to accurately determine cause and effect relations\nUnderstanding of relevant statistical measures such as confidence intervals, significance of error measurements, development and evaluation data sets, etc.\nStrong attention to detail\nExceptional level of organization\nComfortable working in a fast paced, highly collaborative, dynamic work environment\nAmazon is an Equal Opportunity Employer \xe2\x80\x93 Minority / Women / Disability / Veteran / Gender Identity / Sexual Orientation / Age\n\n\nCompany - Amazon.com Services LLC\nJob ID: A1090583"""
b'Lead Data Scientist',b'Dynatrace',"b'Waltham, MA, US'","b'Are you a ""data geek\xe2\x80\x9d? Do you have a passion to foster business growth through data? Want to be a part of an energetic and talented team of \xe2\x80\x9ctechnologist\xe2\x80\x9d? Then continue reading!\n\nWho We Are\n\nDynatrace is software intelligence for the enterprise cloud! We have reinvented cloud and application performance monitoring to a full scale with end-to-end visibility of every user, across every application, anywhere in the digital ecosystem. The Dynatrace platform is easy, automatic, AI powered monitoring! Go beyond the standard, try our demo!\n\nWhat You Will Be a Part Of\n\nDynatrace has many functional layers from product to business development. Join the team that is driving how we do business at the global level through the leverage of data. This team enables Dynatrace to dynamically change our offerings, licenses, SKUs, and product integration process to ensure we are competitive, scalable and always ready to adapt to for customer success. Our product is continually improving through research and development, this team of \xe2\x80\x9ctechnologists\xe2\x80\x9d are no different by generating insights on how we have done business, and how we can continue to do better.\n\nWhy Work At Dynatrace\n\nDynatrace provides you with continuous growth opportunities in an environment catered towards learning, creativity and innovation. We pride ourselves on working hard and having fun! With a flat hierarchy mindset, you are enabled to voice your opinions, take ownership, and drive your own success. You will get to work in the heart of Detroit, the next \xe2\x80\x9ctech-hub\xe2\x80\x9d of the US where you are provided with easy access parking to Ford Field. We have an open, casual office with a heavy sense of community, collaboration and fun. A few perks of our office and Dynatrace can be seen below and check out Dynatrace Life on Twitter and Instagram .\n\nThe Role\n\nAs a Lead Data Scientist, you will be a key driver on pricing, pricing models, decision support tools and more through the use of machine learning and predictive analytics. Own a very high impact through a combination of business know-how, strong data analysis, and use of emerging data technologies to drive strong business results. Empower the data and business teams, create a successful vision for the pricing and sales team and lead the future of business at Dynatrace through data insights.\n\nQualifications/Requirements\n5+ years of experience working on business impacting data through machine learning and predictive analytics\nKnowledge of SaaS Enterprise Software and B2B software pricing\nExperience with SAS and Python or similar tool-sets\nExperience with data cleansing, accuracy and profiling\nExperience with working with cross functional business teams\nMaster\xe2\x80\x99s degree in Data Science or related programs\n\nWhat Will Make You Stand Out\nSoftware development experience/education\nMachine learning evangelist\nEnjoy being creative and show a high-energy with a passion for winning\nStrong communication and presentation skills\nExperience with global teams\nSelf-motivated with a strong work ethic\nConvinced that continuous delivery needs continuous feedback\n\nPerks And Benefits\nGreat Medical Benefits including Health, Vision and Dental\nAwesome Work/Life balance with a generous PTO/Holiday package\nProvided with excellent hardware/software for you to be successful\nBarista-Quality coffees and teas provided\nFresh fruit provided on Wednesdays\nFree snacks to keep you energized\nSubsidized drinks including sodas and energy drinks\nContinued education assistance and more\n\nDynatrace provides software intelligence to simplify enterprise cloud complexity and accelerate digital transformation. With AI and complete automation, our all-in-one platform provides answers, not just data, about the performance of applications, the underlying infrastructure and the experience of all users. That\xe2\x80\x99s why many of the world\xe2\x80\x99s largest enterprises trust Dynatrace to modernize and automate enterprise cloud operations, release better software faster, and deliver unrivaled digital experiences.\n\nWe offer competitive compensation, company-sponsored premium benefits, medical, dental, vacation/holidays, company matching 401(k) Plan, etc. Dynatrace is an equal opportunity employer and VEVRAA Federal Contractor. We consider all qualified applicants of diverse background and hire without regard to race, color, gender identity, religion, national origin, ancestry, citizenship, physical abilities, age, sexual orientation, veteran status, or any other characteristic protected by law. If your disability makes it difficult for you to use this site, please contact recruiting@dynatrace.com . Dynatrace participates in E-Verify, participant information in English and Spanish. Right to work information in English and Spanish. EEO is the Law / EEO is the Law Supplement.\n\nNote to Recruiters and Placement Agencies: Dynatrace LLC (Dynatrace) does not accept unsolicited agency resumes. Please do not forward unsolicited agency resumes to our website or to any Dynatrace employee. Dynatrace will not pay fees to any third party agency or firm and will not be responsible for any agency fees associated with unsolicited resumes. Unsolicited resumes received will be considered property of Dynatrace.'"
b'Sr. Data Scientist',b'Analog Devices',"b'Wilmington, MA, US'","b""Analog Devices (NASDAQ: ADI) designs and manufactures semiconductor products and solutions. We enable our customers to interpret the world around us by intelligently bridging the physical and digital worlds with unmatched technologies that sense, measure and connect.\n\nWhat You Will Be Doing\nLead data science projects and tasks that may include predictive analytics, machine learning, and natural language processing\nApply a wide array of advanced data mining techniques (including supervised and unsupervised methods, dimension reduction methods, and social network analysis methods) in support of research and operational analytic projects\nWork extensively in Python\nMentor entry-level data scientists\nYou\xe2\x80\x99ll be encouraged and supported to take ownership of your projects and collaborate with a dynamic team to think entrepreneurially and leverage new opportunities and problems where machine learning and computational techniques can be applied to improve our sales, marketing, and business results\nBuild and deploy your models to generate immediate business value and revenue in virtually unlimited areas\xe2\x80\x94including digital platforms, online product recommender systems, AI-enabled sales, demand signaling, product development, market research, customer identification, search engine marketing, digital advertising, customer experience\xe2\x80\x94and continuously improve and optimize\n\n\nWhat You Need For This Position\nBachelors or Master's degree in economics, data science, data analytics, computer science, statistics, mathematics, natural sciences or other relevant field\nSolid foundation in statistics\nKnowledge of data analytics, data visualizations, data mining, predictive modeling, machine learning, or other data intensive analytical role\nExperience with open source programming languages like Python and Julia\n\n\nCulture\nNatural curiosity\xe2\x80\x94you enjoy digging deeper to find the big picture\nEagerness and desire to learn\nEnthusiasm about helping others, especially team members\nAlways be the person who takes on any project\nFlexibility in dynamic environments\n\n\nFor positions requiring access to technical data, Analog Devices, Inc. may have to obtain export licensing approval from the U.S. Department of Commerce - Bureau of Industry and Security and/or the U.S. Department of State - Directorate of Defense Trade Controls. As such, applicants for this position \xe2\x80\x93 except US Citizens, US Permanent Residents, and protected individuals as defined by 8 U.S.C. 1324b(a)(3) \xe2\x80\x93 may have to go through an export licensing review process.\n\nAnalog Devices, Inc. is an Equal Opportunity Employer Minorities/Females/Vet/Disability\n\nEEO Is The Law\n\nEducation Level: Bachelor's Degree\nTravel Required: No"""
b'Senior Data Scientist',b'Tripadvisor',"b'Needham, MA, US'","b'We are looking for an exceptional data-driven individual to join our Yield Management group. The successful candidate will report to Director of Yield Management in the Hotels organization and will be responsible for optimizing existing monetization strategies and identifying new revenue growth opportunities. Located in our Needham HQ office, this role will be focused on driving the analysis of user behavior on our site and coming up with new models and algorithms to grow our revenue. This is a tremendous chance to make largest travel site in the world even better, while enjoying the energy and rapid pace of a startup. This role requires very strong emphasis on data analysis and advanced analytics.\n\nKey Areas Of Responsibility\nPerform data analysis to support key decision making to evaluate opportunities for revenue optimization.\nOversee full lifecycle of analytical model development to optimize traffic monetization\nDevelop predictive models for user engagement and buying behavior.\nIdentify opportunities for revenue growth via user segmentation and personalized recommendations.\nMentor junior team members\nPartner with Product Management and Engineering to create product requirements and specification documents for new features and products\n\n\nWhat We Seek\nA results-oriented person who thrives on data and measurements.\nAbility to derive practical solutions to business problems from not-always-perfect data of formidable size.\nProven track record of translating business needs into data-driven solutions.\nDemonstrated ability of communicating complex analytical issues to technical and business audiences\nProficiency in data transformation, cleansing and interpretation.\nExpert SQL skills and experience with Big Data stack (Hadoop/Hive/Pig/Spark/etc.).\nMasters/Ph.D. in quantitative field.\n2+ years of experience is required\nProficiency with statistical programming environment (e.g. R, Python).\nAbility to work well with colleagues across multiple global offices.\nSignificant experience with eCommerce, recommender systems, user choice models, classification, online auctions, A/B testing, digital advertising, or marketing analytics is strongly preferred'"
b'Data Scientist Intern',"b'FocusKPI, Inc.'","b'Boston, MA, US'","b""FocusKPI is looking for a data scientist intern to join us in our talent database project. This is a hands-on internship with training support. If you're seeking an internship that may turn into a full-time job, this is a great fit for you!\n\nDue to the current situation, you need to work remotely for the following weeks. You may work on-site after that or keep working at home. Our team is located in Boston, MA.\n\nResponsibilities\nCollaborate with project managers to comprehend and translate business requirements into technical solutions.\nCollaborate with other engineers in an Agile environment to launch new features and iterate on existing ones.\nProvide knowledge and skills in machine learning, statistical analysis, and varied data sets.\n\nQualifications\nDegree in Statistics, Mathematics, Computer Science, Information Systems, Business Analytics, or related field.\nExperience with data science techniques including machine learning / predictive modeling/data visualization/statistical and mathematical analyses is a plus.\nStrong knowledge of SQL/NoSQL databases, Python, R, PHP.\nStrong communication skills.\n\nThank you for applying!\n\nFocusKPI Hiring Team\n\nAbout FocusKPI\n\nFocusKPI Inc. is an analytics consulting business providing solutions such as CRM customization, Risk Management, Business Intelligence, Advanced/Operational/Web/Digital Analytics as well as Human Resources for our clients.\n\nwYnXoHw8L8"""
b'Data Scientist - Personalization',b'Spotify',"b'Boston, MA, US'","b'The Personalization team makes deciding what to play next easier and more enjoyable for every listener. From Daily Mix to Discover Weekly, we\xe2\x80\x99re behind some of Spotify\xe2\x80\x99s most-loved features. We built them by understanding the world of music and podcasts better than anyone else. Join us and you\xe2\x80\x99ll keep millions of users listening by making great recommendations to each and every one of them.\n\nEveryday, hundreds of millions of people all over the world use the products we build which include destinations like \xe2\x80\x9cHome\xe2\x80\x9d and \xe2\x80\x9cSearch\xe2\x80\x9d as well as original playlists such as ""Discover Weekly"" and \xe2\x80\x9cDaily Mix.\xe2\x80\x9d We\'re a team of technologists, product insight experts, designers, and product managers in Boston, New York, Stockholm, and London.\n\nWe are seeking a Data Scientist to join our Product Insights team, focusing on Personalization. We have several roles open across different levels of seniority.\n\nYou will be solving complex data problems and delivering the insight that helps to define our understanding of music, audio and our listeners to develop how we personalize at Spotify. This role works closely with a multidisciplinary team of data scientist, user researchers, data engineers, product teams and designers.\n\nYour work will impact the way the world experiences music and audio!\n\nWhat You\xe2\x80\x99ll Do\nDevelop research questions and undertake data exploration to understand who our listeners are, how they get value out of Spotify, and where we can develop our product to bring greater value\nWork closely with the team including data engineering to build lasting solutions to our data modeling\nDesign, analyze, and interpret the results of experiments\nPerform exploratory analyses to understand the performance of our machine learning systems\nDefine, evaluate, dashboard and monitor key metrics, understanding root causes of changes\nContribute to the development of the Product Insights function and the wider analytics community at Spotify\nMentor and coach other data scientists\nWork from our office in Boston\n\nWho You Are\nYou have a minimum of 3 to 5 years applied experience with a degree or higher in economics, psychology, computer science, statistics, or mathematics or another quantitative discipline\nTechnical competence to perform advanced analytics:\nCoding skills (such as R, Python, or Scala)\nExperience with analytics & visualization tools (SQL, Tableau, ggplot/matplotlib or equivalent)\nExperience performing analysis with large datasets\nYou have strong statistical understanding of online testing methodologies and metric development\nYou are an independent thinker, able to work autonomously, capable of taking on loosely defined problems and translating complex thinking into practical application for diverse audiences\nYou are a communicative person who values building strong relationships with colleagues and partners and enjoys mentoring and teaching others\n\nYou are welcome at Spotify for who you are, no matter where you come from, what you look like, or what\xe2\x80\x99s playing in your headphones. Our platform is for everyone, and so is our workplace. The more voices we have represented and amplified in our business, the more we will all thrive, contribute, and be brilliant. So bring us your personal experience, your perspectives, and your background. It\'s in our differences that we will find the power to keep revolutionizing the way the world listens.\n\nSpotify transformed music listening forever when we launched in 2008. Our mission is to unlock the potential of human creativity by giving a million creative artists the opportunity to live off their art and billions of fans the opportunity to enjoy and be inspired by these creators. Everything we do is driven by our love for music and podcasting. Today, we are the world\xe2\x80\x99s most popular audio streaming subscription service with a community of more than 271 million users.\n\n,.'"
