title,company,location,job description
b'Data Scientist',b'Datadog',"b'New York City, NY, US'","b""About Datadog\n\nWe're on a mission to build the best platform in the world for engineers to understand and scale their systems, applications, and teams. We operate at high scale\xe2\x80\x94trillions of data points per day\xe2\x80\x94providing always-on alerting, metrics visualization, logs, and application tracing for tens of thousands of companies. Our engineering culture values pragmatism, honesty, and simplicity to solve hard problems the right way.\n\nThe Opportunity\n\nYou will have a fantastic team of data engineers to support you, a collaborative environment to encourage your work, and the best technologies for performing data science at high scale in your toolkit.\n\nYou Will\nPresent the latest academic research papers to your team.\nResearch and benchmark the latest algorithms that can be used for our particular use-cases.\nApply machine learning algorithms and statistical techniques to build new product features.\nDeploy a new feature to production, instantly affecting customers with your work.\nMentor other data scientists on your team.\nExplore and find meaning in extremely high volumes of data.\nInvestigate and fix a production issue from a service your team owns.\n\n\nRequirements\nYou have 2 + years professional experience\nYou are fluent with SQL / relational algebra.\nYou have mastered working with data in a language such as Python, R, or Julia.\nYou\xe2\x80\x99ve done data science at high scale with tools like Hadoop and Spark.\nYou have backend programming experience in one or more languages.\nYou have significant experience applying machine learning to real business problems.\nYou want to work in a fast, high-growth startup environment and thrive on autonomy.\nYou care about code simplicity and performance.\nYou have a BS/MS/PhD in a scientific field or equivalent experience.\nYou can explain complex ideas and algorithms in understandable ways.\n\n\nBonus Points\nYou\xe2\x80\x99ve written production data pipelines.\nYou\xe2\x80\x99re familiar with time series analysis."""
b'Data Scientist',b'Madison Logic',"b'New York, New York'","b""Madison Logic is an industry-leading, rapidly growing MarTech company in B2B lead generation space. We are launching a new Data Science team to contribute to the evolution of the business and discover new insights in this rapidly changing field. Reporting to the head of Engineering, this will be the first hire so you will be instrumental in defining and building the function. You must be a data and strategy focused individual with the ability to apply machine learning and artificial intelligence to real business challenges. If the idea of defining the data science function appeals to you, then you will love growing with us!\n\nWhat You'll Do: \nAct as a hands-on Data Scientist by tackling a rich set of tangible problems that have measurable business impacts\nParticipate in brainstorming sessions\nApply your math, optimization, machine learning and AI skills to solve business challenges\nPartner with internal stakeholders to assess and provide data analysis & strategy recommendations for business questions\nKeep up to date on trends, tools and research\n\nWhat You Have:\nPhD and 1+ yrs of experience or Master's in Data Science and 3+ years of experience required\nExperience with Python or R (bonus points for both)\nWorking knowledge of Regression Analysis, model testing, logistic regression, GLM\nSound knowledge of statistic & random variables\nKnowledge of one or more of: GBM, K-means, Neural Networks, SVMs, Bayesian Networks, NLP etc\nKnowledge of one or more frameworks: Tensorflow; Scikit; Pytorch; Keras, etc\nKnowledge of SQL\n\nYour Rewards For Greatness!\n\nOpportunities for Advancement \xe2\x80\x93 As We Grow, You Grow!\nCompetitive Benefits including Medical, Dental, Vision, FSA plans, 401k with Company Match and employer-paid life insurance\nPaid Time Off including 10 paid Holidays, Vacation, Sick Time, Summer Friday Program, and Family Leave\nDevelopment Opportunities including Global Mobility Program & Education Reimbursement\nCompany Outings, Charity Events, Sponsored Healthy Hours & Happy Hours\nCompany sponsored lunches on Wednesdays and breakfasts on Friday\nDiscounted Gym Memberships and other wellness initiatives\nAn innovative, energetic culture with great people to work with!"""
b'Data Scientist - Healthcare',b'W2O Group',"b'Florham Park, New Jersey, United States'","b'Real World Data, Healthcare Data Scientist\n\nResponsibilities\nConduct discussions with clients and internal stakeholders to understand business problems and use cases then formulate focused solutions\nExtract and integrate results across disparate datasets\nAugment internal data with third party sources of information when needed\nIndependently conduct analyses with a hands-on, detail-oriented approach\nLead and conduct Real World Evidence analyses which may include, but not limited to:\nLongitudinal retrospective studies of existing databases to assess patient characteristics, treatment patterns, and associated clinical, economic and/or patient-reported outcomes\nRetrospective or prospective evaluations of disease treatment patterns, outcomes including drug utilization and adherence;\nCross-sectional analyses of patients, caregivers, health care providers/practitioners, and/or payers;\nAssessments exploring the burden of illness, patient preference and/or comparative effectiveness;\nModels of cost-effectiveness; indirect treatment comparison models and methodologies\nData modeling using advanced methods in Machine Learning, Predictive Modeling\nSocialize key insights through objective story-telling that brings meaningful and actionable context to drive more data-informed decision making\n\nQualifications\nMaster\xe2\x80\x99s/Bachelor\xe2\x80\x99s Degree in Analytics/Data Science/Statistics/Mathematics/Engineering/ Computer Science or related\n5+ years of Analytics/modeling experience working with large, complex, and disparate datasets\n3+ years of experience in a Healthcare organization such as Provider, Payer, and Pharmaceutical\nKnowledge of Healthcare Real World Data including but not limited to Electronic Health Records, Medical and Pharmacy Claims, Pricing, Affiliation, and Formulary. Understanding of care and claims upstream processes.\nExpert in complex data extraction using SQL\nData management and Predictive modeling/Machine learning using Python/R/SAS\nUnderstanding of machine learning techniques and algorithms, such as GLM Models, Regularization, KNN, Naive Bayes, SVM, Decision Trees, Random Forest, etc.\nExperience with at least one business intelligence/visualization tool such as Tableau, Domo\nAnalytic problem-solving skills with a creative and innovative outlook\nExcellent communication (written and oral) including describing complex data topics in simple terms\nExceptional organizational, strategic thinking and problem-solving skills\nCompetency with Microsoft Office, particularly PowerPoint, Excel and Word\nAbility to work well in a matrix driven organization\nBackground in epidemiology or biostatistics experience preferred but not required'"
b'Data Scientist',b'Northwell Health',"b'New Hyde Park, NY, US'","b'Responsibilities\n\nJob Description\n\n\n\n\n\n\n\n\n\n\n\n\n\n\n\n\n\n\n\n\nWorks collaboratively to design, implement and maintain data science models and applications.\nWorks on programs to apply data science methodologies, including predictive modeling and machine learning, data analytics and visualization, and usability and design, to departmental, service line, and enterprise applications and functions.\nSynthesizes complex data-related problems into actionable business and/or clinical strategy, and communicate findings to appropriate end-users and stakeholders.\nAssists with the development of specifications to support the design of new or modified data science projects, with a focus on data-driven optimization, enhancement, and development.\nAssists in the evaluation of projects, systems, and initiatives at the department, service line, and enterprise level. Ensures projects and their outputs enhance clinical quality, patient safety, and institutional efficiency, focusing on all aspects of data science, including data gathering and wrangling, exploratory data analysis, data modeling and machine learning, and model implementation and evaluation. Ensures high quality execution of all proposed projects.\nKnowledgeable in present and planned data science projects and maintains voice of the customer in all project initiatives.\nServes as the link between the clinical staff (customer) requirements and IS capabilities.\nAssists in ensuring that systems are implemented to support Health System initiatives and goals to improve the quality of patient care, to maximize patient safety, and to provide operational efficiencies.\nServes as a resource to the Director of Quality Informatics and Program Director of Data Science.\nDemonstrates familiarity with current hospital information systems.\nPerforms other duties as assigned.\nADA Essential Functions\n\nQualifications\n\nREQUIRED EXPERIENCE AND QUALIFICATIONS\nBachelor\xe2\x80\x99s Degree in Computer Science, Informatics, Statistics, Engineering, Data Science, or related field, required. Master\xe2\x80\x99s Degree, preferred.\nMinimum of two (2) years of post-graduate training or experience involving quantitative data analysis, required and working with clinical data, data science, and machine learning, preferred.\nWorking familiarity with basic medical and health information technology concepts, including standardized terminologies and ontologies and electronic health records, as well as Data Warehousing and Business Intelligence tools, required.\nExpertise in working with SQL relational databases and statistical or general programming languages (e.g., Python, R), required.\nDeep understanding of statistical and predictive modeling concepts, machine-learning approaches, clustering and classification techniques, and recommendation and optimization algorithms.\nStrong interpersonal skills, capable of working collaboratively with clinicians and administrators.'"
b'Data Analyst',b'MailOnline',"b'New York, New York'","b'Overview: Data Analyst is an integral member of the global commercial data and analytics team driving commercial insights and opportunities for the world\xe2\x80\x99s largest English language newspaper website, DailyMail.com. This is a unique opportunity to work in a fast-paced entrepreneurial environment, with wide exposure to ad-tech and big data platforms. The Data Analyst will be responsible for maintaining and optimizing the global commercial data systems, identifying methods to maximize commercial performance and providing business insights to internal stakeholders. This individual will have a genuine passion for digital media and data technology.\nDailyMail.com is a division of UK-based DMGT, an international portfolio of digital, information, media and events businesses, which employs over 12,000 people and is listed on the London Stock Exchange (LSE:DMGT.L).\nSpecific Responsibilities\n\xc2\xb7         Participate in cross-functional projects using advanced data modeling and analysis techniques to discover insights that will guide strategic decisions and uncover optimization opportunities.\n\xc2\xb7         Develop and maintain big data infrastructure, reporting systems and data models that support key business decisions.\n\xc2\xb7         Develop and maintain data visualization dashboards to allow data access to necessary stakeholders.\n\xc2\xb7         Evaluate the configuration and performance of commercial practices against key indicators.\n\xc2\xb7         Continuously monitor yield across platforms and offer innovative recommendations to internal teams to boost performance and generate new revenue.\n\xc2\xb7         Work cross-functionally with teams including Operations, Sales, Marketing, Finance and Analytics to provide excellent customer service in support of DailyMail.com clients and revenue goals.\nExperience and Skills\nRequired:\n\xc2\xb7         B.A. or B.S. in a quantitative or technical field (e.g., math, engineering, statistics, computer science).\n\xc2\xb7         High proficiency in Excel, SQL, Python\n\xc2\xb7         Possess quantitative skills with a creative problem-solving mindset.\n\xc2\xb7         Ability to work collaboratively in a team environment.\n\xc2\xb7         Strong project management skills and ability to meet deadlines.\n  Preferred:\n\xc2\xb7         Digital media and ad-tech experience is a plus\n\xc2\xb7         Familiarity with R, Scala, Spark, Airflow\n\xc2\xb7         Google Cloud (Storage, BigQuery, Compute Engine, Kubernetes Engine)'"
b'Data Scientist',b'CNN',b'New York City Metropolitan Area',"b""WarnerMedia is a leading media and entertainment company that creates and distributes premium and popular content from a diverse array of talented storytellers and journalists to global audiences through its consumer brands including: HBO, HBO Now, HBO Max, Warner Bros., TNT, TBS, truTV, CNN, DC Entertainment, New Line, Cartoon Network, Adult Swim, Turner Classic Movies and others.\nThis is our story\nWe are the now and the next. The power behind the people building the future. We are born from the spirit of innovation. We are created from the idea that people around the world want more, need more, deserve more. We are the home of the global digital revolution. We are CNN.\n\nSee what it\xe2\x80\x99s like to work at CNN! Follow us on Instagram, Twitter and Facebook.\n\nThe Team\nWhen you work for CNN Worldwide, your work shapes news and information platforms that reach more than 2 billion people in every time zone on the planet. Your colleagues include award-winning, top-of-the-line talent committed to telling the world's stories with immediacy and accuracy. At CNN Worldwide, you're at the forefront of the global news business. To see what we are all about, go to www.cnn.com\n\nThe Job\nCNN is looking for a Data Scientist to join a growing team.\n\nThe Daily\nYou are passionate about deriving insights from exploratory data analysis and storytelling from visualizing big data sets to further our understanding of CNN's audience and their content consumption patterns.\nYou have some experience in marketing analytics, media, ad tech, ecommerce or retail industry where you built models and key KPIs for user segmentation and preferably contextual ad targeting.\nAt a minimum, you have independently worked on or were involved in a full product life-cycle.\nYou can communicate complex ideas in a clear way to technical and nontechnical stakeholders across the company.\nAdditionally, you understand the constraints of working with a growing team and thrive in an environment that is fast-paced and sometimes scrappy.\nFinally, you are business focused and proactively thinking about new projects that could have a high impact result for the company.\nIf this sounds like you, please apply!\n\nWe value: \xe2\x97\x8f Team player \xe2\x97\x8f Problem solver \xe2\x97\x8f Radical candor \xe2\x97\x8f Statistical rigor \xe2\x97\x8f Humility Requirements:\n\n\nThe Essentials\nMS or PhD equivalent in a quantitative science (e.g. data science, natural language processing, mathematics, statistics, computer science) is preferred\n2+ years of industry experience working on data-related initiatives.\nGood grasp of statistical concepts (e.g. hypothesis testing, regression)\nProficiency manipulating data with Python.\nProficiency with SQL and working with large data sets.\nProficiency with data visualization tools and packages\nWorks independently, able to manage multiple projects simultaneously\nDeep curiosity and a demonstrated ability to craft original solutions\nHighly communicative with collaborators and manager\nProactive in seeking opportunities for innovation\nExperience in applying machine learning, predictive analytics and classification techniques towards real product and problems\nPluses:\nPrior experience working with product managers and engineers in a full product life-cycle: discovery, development and deployment\nBackground in machine learning and/or statistics\nExperience with display ads, ecommerce, marketing analytics or media is a plus.\n\nThe Perks\nPaid time off every year to volunteer\nAccess to well-being tools, resources, and freebies\n2018 Best Company for Working Mothers\n2018 Best Company for Dads\nAn in-house learning and development team to help shape and grow your career\nPart of the WarnerMedia family of powerhouse brands"""
"b'Data Scientist, Podcasts'",b'Spotify',"b'New York City, NY, US'","b""Spotify\xe2\x80\x99s goal is to become the world\xe2\x80\x99s leading audio platform, and the Studios organization drives the strategy to acquire and build compelling podcast content to achieve this ambition. The Studios Analytics team partners with the organization to power decision making through high quality datasets and dashboards, business planning frameworks, and forecast models.\n\nWe are looking for a Data Scientist to help us execute Spotify\xe2\x80\x99s podcast strategy. You will define success measures, track performance, and rapidly learn and iterate so that we can deliver content that delights our users. You will use sophisticated techniques on datasets to build meaningful business insights and recommendations.\n\nA successful candidate should love podcasts and solving problems by diving into data to build awesome dashboards for automating regular reporting processes. You should have a strong sense of design and a keen understanding of which metrics matter and which don\xe2\x80\x99t, and possess strong communication skills to interface between technical and content business teams.\n\nWhat You'll Do\nPerform analysis on large sets of data to extract measurable insights that will drive decisions, with a particular focus on podcasts.\nAnalyze podcast data to determine trends, and output reports with clear recommendations.\nDefine KPI\xe2\x80\x99s and success metrics, build and analyze dashboards (Tableau), reports and key datasets to empower data-informed development.\nCommunicate recommendations to non-technical audiences, through clear visualizations and presentations.\nPresent data in a format that is immediately useful to answer questions about the inputs and outputs of Forecasting to better understand the value and impact of content initiatives.\nDevelop an understanding of the podcast content landscape.\n\nWho You Are\nPassionate about podcasts and content in general. Previous experience in podcasts is a strong preference. Other media, entertainment or technology experience is also highly valued.\nNatural communicator, who focuses just as much on the delivery and the \xe2\x80\x9cso what\xe2\x80\x9d of your insights, as you do on the technical craft of extracting them.\n4 years of relevant applied experience with a Bachelor\xe2\x80\x99s Degree or higher in economics, computer science, statistics, mathematics, or a related field.\nTechnical competence to perform advanced analytics: coding skills such as Python, experience with analytics tools, SQL,Pandas, R, SPSS and experience performing analysis with large datasets.\nWork with data visualization tools and build data visualization concepts, preference for Tableau, or similar.\nExperience creating and scheduling datasets is highly valued. Knowledge of Google\xe2\x80\x99s BigQuery or Java/Scala is a plus.\nExperience reviewing insights and intelligence to provide recommendations to partners.\nDeep understanding of statistics and experience working with real-world data, as well as a strong business senseExcellent written and verbal communication skills.\nExcellent problem solving skills with a strong attention to detail.\n\nYou are welcome at Spotify for who you are, no matter where you come from, what you look like, or what\xe2\x80\x99s playing in your headphones. Our platform is for everyone, and so is our workplace. The more voices we have represented and amplified in our business, the more we will all thrive, contribute, and be brilliant. So bring us your personal experience, your perspectives, and your background. It's in our differences that we will find the power to keep revolutionizing the way the world listens.\n\nSpotify transformed music listening forever when we launched in 2008. Our mission is to unlock the potential of human creativity by giving a million creative artists the opportunity to live off their art and billions of fans the opportunity to enjoy and be inspired by these creators. Everything we do is driven by our love for music and podcasting. Today, we are the world\xe2\x80\x99s most popular audio streaming subscription service with a community of more than 271 million users."""
b'Data Scientist',b'Johnson & Johnson',"b'Raritan, NJ, US'","b""Janssen Pharmaceuticals, Inc., a member of Johnson & Johnson's Family of Companies, is recruiting for a Data Scientist to support our Commercial Insights & Innovation team within Janssen Data Sciences.\n\nAt the Janssen Pharmaceutical Companies of Johnson & Johnson, what matters most is helping people live full and healthy lives. We focus on treating, curing and preventing some of the most devastating and complex diseases of our time. And we pursue the most promising science, wherever it might be found.\n\nThe Data Science team within Janssen is looking for an outstanding Scientist who is passionate about crafting, developing, and fielding data mining solutions that have direct impact to patients and Janssen. There are many ways to explore and analyze data, and this drives the excitement and passion of data scientists at Janssen as many business units are eager to use the data to build business value.\n\nIn this role you will stay on the cutting edge of data mining research by doing novel research and developing algorithms to influence decisions at various levels in the organization, including but not limited to patient/payer analytics, commercial strategy, and patient support program analytics. The role requires both a broad knowledge of existing data mining algorithms and the creativity to invent and customize when necessary. You will be part of a dynamic, accomplished informatics team that will support multiple therapeutic areas.\n\nQualifications\n\nRequired Qualifications\nM.S. with 2 years of experience, or Ph.D degree, in Computer Sciences, Statistics, Machine Learning & Artificial Intelligence, Physics, Molecular Biology, Bioinformatics, Computational Informatics, Medical Informatics, Computational Biology or a related discipline.\nStrong working knowledge of data mining algorithms including machine learning techniques such as regression, decision trees, probability networks, association rules, clustering, neural networks, Bayesian models.\nFamiliarity with large datasets, handling of healthcare relevant datasets and understanding of data analysis workflows.\nProficient with one or more programming language such as R, Python, SAS or Java.\nExperience delivering on data science projects using predictive technologies, data mining and/or text mining.\n\nPreferred Qualifications\nDeep understanding of R&D and commercial deployment process.\n\n#JNJDataScience\n\nPrimary Location\nUnited States-New Jersey-Titusville-\nOther Locations\nNorth America-United States-New Jersey-Raritan, North America-United States-Pennsylvania-Spring House\nOrganization\nJohnson & Johnson Services Inc. (6090)\nJob Function\nR&D\nRequisition ID\n1316200318"""
