title,company,location,job description
b'Machine Learning Engineer',b'Toyota Research Institute',"b'Los Altos, California'","b""At Toyota Research Institute (TRI), we\xe2\x80\x99re working to build a future where everyone has the freedom to move, engage, and explore with a focus on reducing vehicle collisions, injuries, and fatalities. Join us in our mission to improve the quality of human life through advances in artificial intelligence, automated driving, robotics, and materials science. We\xe2\x80\x99re dedicated to building a world of \xe2\x80\x9cmobility for all\xe2\x80\x9d where everyone, regardless of age or ability, can live in harmony with technology to enjoy a better life. Through innovations in AI, we\xe2\x80\x99ll\xe2\x80\xa6\n\n- Develop vehicles incapable of causing a crash, regardless of the actions of the driver.\n- Develop technology for vehicles and robots to help people enjoy new levels of independence, access, and mobility.\n- Bring advanced mobility technology to market faster.\n- Discover new materials that will make batteries and hydrogen fuel cells smaller, lighter, less expensive and more powerful.\n\nOur work is guided by a dedication to safety \xe2\x80\x93 in how we research, develop, and validate the performance of vehicle technology to benefit society. As a subsidiary of Toyota, TRI is fueled by a diverse and inclusive community of people who carry invaluable leadership, experience, and ideas from industry-leading companies. Over half of our technical team carries PhD degrees. We\xe2\x80\x99re continually searching for the world\xe2\x80\x99s best talent \xe2\x80\x92 people who are ready to define the new world of mobility with us!\n\nWe strive to build a company that helps our people thrive, achieve work-life balance, and bring their best selves to work. At TRI, you will have the opportunity to enjoy the best of both worlds \xe2\x80\x92 a fun start-up environment with brilliant people who enjoy solving tough problems and the financial backing to successfully achieve our goals. Come work with TRI if you\xe2\x80\x99re interested in transforming mobility through designing safer cars, enabling the elderly to age in place, or designing alternative fuel sources. Start your impossible with us.\n\nOur Machine Learning (ML) team is looking for world-class research scientists and engineers to turn Toyota's data advantage into an AI advantage. As the #1 car maker in the world with 100 million cars on the road today, we can learn from massive amounts of data to realize safe automated driving on a global scale. Our team's mission is to use all the data to identify and solve open research problems on the critical path to automated driving. We are working on some of the hardest challenges in the area of perception (e.g., scene understanding, 3D vision, tracking), prediction (e.g., handling uncertainty, predicting human behavior, trajectory forecasting), planning (e.g., understanding and reacting to human intent, multi-agent modeling), and general machine learning (e.g., self-supervised learning, imitation learning, active learning, multi-task learning, domain adaptation, robustness to the heavy tail of edge cases, efficient deep learning, large scale distributed training). We invent new Deep Learning algorithms that can leverage massive amounts of data (labeled or not), experimentally showing state-of-the-art performance (both in internal benchmarks and public ones, publishing at top Machine Learning and Computer Vision conferences and collaborating with our university partners). We work closely with other teams at TRI to transfer and ship our most successful algorithms and models towards world-scale long-term autonomy.\n\nAs a Machine Learning Engineer, you will contribute to state-of-the-art machine learning infrastructure and relevant software (e.g. distributed training, continuous model integration, data management, and evaluation at unparalleled scale). You will implement cutting-edge deep learning models accelerating model training time, improving performance, and tackling open problems together with research scientists. Last but not least, you will deploy your algorithms and models in our self-driving test vehicles and beyond. Responsibilities and required qualifications are as follows:\n\n\nResponsibilities:\n\nBuild machine learning models using deep learning techniques for computer vision tasks such as semantic segmentation, object detection, video understanding, etc.\nAddress large scale challenges in the machine learning development cycle, especially around distributed training in the cloud and data engineering.\nManipulate high-volume, high-dimensionality, structured data from driving logs for training and testing deep networks.\nProduce high quality tested code that enables large scale research and can be transferred to physical robots deployed in the real world.\nStay up to date on the state-of-the-art in Deep Learning ideas and software, in collaboration with our Research Scientists.\nWork in a multidisciplinary team and collaborate with other teams across the company.\nPresent results in verbal and written communications, including potentially at top international conferences.\n\nQualifications:\n\nBachelor's Degree in Computer Science, Math, Physics or related field.\nProficient in Python and Unix is a minimum. Additional knowledge of C++ / CUDA is a plus, experience with AWS as well.\nGood software engineering skills, grounded in principled best practices.\nClear grasp on basic Linear Algebra, Optimization, Statistics, and Algorithms.\nDeep Learning and Computer Vision expertise not required - but recommended. Familiarity with PyTorch or other deep learning frameworks is a bonus.\nYou are passionate about ML, both large scale engineering and research challenges, especially in the space of Automated Driving.\nYou are a reliable team-player. You like to think big and go deeper. You care about openness and delivering with integrity."""
b'Machine Learning Engineer (NLP)',b'Ginger',"b'San Francisco, CA, US'","b""Job Description\n\nAt Ginger, we aim to provide better mental health care to humanity at a scale larger than has ever been possible before. This is no small task and as an expanding team we are working on a number of initiatives to achieve this, including aggressively building tools to simultaneously grow our reach and improve quality of care.\n\nWhat You'll Do\n\nAs a core part of a close-knit data science team you\xe2\x80\x99ll:\nDesign, train and validate algorithms to derive as much actionable information from our data (text, media, activity etc) as possible.\nEngineer informative NLP features that allow us to summarize salient passages, infer quality of care, etc.\nDevelop and deploy algorithms that boost coach and clinician awareness of member goals, status, history and probable future conditions\nWrite new algorithms to recommend specific personalized health-promoting content (e.g. modules in the app) based on a range of features\nIntegrate streaming activity and sleep data directly from the phone or via services to expand our capacity to provide meaningful insight and care.\nCollaborate with engineers to integrate algorithms efficiently with backend production services\nWork with product team to define solutions and integrate them into the roadmap\nHelp us scale our services using GPUs and modern distributed processing tools in the cloud (AWS)\nDig into data with ad hoc analysis as necessary for technical, clinical, customer etc needs\nImprove and help define the data team\xe2\x80\x99s processes and tooling\nSee that we remain at the bleeding edge of advanced analytical capability in our effort to provide unparalleled levels of personalized care.\nEmploy data to keep our eyes on the prize: improved mental-health outcomes for all members.\n\n\nNecessary Skills\nMachine Learning 2+ years\nData Science 1+ years\nPython 2+ years\nNatural Language Processing (NLP) 1+ years\nFoundation in statistics\nMathematically fluent\nMasters in technical field or experiential equivalent\n\n\nPreferred Skills\nModern NLP tools such as spaCy, CoreNLP, Gensim, NLTK 1+ years\nDeep net ML development experience using PyTorch, TensorFlow, etc.\nDistributed ML via Spark or similar\nML on GPUs\nDeploying to production systems with active customers\nPython 4+ years\nNumpy/Scipy/Pandas 2+ years\nDeep learning for text understanding and generation\nAmazon Web Services (AWS) 1+ years\nDocker\nAWS Lambda, Sagemaker\nStrong on Stats\nStrong data visualization skills\nTime Series Analysis\nExperience in the healthcare space\n\n\nWho We Are\n\nAt Ginger, it\xe2\x80\x99s our mission to create a world where everyone has the support they need to improve their mental well-being and live happier healthier lives.\n\nEvery Ginger user is connected to a behavioral health coach who responds via text, within minutes. Coaches provide personalized, proven, coping strategies and help individuals set and achieve goals. Our licensed therapists and board-certified psychiatrists provide clinical care and medication management over video sessions, ensuring easy access and measurable progress.\n\nPinterest, Buzzfeed and numerous other companies trust Ginger to provide mental health benefits to their employees. Fast Company called Ginger one of The World\xe2\x80\x99s Top 10 Most Innovative Companies in Healthcare, and the World Economic Forum named us a Technology Pioneer.\n\nWe are a mission-driven team that offers competitive compensation. We believe individuals that bring different perspectives to challenges are more innovative, collaborative, and create better solutions. To that end, we're striving to build a workplace that actively embraces diverse people, ideas, talents and experiences."""
b'Machine Learning Scientist',b'Moffett.AI',"b'Los Altos, California, United States'","b'Machine Learning Scientist\n\nJob description:\nIn this role, you\xe2\x80\x99ll conduct research and development on state-of-the-art algorithm-hardware codesigned solutions including but not limited to model compression, efficient network architectures, knowledge distillation and field applications. Some of the job duties include:\nUnderstand and improve upon state-of-the-art model compression algorithms in terms of inference efficiency, accuracy, and simplicity of the compression process.\nConduct experiments of compression algorithms on a variety of efficient network structures to develop model zoos and scientific insights.\nCollaborates with ML Framework Engineers to develop software toolchains.\nFollow up research trends in fields related to ML.\n\nJob requirement:\nMaster/PhD degree in CS/EE/Math or equivalent\n3+ year experience of R&D in Machine Learning related fields with familiarity of ML frameworks such as Tensorflow/PyTorch/MxNet.\n5+ year experience of programming in python/C/C++.\nResearch publications on top ML conferences/journals such as CVPR/NIPS/ICML/ICLR/ICCV/ECCV/ACL/EMNLP/NAACL/KDD/AAAI/IJCAI/AISTATS are a strong plus.\nKnowledge in numerical linear algebra and numerical/discrete optimization are strong plus.\nExperience with CPUs, GPUs, computer architectures and accelerators are strong plus.\nStrong communication skills, leadership, and work ethics.'"
b'Senior Machine Learning Engineer',b'Pony.ai',"b'94538, Fremont, California, United States'","b'Pony.ai, a unicorn start-up, is in the forefront of autonomous ride-sharing technology. Our team is built upon years of experience in computer vision, robotics, strong software and hardware design. At Pony.ai, excellence is a core value of the company and every detail counts as we work to deliver a safe, reliable, and cost-effective autonomous driving platform to the public. As part of the team, you will play a critical role in developing and deploying state-of-the-art autonomous vehicle technology. You will have every opportunity to grow and develop as our company grows. Join us on this exciting journey as we bring the latest breakthroughs in artificial intelligence to the future of transportation.\nAs an ML/signal processing engineer you will contribute to the development of low-level algorithms for automotive 3D sensing applications, such as parameter detection, estimation, DSP processing optimization, etc. You have a strong background in Physics-based system-level modeling of 3D sensors, are familiar with the design of experiments (DOE), have a passion for test and evaluation of emerging automotive sensing technologies, and are able to work cross-functionally across hardware and software teams.\nMS or PhD in CS, EE, Physics, Photonics.\nFamiliar with 3D Sensors, preferably, lidar systems design & modeling, including but not limited to TOF, FMCW, and PMCW (phased-array processing and MIMO techniques is a plus).\nStrong background in algorithm design, digital signal processing/machine learning, particularly for detection and estimation. Computational complexity versus performance trade-off analysis for different families of algorithms and optimization for fixed-point implementation.\nIn-depth knowledge of statistical signal (time series) modeling and analysis, especially in regards to sensors and systems for opto-electronic sensing systems .\nStrong Python programming skills, C/C++ a plus.\nStrong team player, passionate about autonomous vehicles, independent, and driven personality.'"
b'Machine Learning Software Engineer',b'PayPal',"b'San Jose, CA, US'","b""Who We Are\n\nFueled by a fundamental belief that having access to financial services creates opportunity, PayPal (NASDAQ: PYPL) is committed to democratizing financial services and empowering people and businesses to join and thrive in the global economy. Our open digital payments platform gives PayPal\xe2\x80\x99s 286 million active account holders the confidence to connect and transact in new and powerful ways, whether they are online, on a mobile device, in an app, or in person. Through a combination of technological innovation and strategic partnerships, PayPal creates better ways to manage and move money, and offers choice and flexibility when sending payments, paying or getting paid. Available in more than 200 markets around the world, the PayPal platform, including Braintree, Venmo and Xoom, enables consumers and merchants to receive money in more than 100 currencies, withdraw funds in 56 currencies and hold balances in their PayPal accounts in 25 currencies.\n\nWhen applying for a job you are required to create an account, if you have already created account - click Sign In.\n\nCreating an account will allow you to follow the progress of your applications.\n\nNote\n\nProvide full legal first Name/Family Name\nDO: Capitalize first letter of First and Last Name. Example: John Smith\nDON'T: Capitalize entire First and/or Last Name. Example: JOHN SMITH\nNOTE: Use correct grammar for Names with multiple cases. Example: McDonald or O'Connell\n\nProvide full address details\n\nResume Is Required\n\nMultiple attachments can be uploaded including Resume and Cover Letter for each application\n\nJob Description Summary\n\nWe are looking for a talented and highly motivated senior engineer for a technical domain that comprises of customer data analytics and ML/DL models development to support different business use cases\n\nJob Description\nDiscovering, analyzing, structuring and mining data\nStatistical hypotheses validation and model performance analysis\nDeveloping neural network models supporting business use cases\nDesign and coordinate implementation of DL based solutions for production usage\nDeep understanding of data mining algorithms and statistical methods\nExperience in successfully applying machine learning to real-world problems\nStrong knowledge of Deep Learning frameworks: Keras, Tensorflow, PyTorch, etc\nKnowledge in python and packages for data analysis (scipy, numpy, pandas, matplotlib)\nProficient in one or more of programming languages Scala, Java, C++\nStrong knowledge of extracting and processing data with RDBMS/NoSQL\nExperience with one or more Container-ecosystem (Docker, Mesos, Kubernetes) will be a plus\nGood communication skills and team player attitude\nExperience in Natural Language Processing/Understanding using deep neural networks ( RNN (LSTM, GRU) / CNN) is a plus\nExperience in working with GPU, profiling/low-level optimizations, Cuda/CuDNN is a plus\nExperience with BigData ecosystem Hadoop, Hive, Spark/PySpark is a plus\n\nSubsidiary\n\nPayPal\n\nTravel Percent\n\n0\nPrimary Location:\nSan Jose, California, United States of America\nAdditional Locations:\n\nWe're a purpose-driven company whose beliefs are the foundation for how we conduct business every day. We hold ourselves to our One Team Behaviors which demand that we hold the highest ethical standards, to empower an open and diverse workplace, and strive to treat everyone who is touched by our business with dignity and respect. Our employees challenge the status quo, ask questions, and find solutions. We want to break down barriers to financial empowerment. Join us as we change the way the world defines financial freedom.\n\nPayPal provides equal employment opportunity (EEO) to all persons regardless of age, color, national origin, citizenship status, physical or mental disability, race, religion, creed, gender, sex, pregnancy, sexual orientation, gender identity and/or expression, genetic information, marital status, status with regard to public assistance, veteran status, or any other characteristic protected by federal, state or local law. In addition, PayPal will provide reasonable accommodations for qualified individuals with disabilities. If you are unable to submit an application because of incompatible assistive technology or a disability, please contact us at paypalglobaltalentacquisition@paypal.com .\n\nReference Number: R0051335"""
"b'Machine Learning Engineer, Homefeed'",b'Pinterest',"b'San Francisco, CA, US'","b""About Pinterest\n\nMillions of people across the world come to Pinterest to find new ideas every day. It\xe2\x80\x99s where they get inspiration, dream about new possibilities and plan for what matters most. Our mission is to help those people find their inspiration and create a life they love. As a Pinterest employee, you\xe2\x80\x99ll be challenged to take on work that upholds this mission and pushes Pinterest forward. You\xe2\x80\x99ll grow as a person and leader in your field, all the while helping users make their lives better in the positive corner of the internet.\n\nHomefeed is a discovery platform at Pinterest that helps users find and explore their interests. We work with some of the largest datasets in the world, tailoring over billions of unique content to 300M+ users. Our content ranges across all categories, from food and fashion to books, art and our dataset is rich with textual and visual content and has nice graph properties. Harnessing these signals at scale is a significant challenge. You'll have the opportunity to work on various machine learning and deep learning challenges, build the systems and machine learning models to improve user experience on Homefeed at scale.\n\nWhat You\xe2\x80\x99ll Do\nApply the latest advances in deep learning and machine learning to personalize Pinterest user's homefeeds.\nDevelop new features to improve our user and pin understanding in our models.\nImpact 300M+ users by developing the next generation of discovery technologies.\nWork in a fast-paced environment with a quick cadence of research, experimentation, and product launches.\n\n\nWhat We\xe2\x80\x99re Looking For\nA senior software engineer passionate about applied machine learning and deep learning\n8+ years experience applying machine learning methods in settings like recommender systems, search, user modeling, image recognition, graph representation learning, natural language processing."""
b'Machine Learning Engineer',b'Tempus Ex',"b'San Francisco, California, United States'","b""Our Mission\n\nWe are building 3D data models of sporting events in real-time via image recognition and ultra-wideband tracking. At Tempus Ex, we have unprecedented inside access to professional sports league's video, tracking data, and stadiums. Founded by industry-leading experts in sports analytics, our values include keeping technical debt low, striving for excellence, and learning and growing as engineers.\n\nOur Values\n\nWork hard, have fun, dream big: we want to change the way sports is consumed.\nBest idea wins: the team uses the best idea regardless of seniority.\nThirst for knowledge and improvement: never stop learning and finding better ways to solve problems.\nBe a self-aware team player: recognize your role in the team to achieve our goals and help others.\nTeams are organized according to scrum/agile principles: engineers are given a chance to focus on the task at hand without undue distraction.\nWeekly sprints: we make small, achievable goals and strive to complete them.\n\nHow You Can Help\n\nBuild out our ML data pipeline.\nStudy and transform data science prototypes.\nDesign machine learning systems.\nImplement working models based on published papers.\nResearch and implement appropriate ML algorithms and tools.\nRun machine learning tests and experiments.\nPerform statistical analysis and fine-tuning using test results.\nTrain and retrain systems when necessary.\nExtend existing ML libraries and frameworks.\nCoordinate a team image labelers.\n\nSkills\n\nYou are passionate about sports data.\nExperience with data science languages such as Python and R.\nDeep knowledge of math, probability, statistics and algorithms.\nFamiliarity with machine learning frameworks (like Keras or PyTorch) and libraries (like scikit-learn).\nAbility to take existing models and convert them to other frameworks, such as PyTorch to CoreML, Tensorflow, or ONNX.\nDeep knowledge of neural nets and when to use each, i.e. MLPs, CNNs, and RNNs.\nFamiliarity with cloud infrastructure providers such as AWS, Azure, or GCP.\nFamiliarity with video codes such as H.264 and HEVC (H.265).\n\nPerks\nGENEROUS VACATION: Unlimited PTO, mandatory 2-week minimum.\nWELLNESS: Wellness reimbursements up to $200 per month.\nTRAVEL: We work in sports stadiums around the country, and will sometimes travel to events.\nFLEXIBLE HOURS: Productivity is more important than working a certain set of hours.\nHEALTH INSURANCE: Full medical, dental, and vision.\n401(K) CONTRIBUTION: 401(k) plan with up to 4% matching.\nWORK FROM HOME: Engineers can WFH as necessary one day a week.\nWORKSHOPS/CONFERENCES: We will reimburse expenses for one technical conference each year.\nFREE FOOD: We will have lunch catered during some Scrum meetings.\n Tempus Ex Machina, Inc provides equal employment opportunities to all employees and applicants for employment without regard to race, color, religion, sex, national origin, age, disability, sexual orientation, gender identity or expression, veteran status, or genetics. In addition to federal law requirements, Tempus Ex Machina complies with applicable state and local laws governing nondiscrimination in employment in every location in which the company has facilities. This policy applies to all terms and conditions of employment, including recruiting, hiring, placement, promotion, termination, layoff, recall, transfer, leaves of absence, compensation and training. Pursuant to applicable laws, we will consider for employment qualified applicants with arrest and conviction records. And if you believe that you will need any type of accommodation, please let us know."""
