title,company,location,job description
b'Machine Learning Engineer',b'Saildrone Inc',"b'Alameda, CA, US'","b""About Saildrone\n\nSaildrone designs and manufactures wind and solar powered autonomous surface vehicles called Saildrones, which make cost-effective ocean data collection possible at scale.\n\nWe are building the world's largest high-resolution ocean datasets, working with governments and private companies around the globe. We believe that better inputs in planetary models in turn yield better outputs and that the new insights gained in weather forecasting, carbon cycling, global fishing and climate change will have tremendous impact on humanity.\n\nWe are based in Alameda, CA and are backed by Social Capital, The Capricorn Investment Group, Lux Capital and The Schmidt Family Foundation.\n\nAbout The Role\n\nSaildrone is searching for a Machine Learning Engineer to grow our machine learning team. As a data and robotics company, we have many opportunities for artificial intelligence to further our mission. You will be responsible for participating in all aspects of machine learning efforts at Saildrone, with an emphasis on bringing new capabilities to production readiness.\n\nResponsibilities\nImprove tooling and best practices for managing reproducible machine learning workflows\nCreate new ML systems to solve challenging problems in perception, robotics and ocean science\nDrive hardware requirements and develop software for running ML solutions on Saildrones in the field as well as in the cloud\n\n\nRequirements\nMS or Ph.D. in a quantitative field or equivalent work experience\nFour years of experience working with machine learning systems\nDeep understanding of statistics and machine learning algorithms, especially for computer vision\nStrong Python skills\nExperience with PyTorch and/or other deep learning frameworks\nExperience with reproducible workflows for machine learning\nExperience deploying ML models to production on embedded systems or in the cloud\nStrong C++ skills\nExperience developing ML services that run on Kubernetes with Docker and containers\n\n\nBenefits\nMedical, dental and vision plans for you and your dependents\nHealthy lunch program provided onsite\nActive sailing classes: become a certified skipper on boats up to 35ft!\nFun team activities including our famous monthly social taxiway BBQ\nWaterfront office, a former airplane hangar that was once used to film 'The Matrix'\nShort and relaxing ferry ride from the Ferry Building for SF residents\nEnhanced paternity / maternity programs\nCompetitive benefits including discounted gym, life insurance, 401k plan\n\nThis is an exciting new opportunity to drive your function at a fast-growing post series-B startup at the cutting-edge intersection of big data services and autonomous hardware. You will be an integral part of an A+ multi-disciplinary team scaling a high-performance business while delivering high impact for humanity and future generations.\n\nOur waterfront office offers beautiful views over San Francisco Bay in always sunny Alameda. Your commute could be a short and relaxing ferry ride from the Ferry Building. Even our walls have good karma, our offices mix software development with a hardware production line in the former airplane hangar that was once used to film 'The Matrix'.\n\nYou Can Read What The Press Says About Us\n\nInc - The most exciting drones aren't in the air, they are in the oceans\nThe New York Times - No sailors needed: robot sailboats scour the oceans for data\nNOAA - Sailing for scientific success in the Bering Sea\nWired - The drone that will sail itself around the world\n\nOr watch the Saildrone mission being presented the TED stage\n\nSaildrone is an equal opportunity workplace dedicated to pursuing and hiring a diverse workforce.\n\nAny unsolicited resumes/candidate profiles submitted through our website or to personal email accounts of employees of Saildrone are considered property of Saildrone and are not subject to payment of agency fees."""
b'Machine Learning Engineer',b'Calico Life Sciences',"b'South San Francisco, CA, US'","b'Who We Are\n\nCalico is a research and development company whose mission is to harness advanced technologies to increase our understanding of the biology that controls lifespan. We will use that knowledge to devise interventions that enable people to lead longer and healthier lives. Executing on this mission will require an unprecedented level of interdisciplinary effort and a long-term focus for which funding is already in place.\n\nPosition Description\n\nCalico is seeking a machine learning (ML) engineer to develop and productionize ML algorithms and software tools to support research into human aging and aging-related diseases. This person will be part of a cross-functional effort to build a world-class machine learning platform to advance research efforts at Calico, develop novel ML algorithms to solve challenging research questions, and play a critical role in defining and executing Calico\xe2\x80\x99s strategy in computational biology and machine learning. Candidates should be comfortable dealing with various types of biological data or data at a scale such that required methods and tools have yet to be well-developed.\n\nThe ideal candidate should be comfortable analyzing data at scale; have experience implementing, extending, and debugging machine learning techniques; and have expertise in designing and building high-leverage data infrastructure and tools. Candidates should be able to demonstrate a strong ability to communicate ideas and results, and to work cross-functionally to execute complex projects.\n\nPosition Requirements\nPh.D. in Computer Science or related technical field or M.S., plus 2+ years software industry experience\nExperience developing, implementing, and extending ML algorithms, data infrastructure, and tools\nFamiliarity with current large-scale distributed ML frameworks, e.g. TensorFlow or PyTorch\nStrong software engineering skills and substantial expertise in Python or C++\nTrack record of effective communication and collaboration in a cross-functional environment\nStrong analytical and quantitative skills\n\n\nNice To Haves\nExperience with biological or chemoinformatic datasets and/or some background in biology or chemistry\nPublic recognition in the field, e.g. via scientific publications or success in online competitions\nPh.D. in Computer Science with specialization in machine learning or artificial intelligence'"
b'Machine Learning Engineer - Fixed Term',"b'X, the moonshot factory'","b'Mountain View, CA, US'","b'X is Alphabet\xe2\x80\x99s moonshot factory where uncomfortably ambitious, world-changing ideas are developed and taken out into the world. X projects have the potential to transform the lives of billions of people and make the world a radically better place. For X to be successful, we have to repeatedly turn breakthrough technology ideas into products that solve large problems in the world, and create meaningful businesses for Alphabet.\n\nTeam\n\nWe are a team of physicists, machine learning researchers, and high performance computing engineers. We investigate technologies at the union of quantum physics and machine learning for the benefit of both fields.\n\nRole Description\n\nThis is a 6-month fixed term contract role.\n\nAs a machine learning engineer, your job will be a mix of research and practical engineering to help external teams and partners integrate the latest advancements into existing models. You\xe2\x80\x99ll be responsible for implementing, benchmarking, maintaining, and upgrading state of the art machine learning techniques used in many products.\n\nResponsibilities\nWrite software to implement cutting-edge machine learning techniques and make it as easy as possible to use externally\nWork with external teams to integrate new methods into their products\nWrite and manage code that will be integrated in the open sourced TensorFlow and Keras packages\nHelp maintain our existing open source repositories\nWork with other researchers on our team to develop novel techniques and use cases\n\n\nMinimum Qualifications\nDegree in Computer Science or equivalent practical experience.\nExperience developing software applications in a modern language (Python, C++)\nExperience with TensorFlow and Keras\nFamiliarity with industry-standard tools and practices\n\n\nPreferred Qualifications\nSignificant experience developing software in Python and C++\nExperience managing open source repositories\nExperience training and deploying production-level machine learning programs\nExperience using GPUs and TPUs\n\n\nAbout X, The Moonshot Factory\n\nX creates radical new technologies to solve some of the world\xe2\x80\x99s biggest problems. We develop uncomfortably ambitious, potentially world-changing new ideas such as self-driving cars, balloon-powered Internet and smart contact lenses. We\xe2\x80\x99re a team of makers, entrepreneurs, engineers, designers and scientists with deep technical expertise who love the challenge of the seemingly impossible. X was formerly known as Google[x] and is part of Alphabet.'"
b'Machine Learning Engineer',b'QuinStreet',"b'Foster City, CA, US'","b' \n\nMachine Learning Engineer\n\n \n\n\nPowering Performance Marketplaces in Digital Media\n\nQuinStreet is a pioneer in powering decentralized online marketplaces that match searchers and \xe2\x80\x9cresearch and compare\xe2\x80\x9d consumers with brands. We run these virtual- and private-label marketplaces in one of the nation\xe2\x80\x99s largest media networks.\n\nOur industry leading segmentation and AI-driven matching technologies help consumers find better solutions and brands faster. They allow brands to target and reach in-market customer prospects with pinpoint segment-by-segment accuracy, and to pay only for performance results.\n\nOur campaign-results-driven matching decision engines and optimization algorithms are built from over 20 years and billions of dollars of online media experience.\n\nWe believe in:\n\nThe direct measurability of digital media.\nPerformance marketing. (We pioneered it.)\nThe advantages of technology.\nWe bring all of this together to deliver truly great results for consumers and brands in the world\xe2\x80\x99s biggest channel.\n\nJob Description\n\nWe\xe2\x80\x99re looking for an extremely smart Machine Learning Engineer to become a core member the team that creates algorithms for pricing, targeting, demand fulfillment, and fraud detection in our marketing platform.\n\nResponsibilities\n\nUse your expertise in machine learning and statistical learning techniques such as classification and regression to produce models applicable to pricing and targeting.\nApply mathematical optimization techniques to solve network problems.\nExperiment and build models that improve the capabilities of our marketing platform and allow for increases in yield.\nWork with our Engineering and Business teams to implement scalable, reliable and useful solutions for our various business units.\nRun numerous experiments in a fast-paced, analytical culture so you can quickly learn and adapt your work.\nGet the satisfaction of knowing that you helped connect millions of visitors to our affiliates and internal properties to the products and services they are searching for.\nQualifications\n\n       2-3 years\xe2\x80\x99 experience in software development \n       MS in Computer Science or related area, or relevant work experience.\nDeep experience in applied machine learning, statistical learning, mathematical optimization and scalable computing. \n       Experience with both supervised and unsupervised learning on large data-sets. \n       Succeed as an individual but to collaborate and strive for the success of your team.\n       Strong sense of ownership in everything you build. \nStrong experience building production level code (Python is a plus)\n \n\nGeneral Requirements\n\n       Presentation, communication, and collaboration skills, enabling effective interaction and knowledge transfer to teammates and other departments within the company\nA high task load is expected. You should be able to work within tight deadlines while exhibiting exemplary time management and task prioritization\n       Strong analytic skills, especially in assessing and designing for performance\n       Meticulous attention to detail and aesthetics\n       Must possess ability to work with minimal to no supervision\n       Up to date with latest standards for site development and optimization\n       Positive attitude and professionalism in the workplace\n       A great sense of humor is always appreciated\n \n\nQuinStreet is an equal opportunity employer. We do not discriminate on the basis of race, color, religion, national origin, pregnancy status, sex, age, marital status, disability, sexual orientation, gender identity, or any other characteristics protected by law.\n\n '"
b'Machine Learning Engineer',"b'Adroitco, Inc'","b'Santa Clara, CA, US'","b'Very important: Candidate must know coding in python and must be willing for Python coding.\nCandidates should have done Machine Learning algorithm in production.\nShould have a computer science background\nCandidate must have worked done Productionised ML algorithm\nFamiliarity with algorithm\nCandidate should be more on engineering side\nGood computer fundamentals\nNeed to understand the entire Machine Learning pipeline and metrics.\nDepth in either Spark or Scala or java.\nExpert at coding and must be willing for ;coding in python.\nNeed to know MLops: mlflow/ kubeflow and needs to have AWS machine learning\nMachine Learning implementation side\nPython knowledge\nData structures and sports.\nMachine Learning engineering, data engineering and Data science. Very important: Candidate must know coding in python and must be willing for Python coding.\nCandidates should have done Machine Learning algorithm in production.\nShould have a computer science background\nCandidate must have worked done Productionised ML algorithm\nFamiliarity with algorithm\nCandidate should be more on engineering side\nGood computer fundamentals\nNeed to understand the entire Machine Learning pipeline and metrics.\nDepth in either Spark or Scala or java.\nExpert at coding and must be willing for ;coding in python.\nNeed to know MLops: mlflow/ kubeflow and needs to have AWS machine learning\nMachine Learning implementation side\nPython knowledge\nData structures and sports.\nMachine Learning engineering, data engineering and Data science.'"
b'Lead Machine Learning Engineer (NLP)',b'Aisera',"b'Palo Alto, California'","b""Senior NLP Engineer\n\nThere are many examples of disruption in the consumer space \xe2\x80\x93 Uber disrupting the cab industry, Airbnb disrupting the hospitality industry and so on; but have you wondered who is disrupting support and operations?\n\nAISERA helps make businesses and customers successful by offering consumer-like user experience for support and operations. We have built the world\xe2\x80\x99s first AISM solution for IT, HR, Customer Service, Facilities, and IT/Cloud Operations. With AISERA, organizations can provide a personalized and proactive experience for users by automating the resolution of tasks and actions.\n\nWhat you'll be doing\n\nAs a  NLP Engineer Manager, you will be responsible for pursuing excellence across these NLP tasks as a core contributor, while also serving as an NLP mentor and guide more broadly. You will lead a team of 8 (and growing) very skilled data scientists.\nYou will be understanding our users and their communication patterns is quintessential in helping our customers. Success in this role is making sense of the chaos, analyzing vast amounts of data and extracting patterns. Deep understanding of languages and passion towards helping machines understand context will ensure enjoyment and success in daily work.\n\n\nRequirements\n  \xe2\x97\x8f Experience in text classification a PLUS.\n\xe2\x97\x8f Experience as technical lead in designing and developing software and algorithms for natural language processing and conversational AI.\n\xe2\x97\x8f Development and implementation of novel methods for data extraction from free text data, including named entity recognition, relation extraction, part of speech tagging, etc.\n\xe2\x97\x8f Strong coding and software engineering skills in a mainstream programming language, such as Python, Java, C/C++.\n\xe2\x97\x8f Experience coding and debugging deep learning neural networks for text processing in PyTorch, Keras and/or TensorFlow.\n\xe2\x97\x8f Development and implementation of methods for topic modeling, document clustering and text summarization.\n\xe2\x97\x8f Development and implementation of methods for unsupervised identification of keywords and for detection of word similarity: latent semantic indexing, brown clustering, word2vec, etc.\n\xe2\x97\x8f Design and coding of algorithms that can enable researchers to identify, categorize, prioritize and process large volumes of unstructured textual datasets.\n\xe2\x97\x8f Experience in building large-scale NLP systems from researching a prototype to production\n\xe2\x97\x8f Experience with supervised, unsupervised and semi-supervised machine learning methods.\n\xe2\x97\x8f Experience with the key open-source software resources in these domains.\n\xe2\x97\x8f Strong communication and writing skills in English are essential.\n\xe2\x97\x8f The ideal candidate will have a proven track record of scientific publication in the fields of machine learning, deep learning, and/or natural language processing.\n\xe2\x97\x8f Must be eligible to work in the U.S."""
b'Machine Learning Engineer',b'Grand Rounds',"b'San Francisco, CA, US'","b'About Us\n\nGrand Rounds is a new kind of healthcare company. Founded in 2011, the company is on a mission to raise the standard of healthcare for everyone, everywhere. The Grand Rounds team goes above and beyond to connect and guide people to the highest quality healthcare available for themselves and their loved ones. Grand Rounds creates products and services that give people the best possible healthcare experience. Named a 2019 Best Place to Work by Glassdoor and Rock Health\xe2\x80\x99s 2018 Fastest Growing Company, Grand Rounds works with inspiring employers and doctors to empower them to be the change agents we need to make our shared vision a reality.\n\nThe Role\n\nData Scientists at Grand Rounds work on problems that are core to the company\xe2\x80\x99s mission. Major challenges include developing systems and models to identify the highest quality doctors in the country as well as methodologies to uncover the subtle differences between each physician\xe2\x80\x99s clinical expertise. Additionally, patient-level modeling allows us to understand the specific healthcare needs of every person. With a high fidelity understanding of both patients and physicians we are able to match patients to both appropriate and high quality care and understand the health of our patient populations.\n\nOur growing sect of machine learning engineers sit on the Data Science team and work closely with Data Engineering, Platform, and Analytics to build out search and analytics platforms powered extensively by machine learning technologies. This role will involve managing the full platform and lifecycle involved with production grade online machine learning, developing batch and stream processing pipelines in Spark, and ensuring deep integration with the next generation data platform being developed by our data engineers.\n\nExample Projects Include\n\nBuilding modules for our \xe2\x80\x9cMatch Engine\xe2\x80\x9d ecosystem: This collection of services powers our provider matching backend in terms of distributed runtime and deployment services. As data scientists across our team are constantly developing new models and features that will help patients immediately, we aim to publish these into our own integrated platform. You will help solidify, grow, and lead the evolution of the end-to-end systems architecture. As a user-facing real-time prediction environment, we take seriously the notions of instrumentation, optimization of both models and orchestration code, as well as the construction and integration of online and offline experimentation frameworks.\n\nLaying the groundwork for our next generation analytics platform. This multi-purpose Spark-based ecosystem will enrich our view of providers and patients through machine learning driven inference and population health statistics. By deeply understanding the modeling and inference patterns that have long been used across our team you will help to simplify and improve our prototype-to-production processes at scale. You will work at the intersection of our Data Engineering and Data Science teams to ensure robust modeling and data delivery systems.\n\nQualifications\nExcellent verbal communications, including the ability to clearly and concisely articulate complex concepts to both technical and non-technical collaborators\nBS with 8+ years or MS with 6+ years or PhD with 3+ years of experience. Degree(s) should be in a technical discipline such as Computer Science, Engineering, Statistics, Physics, Math, quantitative social science\nPrevious experience in machine learning, and statistics fundamentals\nProduction engineering experience is highly desired including previous experience developing and maintaining high-availability search and/or machine learning services.\nExperience with distributed systems componentry including SQL and NoSQL databases, caching layers (Redis, Memcached), compute in Spark or Hadoop, queueing (Kafka, Kinesis, SNS), cloud based databases (BigQuery, Athena, Redshift).\nExperience with workflow management solutions such as Airflow, Azkaban, or Luigi and scalable ETL in batch and stream processing workloads in Spark, Hadoop.\nRequired: SQL, Python, linux shell scripting\nDesired: Scala, Java, or Ruby\nExperience with production ready machine learning packages such as scikit-learn, TensorFlow, PyTorch, SparkML.\nFrequent user of cloud computing platforms such as Amazon Web Services, Microsoft Azure, or Google Cloud Platform\nDouble Bonus Points: previous work on medical applications and/or with claims data\n\nThis is a full time position located in San Francisco, CA.\n\n\n\nGrand Rounds is an Equal Opportunity Employer and considers applicants for employment without regard to race, color, religion, sex, orientation, national origin, age, disability, genetics or any other basis forbidden under federal, state, or local law. Grand Rounds considers all qualified applicants in accordance with the San Francisco Fair Chance Ordinance.'"
