title,company,location,job description
b'Machine Learning Engineer',b'Levi Strauss & Co.',"b'San Francisco County, CA, US'","b'Job Description\n\nAt Levi Strauss & Co, we are revolutionizing the apparel business and redefining the way denim is made.\n\nWe are taking one of the world\xe2\x80\x99s most iconic brands into the next century:\n\nfrom creating machine learning-powered denim finishes to using block-chain for our factory workers\xe2\x80\x99 wellbeing, to building algorithms to better meet the needs of our consumers and optimize our supply chain.\n\nBe a pioneer in the fashion industry by joining our global Data, Analytics & AI \xe2\x80\x9cstartup with assets,\xe2\x80\x9d where you will have the chance to build exciting solutions that will impact our Americas business and at the same time be part of a bigger, across-continents, data community.\n\nAs a Machine Learning Engineer, you will work on a broad set of domains that power a data driven transformation of our standard business procedures across channels and organizations. You will be responsible for developing and deploying novel algorithms along with optimizing existing machine learning systems to maximize their business value and increase consumer satisfaction at every brand touchpoint. You will also get the invaluable opportunity to mentor a closely-knit team of diverse and enterprenuerial data scientists and truly shape their career trajectory through your expertise and experience.\n\nWe are looking for someone who is a technology-agnostic polymath\xe2\x80\x94committed to a lifelong journey of continuous learning and exploration of innovative scientific ideas\xe2\x80\x94and will bring thoughtful perspectives, empathy, creativity, and a positive attitude to solve problems at scale. This role is ideal for someone looking to extend their algorithm design and software engineering skills into a part mentor, part IC, part thought partner role.\n\nExample Projects\n\nBesides driving the transformation of Levi\xe2\x80\x99s into a data-driven enterprise in general, here are some specific projects you will get to work on and contribute towards:\nPersonalized in-session product recommendation engine\nCustomer Segmentation\nAutomated text summarization and clustering\nNext-Best offer prediction\nDesigning Microassortments for Next-Gen stores\nAnomaly detection and Root Cause Analysis\nUnified consumer profile with probabilistic record linkage\nVisual search for similar and complementary products\n\nAbout The Job\nArchitect, build, maintain, and improve new and existing suite of algorithms and their underlying systems.\nImplement end-to-end solutions for batch and real-time algorithms along with requisite tooling around monitoring, logging, automated testing, performance testing and A/B testing\nUtilize your entrepreneurial spirit to identify new opportunities to optimize business processes and improve consumer experiences, and prototype solutions to demonstrate value with a crawl, walk, run mindset.\nWork closely with data scientists and analysts to create and deploy new product features on the ecommerce website, in-store portals and the Levi\xe2\x80\x99s mobile app\nEstablish scalable, efficient, automated processes for data analyses, model development, validation and implementation\nWrite efficient and well-organized software to ship products in an iterative, continual-release environment\nContribute to and promote good software engineering practices across the team\nMentor and educate team members to adopt best practices in writing and maintaining production machine learning code\nCommunicate clearly and effectively to technical and non-technical audiences equally well\nActively contribute to and re-use community best practices\nEmbody the values and passions that characterize Levi Strauss & Co., with empathy to engage with colleagues from a wide range of backgrounds\n\nAbout You\nUniversity or advanced degree in engineering, computer science, mathematics, or a related field\n5+ years experience developing and deploying machine learning systems into production\nStrong experience working with a variety of relational SQL and NoSQL databases\nStrong experience working with big data tools: Hadoop, Spark, Kafka, etc.\nExperience with at least one cloud provider solution (AWS, GCP, Azure)\nStrong experience with object-oriented/object function scripting languages: Python, Java, C++, Scala, etc.\nAbility to work in a Linux environment\nIndustry experience building and productionizing innovative end-to-end Machine Learning systems\nAbility to quickly prototype ideas and solve complex problems by adapting creative approaches\nExperience working with distributed systems, service oriented architectures and designing APIs\nStrong knowledge of data pipeline and workflow management tools\nExpertise in standard software engineering methodology, e.g. unit testing, test automation, continuous integration, code reviews, design documentation\nRelevant working experience with Docker and Kubernetes is a big plus\nLOCATION1155 Battery St. San Francisco, CA, 94111FULL TIME/PART TIMEFull time'"
b'Machine Learning Engineer',b'Automattic',"b'San Francisco, CA, US'","b""We are the company behind WordPress.com, Jetpack, WooCommerce and Tumblr. We are looking for someone to join a team of data scientists and software engineers to build, deploy, and iterate on applications involving time series analysis, machine learning, natural language processing and/or search.\nWhat have we worked on recently?\nWe help our users to create powerful sites with ease and enable our colleagues to support our users. Our completed and ongoing projects include\nElfbot - a machine learning project to automatically tag chat transcripts from our live chat user support.\nAutomated anomaly detection on business and user data.\nA new Jetpack Search experience with instant search and improved relevance.\nA generalized machine learning pipeline to build audiences for marketing and engagement.\nHow do we work?\nWe're kind to each other and our users - we strive to build a positive, supportive, and inclusive culture of cohesive teams focused on delivering value to our customers.\nWe work as a global and distributed workforce resulting in a unique way of working built around our creed.\nWe offer flexible work arrangements allowing our team members to work when they feel best.\nWe welcome collaboration, and you can be involved in any discussion across our many communication channels.\nEnough about us, let's talk more about you. The Machine Learning Engineer position might be a good fit if you:\nHave hands-on experience in building and deploying data-intensive applications to production. You care about building reliable and testable infrastructure and pipelines. Familiarity with the Hadoop ecosystem and cloud computing services like AWS and GCP will be advantageous.\nAre motivated to propose technical solutions, own software architecture, evaluate technologies and infrastructure, or develop technical roadmaps for future applications.\nHave a demonstrated interest in understanding machine learning techniques and workflows like data preprocessing, feature extraction, and training and evaluation of classification and regression models.\nBring programming skills in multiple programming languages and paradigms. You are likely to encounter Python, PHP, Scala, and SQL in this role and the idea of using them on a regular basis should not be a blocker for you.\nAre familiar with professional software engineering methods and standards such as coding conventions, code reviews, continuous integration, build processes, testing, and operations.\nAre open and able to travel 3-4 weeks per year to meet your teammates in person. We hold an annual all-company meeting every year, and meet up with our teams for a week once or twice per year.\nLike all positions at Automattic, you'll work remotely, and can be based wherever you live.\n\nAbout Automattic\n\nWe are the people behind WordPress.com, WooCommerce, Jetpack, Simplenote, Longreads, VaultPress, Akismet, Gravatar, Crowdsignal, Cloudup, and more. We believe in making the web a better place.\nWe're a distributed company with more than 1100 Automatticians in 65+ countries speaking 75+ different languages. Our common goal is to democratize publishing so that anyone with a story can tell it, regardless of income, gender, politics, language, or where they live in the world.\nWe believe in Open Source and the vast majority of our work is available under the GPL.\nDIVERSITY & INCLUSION AT AUTOMATTIC\nWe're improving diversity in the tech industry. At Automattic, we want people to love their work and show respect and empathy to all. We welcome differences and strive to increase participation from traditionally underrepresented groups. Our D&I committee involves Automatticians across the company and drives grassroots change. For example, this group has helped facilitate private online spaces for affiliated Automatticians to gather and helps run a monthly D&I People Lab series for further learning. Diversity and Inclusion is a priority at Automattic, though our dedication influences far more than just Automatticians: We make our products freely available and translate our products into and offer customer support in numerous languages. We require unconscious bias training for our hiring teams and ensure our products are accessible across different bandwidths and devices. Read more about our dedication to diversity and inclusion.\nHow to Apply\nDoes this sound interesting? If yes, click the Apply button below and fill out our application form. In your cover letter, let us know what you can contribute to the team. Proofread! Make sure you spell and capitalize WordPress and Automattic correctly. We are lucky to receive many applications for this position, so try to make your application stand out.\nApply for this Job\nIf you're reading this on a site other than automattic.com please ensure you visit automattic.com/work-with-us for the latest details on applying.\n\xe2\x86\x90 Work With Us"""
b'Machine Learning Engineer',b'Synapse',"b'San Francisco, CA, US'","b""We are looking for machine learning engineers to help us build an automated backoffice. In traditional banks, back offices are filled with humans. Their job usually is to verify physical documents (like government issued IDs, proof of address, proof of income documents etc), fill out forms, and search for people on google (no joke) and other sites.\n\nInstead of using people, we want to use machines to do these things. Here is our reasoning behind this: If we can automate the back office, then we won't have costs associated with customers like traditional banks. We would be able to offer state of the art finance products to everyone at a low cost, regardless of their bank balance. (Usually banks charge monthly management fees to people with lower bank balance, aka people with lower socioeconomic status - we want to break that cycle).\n\nCheck this out: . Everything here uses machine learning, from instant government ID verification, to video authentication to social media verification. These are the kind of tools you will be building.\n\nIn order to be successful at Synapse, you should have:\nAn ability to work independently within a small, fast-paced team\nAn entrepreneurial spirit and unrelenting passion to deliver the best service possible\nThe ability to implement feedback, learn quickly, and contribute new ideas\nA general concern for the wellbeing of others and the desire to work on problems that maximize a positive future for humanity\n\nKey Qualifications\nExperience with Python, with strong love for writing tests\nExperience with Tensorflow, PyTorch, Numpy\nExperience with working on computer vision or NLP problems\nAbility to write clean, reliable code that can be easily maintained\nAbility to solve problems and identify areas of improvement\nAlong with Python, we use flask to build APIs, docker to containerize them, rancher to deploy and orchestrate, AWS to host, CircleCI to test (and obviously Github in between all this). So experience with this stack is a plus, but not a necessity. These things are easy to learn.\nBachelor\xe2\x80\x99s degree in Computer Science, Data Science, Statistics, Mathematics and/or a related field.\n\nPerks\nGrowth Potential\nCompetitive Salary\nInsurance (Health//Dental//Vision)\nOne Medical membership\n401(k) with company matching\nMonthly commuter allowance, for travel to and from work\nHealthy on-site breakfast and lunch crafted by Synapse\xe2\x80\x99s own chefs\n\nCompensation\n$90K - $150K\n0.0% - 0.001%\n\nSynapse is an equal opportunity employer. We celebrate diversity and are committed to creating an inclusive environment for all of our employees.\n\nWe are looking for top notch individuals who are seeking a challenge. Our company is growing quickly. This is an exciting time to join our team. If you are interested in adding value to our team, please apply and we will be in touch.\n\nSan Francisco, CA\n\nData Science\n\nFull Time"""
b'Machine Learning Engineer - Recommendations',b'Scribd',"b'San Francisco, CA, US'","b""At Scribd ( pronounced \xe2\x80\x9cscribbed\xe2\x80\x9d), we believe reading is more important than ever. Join our cast of unique characters as we build the world\xe2\x80\x99s largest and most fascinating digital library: giving subscribers access to a growing collection of ebooks, audiobooks, magazines, documents, and more.\n\nIn addition to works from major publishers and top authors, we also create our own original content exclusively for Scribd users.\n\nOur community includes over 1M subscribers in more than 190 countries. Join us in turning screen time into quality time!\n\nThe Opportunity\n\nWe are looking for exceptional, results-oriented and passionate Machine Learning experts to join our growing Recommendation Team. As an early member of a world-class team, you will lead the way by creating and owning the next generation of machine learning algorithms and end-to-end systems that power the experience for our 6B+ monthly recommendations and 100M+ users around the world.\n\nQualifications\n1+ years of experience applying Machine Learning in industry, especially related to Personalization\nStrong background in Machine Learning and Recommender Systems, with deep understanding of supervised and unsupervised methods (collaborative-filtering, content-based, deep learning, reinforcement learning, contextual multi-armed bandit, causal inference)\nGreat coding skills and software development experience (spark, scala, python, java, tensorflow)\nSuccessful track record of ownership in challenging cross-functional projects\nDemonstrated ability to design and build complex systems that have positively impacted the business\nBS in Computer Science, Statistics, or related field\nIf you are results-oriented, self-driven, motivated to succeed, and are eager to make an impact by working on cutting-edge ML products and shaping Scribd's future, please reach out to us. We are looking forward to talking to you!"""
b'Machine Learning Engineer',"b'Hooked, Inc.'","b'Mountain View, CA, US'","b'We are looking for someone interested in applying the latest advances in ML to building cutting-edge entertainment experiences for our 40MM monthly users. Here are some example projects: Create a recommendation system that provides personalized recommendations to users by leveraging the data generated by hundreds-of-millions of stories being read. The system must be fast, scalable and support testing different candidate recommendation algorithms. For our top stories we work with actors to create audio versions of our story. For the rest of the catalog we have experimented with text-to-speech systems but have found the results more comical than convincing. Build open state-of-the-art TTS systems (wavenet etc) to create TTS system that takes into account semantic context. What emotion needs to be conveyed? Can we condition on this to guide the TTS system? Hooked readers generate vast amounts of granular data when they read -- every tap is a data point. Can we use marry this behavioral information with automatic story analysis using NLP techniques to predict engagement on future stories? by Jobble We are looking for someone interested in applying the latest advances in ML to building cutting-edge entertainment experiences for our 40MM monthly users. Here are some example projects: Create a recommendation system that provides personalized recommendations to users by leveraging the data generated by hundreds-of-millions of stories being read. The system must be fast, scalable and support testing different candidate recommendation algorithms. For our top stories we work with actors to create audio versions of our story. For the rest of the catalog we have experimented with text-to-speech systems but have found the results more comical than convincing. Build open state-of-the-art TTS systems (wavenet etc) to create TTS system that takes into account semantic context. What emotion needs to be conveyed? Can we condition on this to guide the TTS system? Hooked readers generate vast amounts of granular data when they read -- every tap is a data point. Can we use marry this behavioral information with automatic story analysis using NLP techniques to predict engagement on future stories? by Jobble'"
b'Machine Learning Engineer',b'American Express',"b'Palo Alto, CA, US'","b'Why American Express?\n\nThere\xe2\x80\x99s a difference between having a job and making a difference.\n\nAmerican Express has been making a difference in people\xe2\x80\x99s lives for over 160 years, backing them in moments big and small, granting access, tools, and resources to take on their biggest challenges and reap the greatest rewards.\n\nWe\xe2\x80\x99ve also made a difference in the lives of our people, providing a culture of learning and collaboration, and helping them with what they need to succeed and thrive. We have their backs as they grow their skills, conquer new challenges, or even take time to spend with their family or community. And when they\xe2\x80\x99re ready to take on a new career path, we\xe2\x80\x99re right there with them, giving them the guidance and momentum into the best future they envision.\n\nBecause we believe that the best way to back our customers is to back our people.\n\nThe powerful backing of American Express.\nDon\xe2\x80\x99t make a difference without it.\n\nDon\xe2\x80\x99t live life without it.\n\nAs part of the Data Science team, you will be responsible for:\nDriving requirements for structured data formats from a wide variety of data sources\nBuild data science products across a wide range of digital data streams (Anomaly Detection, Deep Learning, Information Retrieval)\nWork with engineering teams to deploy robust, highly available decisioning and alerting pipelines based on your models.\nRegularly attend key initiative stand-ups, proactively advising on opportunities to apply the best approach to apply underlying empirically-developed algorithms.\n\nMinimum Qualifications\nDeep technical skills in data engineering, statistics, machine learning, or deep learning and a passion for making these methods more rigorous, robust and scalable\nStrong programming skills in Python or Java\nPractical experience working with and conducting experiments on large datasets then turning prototypes into production models in one or more domains\nExperience applying analytical techniques to provide solutions to real business and engineering problems\nAbility to explain and present analyses and machine learning concepts to a technical audience\nEmployment eligibility to work with American Express in the U.S. is required as the company will not pursue visa sponsorship for these positions.\n\nReqID: 19009478\nSchedule (Full-Time/Part-Time): Full-time\nDate Posted: May 22, 2019, 9:07:03 AM'"
b'Machine Learning Engineer',b'CRB Workforce',"b'San Mateo, CA, US'","b""Located in Redwood City, we're looking for a strong ML Engineer to join our team. We're a innovative successful startup that specialized in Natural Language Processing and Automation.\n\nResponsibilities\nBuilding Real-time reactive systems for our product hat allow different product teams to iterate and optimize on site features.\nDesigning the system to incorporate real time contextual features, streaming features to build the most predictive model.\nBuilding end-to-end large scale ML Systems in Production\nImplementing predictive models and statistical methods within Automation\nDesigning and implementing Data Pipelines for Distributed Cloud Computing\n\n\nQualifications\nBS or MS in Computer Science or Technical Discipline\nExperience with Spark and Python\nStrong understanding of NLP and Machine Learning Principles\nExperience with Data Structures, Algorithms, and Run-time Optimization\nSomeone who is comfortable working in a fast paced startup\n\nIf the above seems like a fit, then apply!!\n\nAlso, if the title doesn't seem just right for you, talk to us and we will change it - if the job is for you, we will make it work.\n\nCRB Workforce, LLC provides equal employment opportunities to all employees and applicants for employment and prohibits discrimination and harassment of any type without regard to race, color, religion, age, sex, national origin, disability status, genetics, protected veteran status, sexual orientation, gender identity or expression, or any other characteristic protected by federal, state or local laws.\n\nThis policy applies to all terms and conditions of employment, including recruiting, hiring, placement, promotion, termination, layoff, recall, transfer, leaves of absence, compensation and training."""
