title,company,location,job description
Software Engineer,Hearst Magazines,"New York, United States","b'Pattern & Shape is seeking an experienced software engineer, primarily focused on the back end, who is passionate about building desktop and mobile web applications while discovering the best ways to deliver complicated data in easy to understand visualizations. This position is full-time and is based in our New York office.\n Helmed under Hearst Magazines, Pattern & Shape\xe2\x80\x99s mission is to change the ways brands approach marketing. We\xe2\x80\x99re building a platform that makes our first party proprietary data comprehensive in an intuitive and on demand way. We work with large data sets, novel database structures, and deliver products fast. Whether we\xe2\x80\x99re making new features or improving our data pipelines, people at Pattern & Shape are builders at heart. We\xe2\x80\x99re a small, autonomous team, dedicated to making data comprehensible and looking to add another member to our group is like-minded, skilled, and hardworking.\n As a software engineer, you will be working with a small team of engineers who are creating our technology stack, all being built from the ground up. We\xe2\x80\x99re using a variety of technologies and languages in a dynamic start-up like environment. You\xe2\x80\x99re experienced with Python, GraphQL, React, Webpack, structured and unstructured data sets, Postgres, Redis - and this list is by no means exhaustive! Our platform leverages a plethora of APIs, some of which you will be building to connect billions of data points from our first-party data.\n You have the ability to take a feature or service to full completion, from owning our back-end tech in collaboration with our Senior Software Engineer through to front-end implementation.\n Our idea candidate is passionate, primarily back-end, software engineer who is eager to learn and contribute. You\xe2\x80\x99re meticulous, a team player, highly communicative, responsible, and a builder of things that can work at a rapid pace with a strong \xe2\x80\x98can do\xe2\x80\x99 attitude in an agile environment.\n Responsibilities:\nWorking on a small team, you will be involved in all phases of the software\xe2\x80\x99s development and will be responsible for planning, estimating, architecting, testing, and delivering the final product. \nLeveraging web technologies in service of creating the best possible user experience.\nTaking the initiative to constantly improve existing services and functions\nArchitect efficient and reusable systems that drive our ability to surface insights from complex and large scale data sets\nCollaborate with Product Managers, Business Development, and Software Engineers to deliver solutions that are performative and include compelling user-facing experiences.\n Need to Haves:\n3+ years of software engineering experience\n2+ years of Python experience/NodeJS experience\nExperience building software for consumer-facing applications, preferably large-scale\nUnderstanding of microservices architecture \nExperience building RESTful APIs\nEager to learn any other languages/frameworks that apply\nPostgreSQL experience (or similar relational database)\nFamiliarity with database performance tuning / caching strategies \nReact or other Javascript framework experience \xe2\x80\xa2 Experience with job queueing \xe2\x80\xa2 Logging and monitoring tools\nGraphQL API integration\nLinux, Docker, Amazon AWS\nA degree in Computer Science or equivalent experience required.'"
Software Engineer,IBM,"Yorktown Heights, NY, US","b""Introduction\nSoftware Developers at IBM are the backbone of our strategic initiatives to design, code, test, and provide industry-leading solutions that make the world run today - planes and trains take off on time, bank transactions complete in the blink of an eye and the world remains safe because of the work our software developers do. Whether you are working on projects internally or for a client, software development is critical to the success of IBM and our clients worldwide. At IBM, you will use the latest software development tools, techniques and approaches and work with leading minds in the industry to build solutions you can be proud of.\n\nYour Role and Responsibilities\nIBM Research seeks a Software Engineer to join our quantum computing team at the Almaden Research Center in San Jose, CA or out TJ Watson Lab in Yorktown Heights, NY.\n\nWe are looking for researchers and developers for quantum applications software. Candidates are expected to carry out a high degree of fruitful collaboration with other members of the group.\n\nRequired Technical and Professional Expertise\nAt least 2 years of experience in quantum computing\nPreferred Technical And Professional Expertise\nAt least 5 years research experience in computer science\nProven record of research and development\nAbout Business Unit\n\nWith more than 3,000 researchers in 12 labs located across six continents, IBM Research brings together hundreds of researchers who possess unparalleled industry expertise to address some of the world's most challenging problems. Join us as we do pioneering work in areas such as cognitive computing, augmented intelligence, quantum computing, and blockchain, to name a few.\n\nYour Life @ IBM\nWhat matters to you when you\xe2\x80\x99re looking for your next career challenge?\n\nMaybe you want to get involved in work that really changes the world? What about somewhere with incredible and diverse career and development opportunities \xe2\x80\x93 where you can truly discover your passion? Are you looking for a culture of openness, collaboration and trust \xe2\x80\x93 where everyone has a voice? What about all of these? If so, then IBM could be your next career challenge. Join us, not to do something better, but to attempt things you never thought possible.\n\nImpact. Inclusion. Infinite Experiences. Do your best work ever.\n\nAbout IBM\n\nIBM\xe2\x80\x99s greatest invention is the IBMer. We believe that progress is made through progressive thinking, progressive leadership, progressive policy and progressive action. IBMers believe that the application of intelligence, reason and science can improve business, society and the human condition. Restlessly reinventing since 1911, we are the largest technology and consulting employer in the world, with more than 380,000 IBMers serving clients in 170 countries.\n\nLocation Statement\nFor additional information about location requirements, please discuss with the recruiter following submission of your application.\n\nBeing You @ IBM\nIBM is committed to creating a diverse environment and is proud to be an equal opportunity employer. All qualified applicants will receive consideration for employment without regard to race, color, religion, gender, gender identity or expression, sexual orientation, national origin, genetics, disability, age, or veteran status. IBM is also committed to compliance with all fair employment practices regarding citizenship and immigration status."""
Software Engineer,FactSet,New York City Metropolitan Area,"b'The News Processing team is a highly motivated and collaborative team that works to develop and maintain the distributed services that orchestrate, extract, normalize, and correct real-time News, Research, and Filings documents. Our architectures are a critical part of providing content and services to Workstation, web, mobile apps, and external facing APIs.\n\nWe are looking for a strong addition to the team who will join us in our effort to further develop, refine, and re-imagine our distributed architectures in a cloud-first world. As a member of this team, you will work collaboratively through every step of the software development cycle, focusing on real-time delivery and fully redundant services for our global client base. This position requires a hardworking and driven individual with a keen eye for detail.\n\nResponsibilities:\nBe willing to collaborate, share, learn, and adapt as part of a highly collaborative team\nDesign, develop, and maintain real-time services for a global client base\nTroubleshoot, remediate, and optimize services for real-time workflows\nWork to redesign and reimagine services as we move from on-prem to cloud based architectures\nContinuously integrate and deliver new code for an on-demand release cycle\nWork closely with product developers, engineers, and consultants in an iterative process\n\nRequired Skills:\n2 yrs. experience with object-oriented programming in Python\nAbility to work independently and produce reliable code\nStrong analytical and problem solving skills\nComfort working in a real-time, 24/7 production environment\nExcellent organizational and communication skills\nWillingness to participate in design discussions and peer code reviews\nWillingness to maintain project and operational documentation and test plans\nWillingness to participate in a team-wide on-call rotation\nBS or MS in Computer Science or equivalent'"
Software Engineer,EPITEC,"Berkeley Heights, New Jersey, United States","b'Software Engineer\n* Must be U.S. citizen or Green Card Holder\n* 2-3  years experience with application and services development with Android and Java\n* Not senior position\n* 12 Month contract - possibility of extension or permanent\n\nResponsibilities\n\xe2\x80\xa2 Develop and build applications on platform\n\xe2\x80\xa2 Integrate applications & deploy solution in different handsets, debug & fix internal/customer issues\n\xe2\x80\xa2 Work closely with Project Lead, Product managers, and other cross-functional members on need-basis to submit required deliverables, support requests\n\xe2\x80\xa2 Work on legacy applications and do enhancements, bug fixes\n\xe2\x80\xa2 Unit-test code for robustness, including edge cases, usability, and general reliability\n\nRequired Skills\n\xe2\x80\xa2 Educational Qualification : B S( BS , B TECH) or MS ( ME, M TECH) in Computer Science Or Information Technology\n\xe2\x80\xa2 2-3 years of experience with application and services development with Java.\n\xe2\x80\xa2 Familiar with Studio IDE, Perforce, Git and gradle build scripts. Deep exposure to Perforce is strongly recommended.\n\xe2\x80\xa2 Understanding of networking and building client-server based applications\n\xe2\x80\xa2 Adequate Technical, Analytical, problem solving written and verbal skills.\n\xe2\x80\xa2 Prior experience and understanding of the product/software development process.\n\xe2\x80\xa2 Highly motivated and able to think proactively.\n\xe2\x80\xa2 Excellent communication and interpersonal skills\n\xe2\x80\xa2 Meticulous in carrying out daily tasks\n\xe2\x80\xa2 Excellent team player'"
Software Engineer,Radley James,New York City Metropolitan Area,"b'A highly optimised trading firm based in New York is seeking a C++ software developer to join their front office team to develop low latency cutting edge trading systems. They trade mainly in equities and futures.\n\nYou will be developing and implementing, the tools, frameworks and libraries which power the company\xe2\x80\x99s quantitative research and systematic trading. The role requires you to liaise with strategists and traders to provide solutions for algorithmic trading; therefore good communication skills are essential.\n\nKey Responsibilities\nDesigning and implementing algorithmic trading systems components in C++ on Linux\nTrading infrastructure libraries, market data and order entry protocols\nEnsuring trading strategies are successful\n\nRequirements\nExperience in C++, however developers from all programming backgrounds will be accepted.\nA strong passion for technology\nEnjoys working in a team environment\nMinimum academic qualification Bachelors degree in Computer Science or Computer Engineering, or equivalent\nFinance is a nice to have but not a necessity'"
Software Engineer,Current,New York City Metropolitan Area,"b'Software Engineer\n Current is a New York-based FinTech that uniquely connects people and their money to friends, family, brands, and experiences. Our mission is to create better financial outcomes for people and their unique lives.\nWe are looking for software engineers to help build features on our customer-facing GraphQL API. You will be on the front lines of delivering exceptional product experiences while using the latest technologies. You will collaborate closely with our product and app teams, and you will start shipping high-impact code within your first week.\n\nAbout the Stack\nCurrent\xe2\x80\x99s engineering team has applications running on Google Cloud, with Compute Engine and Kubernetes clusters hosting various parts of the system. We use a variety of databases, including MongoDB and Neo4j, with our API services written in TypeScript and Node.js. We are obsessed with tracking and analyzing our system activity in order to improve our product funnels and system performance, and we leverage Segment to aggregate many data sources into our BigQuery warehouse.\n\nAbout You\nRequired:\n3+ years of professional development experience\nB.S. Computer Science, Mathematics, or equivalent\nExperience running production web applications with real users\nExperience writing and debugging Node.js code\nExperience with cloud hosted services, like AWS or GCP\nExperience with more than one database, and understanding when to use what\nExperience working across disciplines and teams to diagnose and resolve customer/system issues\n\nBonus:\nProduction Kubernetes experience\nProduction GraphQL experience\nTypeScript experience\nExperience with creating and maintaining tests within a CI pipeline\nMongoDB, Neo4j, Postgres, Graphite, and/or Elasticsearch expertise\nGoogle Cloud (GKE, Compute Engine, BigQuery, Cloud Build) expertise\n\nBenefits & Perks:\nHealth, dental, vision benefits with 100% premium covered for employees\nUnlimited vacation days and paid holidays\nDiscounted gym memberships\nEmployee commuter benefits\nCompany equity & discretionary performance bonuses\nHealthcare and Dependant care FSA benefit\nA collaborative open floor plan in our Soho-based office with a stocked fridge and kitchen, occasional catered lunches, hot and cold drinks, and happy hours'"
Software Engineer,Seated,New York City Metropolitan Area,"b'About the Role:  \nSeated is an app that rewards you for dining out. Users can browse restaurants based on their location, preferences or mood and book either as walk-in or reservation. The seated mobile app, powered by robust microservices architecture, provides a convenient way to upload receipts, verify spend and reward users. The Seated platform further allows users to spend rewards on in-person experiences such as wine tasting & cooking classes or redeem rewards for gift cards from a wide variety of brands such as Uber, Amazon, Target or SoulCycle.\n\nWe are fast-paced, innovative and metric-driven, with a team that are passionate for delighting our customers. Whether you want to work with incredible product design, develop technology solutions for mobile applications, scale our microservices for millions of users, use AI for automation & fraud prevention or do something else awesome in between, we have a place for you. \n\nAs the Senior Software Engineer you will work with the software development team based in New York, you\xe2\x80\x99ll help define technical standards and drive the architectural and engineering vision in a very dynamic environment. You\xe2\x80\x99ll translate business needs into live features and partner directly with business owners who recognize the value of technology. You will have a strong voice in product design and ownership over coding, QA, and production support.\n\nTo be successful in this role you will have 1+ years of experience in developing and supporting software systems, as well as being a strong individual contributor with strong quantitative, analytical, strategic thinking and problem-solving skills.\n\nWhat you\xe2\x80\x99ll do\nActively participate in tech design for complex high-performance service-oriented architectures\nDevelop reliable, fault-tolerant & distributed software solutions, ensuring global compatibility\nWork with business users to ensure understanding of the business process and proper implementation in software\nScale backend systems & microservices for high throughput & low latency while running against rapidly expanding data sets\nFollows engineering best practices from coding, testing and performance perspective\n\nWhat you\xe2\x80\x99ll bring\nBachelors in CS or Engineering, Masters preferred\n1+ years experience in successfully shipping large scale engineering projects \nAbility to rapidly adapt to new technologies and concepts to productional business solutions & product designs\nIn-depth knowledge of distributed database systems, big data architectures & scalable fault-tolerant caching solutions \nHands-on development experience in Java or similar object-oriented programing language\nExperience developing low latency APIs and distributed RESTful Web-Services \nExperience & in-depth knowledge of Dockers, Kubernetes or similar container technologies\n\nWhat you\xe2\x80\x99ll get\nComprehensive Healthcare, Dental, and Vision\nGenerous 401(k) Matching\nStock options\nUnlimited PTO\nPre-Tax Flexible healthcare spending account (FSA), Dependent Care FSA and Commuter Benefits\nPaid Family Leave\n$100 monthly Seated allowance (dine on us)\nStocked fridges, coffee, soda, and lots of treats\nCollaborative, dynamic work environment within a fast-paced, mission-driven company\n At Seated we welcome passionate people from all backgrounds, helping us make dining experiences more accessible & rewarding. If you have the curiosity & passion to drive our mission together, we would love to hear from you.  '"
Software Engineer,The Phoenix Group,"New York, New York","b""Post series A B2B SaaS start up in midtown NYC actively seeking multiple software engineers to join their growing team. Great opportunity to have an influential impact for the global Pandemic. Apply here to learn more!!\n\nWHAT YOU'LL DO:\n\xe2\x80\xa2 Build projects from design through development to production\n\xe2\x80\xa2 Turn fast-moving product requirements into tangible engineering tasks \n\xe2\x80\xa2 Refine your work in the spirit of continuous improvement\n\xe2\x80\xa2 Shape our engineering culture with best practices and tools we're proud of\n\xe2\x80\xa2 Produce high-quality, well-documented, and tested code\n\xe2\x80\xa2 Measure and monitor systems\n\xe2\x80\xa2 Collaborate with design, creating a user experience that is empathic and elegant in its simplicity\n\nYOU SHOULD APPLY IF:\n\xe2\x80\xa2 4/5+ years of experience building scalable backend and frontend systems\n\xe2\x80\xa2 Generalist background with the ability to \xe2\x80\x9cgo deep\xe2\x80\x9d anywhere in the stack\n\xe2\x80\xa2 Modern web application experience working with complex requirements\n\xe2\x80\xa2 3+ years of experience with Rails and React/Vue/Ember, or any modern Javascript framework a plus\n\xe2\x80\xa2 Understanding of modern best practices relating to cloud-based deployment and service design\n\xe2\x80\xa2 Well-balanced mix of architectural thinking and ability to dive deep in pursuit of the best possible solution\n\xe2\x80\xa2 Comfortable working with early stage startups that are growing\n\xe2\x80\xa2 Computer Science degree desired"""
Software Engineer,Epic,"Allentown, PA, US","b""TL;DR\n\nHigh-impact software development jobs for smart people.\n\nCode that saves lives.\n\nAs a software developer at Epic, you\xe2\x80\x99ll write software that impacts the lives of 75% of Americans and 250 million patients around the world. Working in your own office, surrounded by thousands of high-caliber developers, you\xe2\x80\x99ll use modern development methodologies and employ user-centered design, analytics, and machine learning tools to drive innovation in healthcare. Using leading-edge technologies and languages like JS, TS, and C#, you\xe2\x80\x99ll invent better ways to reduce medical errors, streamline record sharing between hospitals, and provide the quality of care a patient deserves.\n\nWrite software for the most innovative health systems on the planet.\n\nAll the Top 20 health systems in U.S. News and World Report are Epic customers. Our community includes major systems like the Mayo Clinic, Johns Hopkins, Cleveland Clinic, and Kaiser Permanente, as well as leading academic medical centers at the University of Wisconsin, University of Michigan, University of California, University of Texas, The Ohio State University, and many more.\n\nWork in your own office, eat delicious food, and travel the world.\n\nWe don\xe2\x80\x99t believe in cubicles. (Well, we believe they exist, but\xe2\x80\xa6) You will work in an individual office that will heighten your ability to get stuff done. For lunch, visit King\xe2\x80\x99s Cross or Cassiopeia for a wide array of meal options, or go to one of our smaller, themed bistros, featuring wood-rotisserie, pan-Asian, and Latin-inspired cuisine. All meals are restaurant-quality but cost only a few dollars, and they\xe2\x80\x99re prepared by a team comprised of kitchen talent from restaurants around the country. And, after five years here, you\xe2\x80\x99ll earn a four-week sabbatical anywhere in the world. Staff have kayaked in Patagonia, attended a Beyonc\xc3\xa9 concert in Ireland, built a library in Tanzania, and run a marathon in Antarctica.\n\nLive affordably in a city known for its rising tech talent.\n\nEpic is located just outside Madison, Wisconsin the second fastest growing market for tech talent in the United States and home to the state capital and the University of Wisconsin. Madison, a city surrounded by water, has received accolades for being the greenest city in America (NerdWallet), the best city for renters (SmartAsset), fittest city in America (Fitbit), and, for the gamers, is one of a handful of US cities to have a Killer Queen arcade game, located at Madison\xe2\x80\x99s first arcade bar.\n\nMore than just important work.\n\nWe offer comprehensive benefits to keep you healthy and happy as you grow in your life and career, and your merit-based compensation will reflect the impact your work has on the company and our customers. You'll also be eligible for annual raises and bonuses, as well as stock grants, which give you an even greater stake in the success of Epic and our customers. Epic is an Equal Opportunity/Affirmative Action (W/M/Vets/Disability) employer. Please see our full non-discrimination statement at https //careers.epic.com/EEO.\n\nRequirements\n\nOpen to relocation to the Madison, WI area (we will bring you here to explore the city for yourself)\nBS/BA or greater in Computer Science, Mathematics, Software Engineering, Computer Engineering, or a related field\nA history of academic excellence or professional success\nEligible to work in the United States without visa sponsorship (persons with appropriate qualifications and eligible for TN status under NAFTA may apply)"""
