title,company,location,job description
Software Engineer,Attentive,Greater New York City Area,"b'Software Engineer\n_____________________________________________________________________________________________\nAre you an experienced software developer looking to join an innovative growth-stage company?\nStreet Diligence is seeking a Software Engineer with a record of success and interest in joining a growth stage firm. Our technology & product is unique and growing in the marketplace, so this is a greenfield opportunity with plentiful room to grow.\nYou will work on the development of Street Diligence\xe2\x80\x99s core applications, which are built in React.js and ASP.NET Core C#. You will play a pivotal role in defining, designing and developing the code base. You will work closely with our team to create scalable, fast and efficient applications.\nWe\xe2\x80\x99re looking for a business-minded full-stack developer with superior skills in JavaScript, React.js and a solid base of back-end technologies (e.g. C#, Java, python). A self-starter with an appetite for putting out innovative product in a fast-paced agile environment is preferred.\n_____________________________________________________________________________________________\nAt Street Diligence you will:\nWork with the development team to create innovative solutions and applications (full-stack)\nImplement solid front ends for client facing and internal websites using Javascript/ES8, React.js, Redux, etc.\nTake a UI design or wireframe, with functional specs, and build working apps to fit\nBuild backend microservices for applications and general back-end jobs, primarily in C#/.NET\n\nAbout you:\n\xc2\xb7 Excited about working at a fintech startup & bring unique software to market\n\xc2\xb7 Deep understanding of React & Redux coding and experience with JavaScript and ES6/7/8\n\xc2\xb7 Experience with server-side application coding, preferably C#, ASP.NET MVC, .NET Core, SQL Server\n\xc2\xb7 Able to deliver high quality browser UI/UX to clients\n\xc2\xb7 Experienced with Agile development\n_____________________________________________________________________________________________\nAbout Street Diligence\nStreet Diligence (www.streetdiligence.com) is a high-growth, well-funded venture with an innovative product offering and ambitious expansion plans. Our software platform is used by leading financial institutions and corporations to analyze and negotiate advantageous terms in dense legal and financial contracts.'"
Software Engineer,Huxley,"New York, New York, United States","b'What you\xe2\x80\x9dll do:\nCreate software that\xe2\x80\x99s extensible, reusable and meets desired architectural objectives\nPerform reviews and ensure exceptional cloud platform quality\nBuild robust, lasting, and scalable products \nBe challenged to think out of the box to solve complex problems\nContribute ideas to existing and future technical plans\n\nMinimum qualifications:\nBS/BA in a technical field such as Computer Science or equivalent experience\n3+ years of software development experience\nExperience with backend services or distributed systems'"
Programmer/Analyst,Change Healthcare,New York City Metropolitan Area,"b'Programmer/Analyst 3\n  The position involves the analysis, design, documentation, development, testing, and implementation activities related to development and modifications to existing healthcare systems. The Programmer/Analyst will design, build, and maintain software components for the Claims Adjudication systems, Care Coordination systems, and related healthcare applications. This candidate should have a strong understanding of the Trizetto/Cognizant Facets system.\n  Job Responsibilities of the Programmer/Analyst:\n\xc2\xb7         Participate in the full software development life cycle (AGILE) from requirements analysis through test, release and maintenance\n\xc2\xb7         Maintain and resolve issues with existing healthcare software components providing quality solutions\n\xc2\xb7         Participate in code and design reviews\n\xc2\xb7         Interface with the Business Analysis and Quality Assurance teams to ensure accurate delivery of project requirements and compliance with standards, code quality and accepted conventions\n\xc2\xb7         Provide feedback to business units regarding process improvements for engaged developments\n\xc2\xb7         Travel estimated to be less than 5%\n  Key Responsibilities of the Programmer/Analyst:\n\xc2\xb7         Ensure the successful insertion of data into various healthcare applications and processes\n\xc2\xb7         Create of reports for deltas encountered\n\xc2\xb7         Create automated/scheduled processes to ensure contractual obligations are fulfilled\n  Requirements / Required Knowledge and Skills of the Programmer/Analyst:\n\xc2\xb7         3 years of software development experience in a .Net environment (C#.Net, VB.Net, or ASP.Net)\n\xc2\xb7         Experience working with Trizetto/Cognizant Facets\n\xc2\xb7         Proficient with T-SQL\n  Preferred Skills of the Programmer/Analyst:\n\xc2\xb7         C# development experience\n\xc2\xb7         Microsoft Team Foundation Server knowledge\n\xc2\xb7         Ability to be self-motivated and a creative problem solver while working independently\n\xc2\xb7         Strong written and verbal communication skills\n\xc2\xb7         Ability to maintain confidentiality with sensitive customer and internal information\n\xc2\xb7         Strong technical aptitude and ability to research, document and solve complex issues independently\n  Education:\n\xc2\xb7         Bachelor\xe2\x80\x99s degree in Computer Science'"
Software Engineer,Zocdoc,"New York City, NY, US","b""We are looking for a Software Engineer (SE) to join our engineering team at Zocdoc! As an SE at Zocdoc you\xe2\x80\x99ll balance individual contribution with mastering best practices and collaborating with your peers. You\xe2\x80\x99ll take ideas from inception to reality by rapidly building prototypes, iterating and releasing them. You\xe2\x80\x99ll build scalable products to make a simple and efficient healthcare experience for patients, providers, and your fellow Zocdocr\xe2\x80\x99s.\n\nWhat You\xe2\x80\x99ll Do\nContribute across the stack with technologies like React, Scala, Node.js and C#. Build products designed to scale quickly like new patient interactions, native advertising technology and new functionality that helps doctors optimize their Zocdoc experience.\nShip new features to millions of users autonomously, with fully automated continuous integration and deployment. Work with industry leading technologies across AWS in a scalable and resilient microservice environment.\nCollaborate with our agile team of dedicated and brilliant engineers, product managers, and designers. Share and learn through our technology guilds, design and code review processes, and teams that love to explore new ideas and work together!\n\n\nWhat's Required\nA natural curiosity and passion for technology. You have a sound foundation in computer science fundamentals and are excited to deepen your coding and OO design skills.\nYou work well on agile teams and value open communication, conflict resolution and real time feedback that makes both you and your team better.\nYou understand the software development lifecycle and have built and deployed client facing web applications that scale.\n3+ years of professional back-end development experience. Knowledge of OOP, FP, and React are all a plus, as is experience writing automated tests.\nComputer Science or related degree preferred."""
Software Engineer,The Orchard,"New York City, NY, US","b""Overview\n\nThe Orchard is a leading music distribution company operating in over 40 markets worldwide - distributing music from independent artists including Ozuna, Skepta, Jorja Smith, John Prine, and Kelsea Ballerini. With cutting edge operations and an unparalleled global team, The Orchard partners with labels of all sizes to make their music and video available across hundreds of digital and physical retailers around the world. At The Orchard, the focus is to provide a comfortable, social and engaging environment to encourage productivity and creativity.\nThe Orchard is hiring a Software Engineer to join our NYC office.\n\nResponsibilities\nBuild amazingly crafted software and systems to provide our clients with a cutting-edge digital media management, delivery, and reporting/analytics suite.\nParticipate in ongoing Sony platforms integration efforts to deliver next generation, full service distribution products.\nCollaborate with a talented team of engineers and designers.\nWork with new technology and tools in a highly-collaborative, Agile environment.\nUse industry standards and adopt new technologies to manage big data transformations and analysis.\nAdvocate for best schema designs to manage Orchard's master data to ensure scalability and flexibility.\nQualifications\nFull stack proficiency. We are polyglots, currently using Python, PHP and Ruby but open to the best tool for the job. Check out http://stackshare.io/the-orchard for a better idea of what we're using.\nFamiliarity with design patterns. Experience with microservices a plus.\nAgile & results-focused. Ability to work effectively on small, cross-functional teams following Agile development methodology (Kanban, Scrum).\nExperience designing and implementing scalable ETLs.\nExperience designing and consuming RESTful APIs.\nFamiliarity with relational databases and NoSQL databases.\nAbility to implement XHTML/HTML5, CSS, and Javascript quickly and effectively.\nFamiliarity with AWS is a huge plus (DynamoDB, Redshift, SWF, Lambda).\nExcellent verbal and written communication skills.\nLove for music and film a plus.\nAbout The Orchard\n\nThe Orchard is a leading music distribution company operating in over 40 markets worldwide. With a comprehensive artist & label services offering including full-service marketing, sync licensing, comprehensive video services, transparent data analysis, advertising, rights management, digital and physical distribution and more, The Orchard empowers creators and businesses to grow and adapt in the dynamic global industry. For further information, visit www.theorchard.com.\nThe Orchard is committed to providing equal employment opportunity for all persons regardless of age, disability, national origin, race, color, religion, sex, sexual orientation, gender, gender identity or expression, pregnancy, veteran or military status, marital and civil partnership/union status, alienage or citizenship status, creed, genetic information or any other status protected by applicable federal, state, or local law."""
Software Engineer - C++,The Bachrach Group,Greater New York City Area,"b""We are working directly with the head of development at an Investment Bank located in midtown, Manhattan. They are looking for a highly motivated, talented and responsible software engineer with a strong C++ background to join our cross product algorithmic trading development team in NYC. \n\nYou will have the opportunity to make significant contributions to our platform and help define our product's strategic direction through thoughtful design and solid development.\n\nOur team models complex data structures, patterns and relationships to build well architected low-latency algorithmic execution strategies, and have a passion for high quality standards. \n\nSkills and background:\nRequired: \nExpert C++ programming skills (OOP, Templates, Design patterns, Data structures)\nDeep knowledge of the multithreaded programming, IPC and linux internals\nStrong analytical and problem solving skills with a proactive attitude to own issues and solve them\nAbility to work independently and a strong desire to automate and optimize code"""
Software Engineer,ICS,"Manhattan, New York, United States","b'I have the following long-term assignment in Manhattan, NYC.  Great  rate, 6 months+ extensions (could last 2-3 years)\n\nThe individual will be responsible for integrations, upgrades, data migration, testing, and implementation, of Student Engagement and Career Services Systems like - OrgSync, Engage -Campus Labs, Handshake, PeopleGrove etc. The individual will create work plans, delegate tasks, ensure plans are implemented without defects, review code for function and structure, test code to ensure the quality of deliverables, provide clarification and guidance on implementation standards and decisions.\n\nThe software engineer leads a team of design-focused software developers across project teams to implement technology solutions. (S)he advocates and supports developer growth and training in new development technologies.\n\nSoftware Development: Develop new software solutions utilizing advanced data structures, relational database modeling and cross-platform web technologies in order to support and streamline current business practices.\n\n\n\n\nQualifications\n\n1)  Bachelor of Science from an accredited college or university in Computer Science, Information Systems or an equivalent combination of education and work experience.\n\n2)  Min 5 years of related experience with team-based software development, virtual environments, and backend application development.\n\n3)  Hands-on experience with one of any cloud platforms such as AWS, GCP or Azure.\n\n4)  Experience in designing scalable and fault tolerant architectures using a preferred cloud platform.\n\n5)  Experience with container technologies(docker and/or kubernetes).\n\n6)  Hands-on experience with a compiled language(Java/GoLang)\n\n7) Familiarity with any one of scripting languages such as Python, Javascript and Bash\n\n8)  Familiarity with NoSQL databases, especially MongoDB/Dynamo, is a plus.'"
"Consultant, Software Engineer, Manufacturing",GForce Life Sciences,"Princeton, New Jersey, United States","b'Summary\nOur client, a global medical device manufacturer, has engaged GForce Life Sciences to identify a Clinical Project Lead who will be responsible for various aspects of assigned clinical studies, from protocol drafting through study summary and final report.\n\nDuties / Expectations of Role\nDesign, Implement and test software for embedded medical products in C/C++11.\nDesign and Implement Unit tests for the product software that the candidate will generate.\nWrite and maintain software design document. UML experience is a plus.\nFamiliar with software design pattern.\nStrong experience with Object Oriented Design concepts.\nWorked in an Agile/Scrum development process environment.\nInvestigate internal process /procedure issues by using system level knowledge of the interactions between the product\xe2\x80\x99s electronics, software and mechanics.\n\nMandatory Requirements\nBachelor Degree in Computer Science.\nMinimum 2+ years of experience\nThe candidate will be expected to have experience with Linux/Unix and Windows programming techniques and concepts; experience with Git source control; strong C/C++ programming skills; experience in programming with at least one application framework; excellent documentation and effective communication skills; familiarity with object-oriented design and programming techniques; SQL/ORM web development and web services experience is highly desired\n\nAdditional Notes\nThis position will be based in Northeastern New Jersey\n\nTerm & Start\nASAP\n6+ months'"
Quantitative Software Engineer,Jacobs Levy Equity Management,"Florham Park, New Jersey","b'Jacobs Levy Equity Management, an institutional asset manager located in Florham Park, NJ, is seeking Quantitative Software Engineers to play a key role in contributing to the quantitative investment processes.\n  Be part of a team that leads our future. Our engineers are responsible for the design, implementation, optimization, and testing of our proprietary quantitative investment systems. You will have a great opportunity to build a next generation system for global portfolio management, work with large data sets, and solve challenging business problems.\n  As part of a team, Primary Responsibilities include:\nImplement and enhance quantitative models, proprietary portfolio construction, and optimization techniques with Research and Portfolio Management teams\nArchitect and manage global data repository incorporating millions of financial and market data points\nCreate high performance simulation and optimization engines\nDevelop and manage investment workflow management systems\nBuild and extend analytics and reporting platforms\n  Requirements Include:\nMS/PhD in Computer Science, Engineering, Statistics, or related discipline\nMust have strong programming skill in Python or Julia, experience with NumPy/Pandas or similar quantitative software a plus\nMust have hands-on programming Experience in C/C++\n2+ years experience with database technologies like SQL server, Oracle, etc.\nOutstanding coding, debugging, and analytical skills\nAn aptitude for math and statistics\nKnowledge in .NET and C# is a plus\nPassionate about solving complex business, data, and technical challenges\nContributions to open source software a big plus\n  Jacobs Levy Equity Management focuses exclusively on managing equity portfolios for institutional clients. We encourage intellectual curiosity and offer a good work/life balance, competitive compensation, and a collegial environment. '"
"Software Engineer, Data Engineering",Lyft,"New York City, NY, US","b""At Lyft, our mission is to improve people\xe2\x80\x99s lives with the world\xe2\x80\x99s best transportation. To do this, we start with our own community by creating an open, inclusive, and diverse organization.\n\nHere at Lyft, Data is the only way we make decisions. It is the core of our business, helping us create a transportation experience for our customers and providing insights into the effectiveness of our product launch & features.\n\nAs a Data Engineer at Lyft, you will be a part of an early stage team that builds the data transport, collection, and storage, and exposes services that make data a first-class citizen at Lyft. We are looking for a Data Engineer to build a scalable data platform. You'll have ownership of our core data pipeline that powers Lyft\xe2\x80\x99s top line metrics; You will also use data expertise to help evolve data models in several components of the data stack; You will help architect, building, and launching scalable data pipelines to support Lyft\xe2\x80\x99s growing data processing and analytics needs. Your efforts will allow access to business and user behavior insights, using huge amounts of Lyft data to fuel several teams such as Analytics, Data Science, Marketplace and many others.\n\nYou will report to a Data Engineering Manager.\n\nResponsibilities\nOwner of the core company data pipeline, responsible for scaling up data processing flow to meet the rapid data growth at Lyft\nEvolve data model and data schema based on business and engineering needs\nImplement systems tracking data quality and consistency\nDevelop tools supporting self-service data pipeline management (ETL)\nSQL and MapReduce job tuning to improve data processing performance\n\n\nExperience\nExperience with Hadoop (or similar) Ecosystem (MapReduce, Yarn, HDFS, Hive, Spark, Presto, Pig, HBase, Parquet)\nProficient in at least one of the SQL languages (MySQL, PostgreSQL, SqlServer, Oracle)\nGood understanding of SQL Engine and able to conduct advanced performance tuning\nStrong skills in scripting language (Python, Ruby, Bash)\n1+ years of experience with workflow management tools (Airflow, Oozie, Azkaban, UC4)\nComfortable working directly with data analytics to bridge Lyft's business goals with data engineering\n\n\nBenefits\nGreat medical , dental, and vision insurance options.\nIn addition to 11 observed holidays , salaried team members have unlimited paid time off, hourly team members have 15 days paid time off.\n401(k) plan to help save for your future\n18 weeks of paid parental leave. Biological, adoptive, and foster parents are all eligible\nMonthly commuter subsidy to cover your transit to work & 20% of all Lyft rides\n\n\nLyft is an Equal Employment Opportunity employer that proudly pursues and hires a diverse workforce. Lyft does not make hiring or employment decisions on the basis of race, color, religion or religious belief, ethnic or national origin, nationality, sex, gender, gender identity, sexual orientation, disability, age, military or veteran status, or any other basis protected by applicable local, state, or federal laws or prohibited by Company policy. Lyft also strives for a healthy and safe workplace and strictly prohibits harassment of any kind. Pursuant to the San Francisco Fair Chance Ordinance and other similar state laws and local ordinances, and its internal policy, Lyft will also consider for employment qualified applicants with arrest and conviction records."""
