title,company,location,job description
Jr. Software Engineer - Technology Associate Program,Chubb,"Whitehouse Station, NJ, US","b""By Joining The Technology Associate Program, You Will Be Offered The Following\n\nChubb is looking for individuals passionate about technology to join our Technology Associate Program (TAP). The Technology Associate Program is a two year program geared to early career professionals to help them develop expertise and technical acumen as a technologist.\nTechnical training to enhance your skills within your chosen discipline\nBusiness acumen and professional development training specific to IT and an understanding of our broader industry\nIT Mentorship Program\nNetworking opportunities with IT and Business leaders and TAP associate peers.\nHackathons\n\nPosition Summary\n\nThe Jr. Software Engineer will assist in developing the next generation user interfaces, apps and APIs. This role will be a contributor to agile teams by providing services that ensure Chubb is aligning technology efforts with business information needs. The person selected will learn agile methodology of software development, web application development, API development using the latest technologies and framework like Angular, ExtJS, C#, Microsoft Azure etc.\n\nWhat about you?\nYou are highly collaborative, creative, and intellectually curious individual who is passionate about software engineering and supporting cutting-edge computing capabilities.\nYou are able work well, both individually and within a team.\nYou are adaptable and able to overcome technical challenges\nYou are a self-starter and motivated to learn and succeed.\n\nResponsibilities\nWorks with the business and technology team members to identify opportunities for improvement, and to validate, refine and prioritize user stories.\nParticipates in design and code reviews, performance tests, test automation, and unit test strategies.\nCollaborates with peers and learn from existing solutions\nProvide strong support in cultivating an environment that encourages the use of data to support problem solving, critical thinking, and innovation.\nWorks in a scrum environment to ensure quick delivery\n\nDesired Qualifications\nBasic exposure / experience with code development (C#, Angular, Javascript, HTML, CSS, etc.).\nWorking knowledge of Excel, PowerPoint, and Word is required.\nEnergetic, able to build and sustain long-term relationships across a multitude of stakeholders in a fast paced, multi-national work environment.\nPossess strong verbal and written communication skills\nBachelor's degree required\n\nBonus Skills\nExposure or experience with Node.JS.\nExposure or experience with Services/APIs\nExperience in developing apps in Cloud Platforms such as Microsoft Azure or Amazon Web Services\nUnderstanding of the SAFe Agile development methodology\n\nEEO Statement\n\nAt Chubb, we are committed to equal employment opportunity and compliance with all laws and regulations pertaining to it. Our policy is to provide employment, training, compensation, promotion, and other conditions or opportunities of employment, without regard to race, color, religious creed, sex, gender, gender identity, gender expression, sexual orientation, marital status, national origin, ancestry, mental and physical disability, medical condition, genetic information, military and veteran status, age, and pregnancy or any other characteristic protected by law. Performance and qualifications are the only basis upon which we hire, assign, promote, compensate, develop and retain employees. Chubb prohibits all unlawful discrimination, harassment and retaliation against any individual who reports discrimination or harassment.\n\nWork Locations\n\nJersey City\n\nOther Locations\n\nUSA-New Jersey-Whitehouse Station\n\nJob\n\nInformation Technology\n\nTravel\n\nNo\n\nJob Posting\n\nMar 19, 2020, 3:08:32 PM"""
Software Engineer,Ridgeline,"New York City, NY, US","b""As a Ridgeline Software Engineer, you'll have the unique opportunity to build high-quality, creative business applications in a fast-moving, progressive work environment. You'll think outside the box and add your own genius, passion, and interests to the software development lifecycle.\n\nWhat will you do?\nContribute business insight, design skills, and technical expertise to a team where design, strategy, and engineering collaborate closely\nBe involved in the entire software development process, from requirements and design reviews through the implementation of a new product\nImpact a developing tech stack based on modern front-end frameworks and cost-efficient utilization of AWS back-end services\nParticipate in the creation and construction of developer-based automation that leads to scalable, high-quality applications customers will depend on to run their businesses\nThink creatively, own problems, seek solutions, and communicate clearly along the way\nContribute to a collaborative environment deeply rooted in learning, teaching, and transparency\n\n\nDesired Skills And Experience\n2+ years of professional work experience in a software engineering role post graduation (this is not a new grad role)\nBachelor's Degree in Computer Science, Information Science, or a related discipline\nStrong knowledge of data structures, algorithms, and architectural patterns\nExpertise in one or more of the following languages: Golang, Python, Java\nWorking knowledge or expertise in JavaScript, HTML, CSS\nWillingness to learn about new technologies while simultaneously developing expertise in a business domain/problem space\nUnderstand the value of automated tests at all levels\nAbility to focus on short-term deliverables while maintaining a big-picture perspective\nAn aptitude for problem solving\nAbility to communicate effectively with colleagues at all levels\nSerious interest in having fun at work\n\nNice-to-Haves\nExperience building responsive Web interfaces using frameworks such as React and Redux\nUnderstanding of building back-end infrastructure using AWS offerings such as Aurora, Lambda, and S3\nExperience with agile development methodologies\nBackground in design, economics, or business\n\n\nAbout Ridgeline\n\nRidgeline was founded by Dave Duffield (co-founder and former CEO of both PeopleSoft and Workday) in late 2017 to develop enterprise software for the investment management industry. We are building an end-to-end cloud platform on a modern infrastructure using AWS, serverless technologies, and working with modern frameworks\n\nHeadquartered in the Lake Tahoe Basin with an office in the heart of Manhattan, Ridgeline employees enjoy the best of both worlds: the tranquility of Lake Tahoe and the energy of the country's financial epicenter.\n\nOur unconditional commitment to our customers and each other creates an environment of respect, trust, and collaboration; we lift each other up in the pursuit of shared goals. If this people-first perspective is important to you, perhaps you're one of us.\n\nRidgeline is proud to be a community-minded, discrimination-free equal opportunity workplace.\n\nRidgeline processes the information you submit in connection with your application in accordance with the Ridgeline Applicant Privacy Statement. Please review the Ridgeline Applicant Privacy Statement in full to understand our privacy practices and contact us with any questions."""
Software Development Engineer I - Mastercard Labs,Mastercard,"New York City, NY, US","b""Who is Mastercard?\n\nWe are the global technology company behind the world\xe2\x80\x99s fastest payments processing network. We are a vehicle for commerce, a connection to financial systems for the previously excluded, a technology innovation lab, and the home of Priceless\xc2\xae. We ensure every employee has the opportunity to be a part of something bigger and to change lives. We believe as our company grows, so should you. We believe in connecting everyone to endless, priceless possibilities.\n\nJob Title\n\nSoftware Development Engineer I - Mastercard Labs\n\nOverview\n\nIn Mastercard Labs we are currently looking for a Software Engineer passionate about innovation and new technologies to join our NYC R&D team and help Mastercard build the future of payments and commerce.\n\nIn this role you will have the opportunity to work on our New Interfaces team, which explores how emerging human-computer interfaces such as Augmented Reality, Virtual Reality and Natural Interfaces such as voice or vision will shape the future of payments and commerce.\n\nThe team\nOur team is built on a foundation of research and development, mining innovation internally, innovating new product lines with emerging technology, managing new products from inception to market validation and engaging strategically with startups to shape the future of commerce with and for our customers.\n\nYou will be working alongside a skilled group of technologists in the Research and Development team based in our NYC TechHub. This team focuses primarily on Blockchain and New Interfaces projects and its part of our wider Mastercard Labs network with teams in Singapore, Dublin, Nairobi and Pune.\n\nFind Out More About Mastercard Labs\n\nhttps://www.youtube.com/watch?v=w7FvjIQx_tg\n\nRole\nObjectives\nLeverage New Interfaces and Blockchain technologies to design, build and launch robust, scalable and elegant digital products.\nKeep up to date on technology trends and assess relevance in the payments space.\nAssess the technical feasibility of new product ideas by developing prototypes and proof of concepts.\nPropose new approaches to solve tough technical and product challenges.\nStay up to date with the latest trends and technologies in your research space.\nParticipate in hackathons and design thinking workshops for other Mastercard Labs initiatives.\nAll About You\nPrior experience as a full stack engineer.\nStrong software development fundamentals and agile methodologies.\nTeam player, with the ability to work independently to drive results.\nOpen to learning and evaluating new technologies and frameworks.\nNice to Have\nExperience with Java and Springboot.\nExperience designing and implementing web API.\nExperience with OpenAPI (Swagger).\nFamiliar with Docker and Kubernetes.\nFamiliar with Typescript, Angular and Node.js.\nFamiliar with CI/CD and DevOps concepts.\nFamiliar with Git and Jenkins.\nExperience with Unity, Blender or other 3D Design and animation technologies.\nExperience with Artificial intelligence, Machine Learning, Natural Language Processing, Voice Recognition or Computer Vision.\nExperience with Augmented Reality or Virtual Reality.\nEducation\nBachelor's degree in Computer Science, Information Systems, Information Technology, Engineering or equivalent work experience.\n\nMastercard is an inclusive Equal Employment Opportunity employer that considers applicants without regard to gender, gender identity, sexual orientation, race, ethnicity, disabled or veteran status, or any other characteristic protected by law.\n\nIf you require accommodations or assistance to complete the online application process, please contact reasonable.accommodation@mastercard.com and identify the type of accommodation or assistance you are requesting. Do not include any medical or health information in this email. The Reasonable Accommodations team will respond to your email promptly."""
Software Engineer,Financial Holdings Company,New York City Metropolitan Area,"b'We are a technology platform built to empower financial advisors and their clients by providing novel products and services that blend cutting-edge technology and financial innovations, all backed by a successful financial holdings company. The only non-negotiables for working with us are curiosity, low ego, and a deep commitment to personal improvement.\n\nThis is a rare opportunity to join a small, dynamic, fast-paced and collaborative technology startup with exceptional growth potential and fantastic teammates, while benefiting from the support of a forward thinking, successful parent organization in a truly unique working environment.\n\nThe ideal candidate:\nYou are an engineer, first and foremost. You can rapidly plan solutions, write code and build product that will scale to millions of users. You thrive in a work environment that requires strong problem solving skills and independent self-direction, coupled with an aptitude for team collaboration and open communication. You are a strong communicator, explaining complex technical concepts to designers, support, and other engineers is no problem for you.\n\nA BS/MS/PhD in Computer Science or the equivalent is nice to have, but the most important requirement is significant independent programming experience as demonstrated by your GitHub account, personal projects, academic publications, or startup success. You possess strong computer science fundamentals: data structures, algorithms, programming languages, distributed systems, and information retrieval. And finally, your accomplishments are much more important than your paper credentials.\n\nRequirements:\nBS/MS/PhD in Computer Science/Math/Physics/Engineering\nAt least 5 years of software engineering experience\nStrong experience with Python and/or Java\nStrong experience with Pandas, NumPy, SciPy and/or Numba\nSolid understanding of modern database technology (Redis, Postgres, RedShift, BigQuery)\nAbility to work independently and as part of a fast moving team\nReady to learn, but just as ready to teach\n\nNice to haves:\nNoSQL experience (We use DynamoDB and Redis)\nHeroku/Docker experience\nOpen source contributions\nMobile development experience\nJS, React, and Swift\nInterest in financial planning and fintech/insurtech'"
Software Engineer,The New York Times,"New York City, NY, US","b'We are a technology platform built to empower financial advisors and their clients by providing novel products and services that blend cutting-edge technology and financial innovations, all backed by a successful financial holdings company. The only non-negotiables for working with us are curiosity, low ego, and a deep commitment to personal improvement.\n\nThis is a rare opportunity to join a small, dynamic, fast-paced and collaborative technology startup with exceptional growth potential and fantastic teammates, while benefiting from the support of a forward thinking, successful parent organization in a truly unique working environment.\n\nThe ideal candidate:\nYou are an engineer, first and foremost. You can rapidly plan solutions, write code and build product that will scale to millions of users. You thrive in a work environment that requires strong problem solving skills and independent self-direction, coupled with an aptitude for team collaboration and open communication. You are a strong communicator, explaining complex technical concepts to designers, support, and other engineers is no problem for you.\n\nA BS/MS/PhD in Computer Science or the equivalent is nice to have, but the most important requirement is significant independent programming experience as demonstrated by your GitHub account, personal projects, academic publications, or startup success. You possess strong computer science fundamentals: data structures, algorithms, programming languages, distributed systems, and information retrieval. And finally, your accomplishments are much more important than your paper credentials.\n\nRequirements:\nBS/MS/PhD in Computer Science/Math/Physics/Engineering\nAt least 5 years of software engineering experience\nStrong experience with Python and/or Java\nStrong experience with Pandas, NumPy, SciPy and/or Numba\nSolid understanding of modern database technology (Redis, Postgres, RedShift, BigQuery)\nAbility to work independently and as part of a fast moving team\nReady to learn, but just as ready to teach\n\nNice to haves:\nNoSQL experience (We use DynamoDB and Redis)\nHeroku/Docker experience\nOpen source contributions\nMobile development experience\nJS, React, and Swift\nInterest in financial planning and fintech/insurtech'"
"Software Engineer, Buyer Promise",Etsy,"Brooklyn, NY, US","b'Company Description\n\nAs an Etsy employee, you can do the work you love, be yourself, and make an impact in the lives of millions. Our commitments to diversity and inclusion, team culture and the spaces where we work all reflect our mission to keep commerce human.\n\nJob Description\n\nEtsy is hiring a Full Stack Engineer to join our Buyer Promise team. This role is located in our Brooklyn HQ.\n\nAbout The Team\n\nThe Buyer Promise team supports the Free Shipping Guarantee at Etsy. We work at the intersection of adding new features to the buyer experience, and building out thoughtful experiments that help us make better decisions for future improvements to our products.\n\nThe Buyer Promise team is very experiment driven, and we use the data we get from our in-house analytics tools to capture information and gain insights from the experiments we run to drive a huge business impact. We are a team that works across the different systems that power Etsy.com, allowing us to learn deeply about different stacks within Etsy Engineering in our day-to-day work.\n\nIn the past year, we\xe2\x80\x99ve shipped a lot of work that we\xe2\x80\x99re proud of, including updates to search ranking, new modules serving item recommendations on the listing page, and large scale modifications to how shipping cost is determined on Etsy.\n\nOur production systems rely on PHP, JavaScript, Java, and Scala. We are proud to have an engineering culture that encourages career growth and learning. You can learn more about our philosophies, tools, and some of the challenges we\xe2\x80\x99ve been solving on our Engineering blog: http://codeascraft.com/\n\nWe use a language-agnostic approach in our interviews.\n\nAbout The Role\n\nAs a Software Engineer on the Buyer Promise team, you will do the following:\nHelp plan and develop innovative solutions to complex business problems. The Free Shipping Guarantee is new to Etsy as of 2019, and there is tremendous opportunity for us to grow.\nContribute at all levels of our web application stack, ranging from front-end web interfaces (HTML, CSS, JavaScript, React) to back-end technologies (PHP, MySQL, Memcache).\nCollaborate with Engineers, Product Managers, and Designers to address user feedback and build new and meaningful features.\n\nQualifications\n\nAbout You\nYou have experience operating in a full-stack environment.\nYou find value in empowering data-driven decision making and building out experiments that enable big product and design decisions.\nYou understand the importance of testing and monitoring the systems that your team is responsible for, and have opinions on how to improve the observability of systems you encounter.\nYou have a particular interest in developing products on the back-end, but still want to have full stack exposure.\nYou have a \xe2\x80\x9cleave it better than you found it\xe2\x80\x9d attitude, and are willing to work with and improve on code you did not originally write.\nYou enjoy thinking about the implications of your work on end users. You are comfortable collaborating with Product Managers and Designers to ensure that you\xe2\x80\x99re delivering impactful product features.\n\nAdditional Information\n\nAt Etsy, we believe that a diverse, equitable and inclusive workplace makes us a more relevant, more competitive, and more resilient company. We welcome people from all backgrounds, ethnicities, cultures, and experiences. Etsy is an equal opportunity employer. We do not discriminate on the basis of race, color, ancestry, religion, national origin, sexual orientation, age, citizenship, marital or family status, disability, gender identity or expression, veteran status, or any other legally protected status. We will ensure that individuals with disabilities are provided a reasonable accommodation to participate in the job application or interview process, to perform essential job functions, and to receive other benefits and privileges of employment. While Etsy supports visa sponsorship, sponsorship opportunities may be limited to certain roles and skillsets.'"
Software Engineer,EagleView,"Monroe, NY, US","b'Mixing technology, data, and first-in-class innovation, EagleView \xc2\xae is not only leading the property data analytics market, but also changing lives along the way. Come join us and make great things happen EagleView is a fast-growing technology company driving game changing innovation in multibillion-dollar markets such as property insurance, energy, construction, and government. Leveraging 17 years of the most advanced aerial imaging technology in the world, along with the most recent advances in machine learning and AI, EagleView is fundamentally transforming how our customers do business. At EagleView, we believe that making our culture engaging and empowering are keys to success. Our kitchens are stocked 24/7; social, athletic, and wellness opportunities are plentiful; and the growth, education, and potential of employees is a top priority, making EagleView a \xe2\x80\x9cBest Place to Work\xe2\x80\x9d for more than five years running. Job Description As a Software Engineer you will join our image processing applications development team as an individual contributor. As a member you will be responsible for designing and developing the user interface and experience for our internal image processing application pipeline. You will work closely with our image processing teams and operations organizations to translate stakeholder needs into user requirements. We are looking for an individual who will enjoy working as part of a dynamic team and is enthusiastic about making a difference in the future of out company. Skills & Requirements Demonstrate a working knowledge the HTTP stack and Browser limitations Experience with Javascript and common modern UI frameworks (React, Vue, Webpack) as well as HTML/CSS Passion for good modern UI/UX design and engineering Demonstrate software engineering best practices (e.g. unit testing, code reviews, design documentation, and continuous integration). Experience with GIS and Image processing EagleView\xc2\xae offers competitive pay and robust benefit plans along with the opportunity to grow your career in a fast-paced, fun and casual environment. EagleView and its subsidiaries are committed to leveraging the talent of a diverse workforce to create great opportunities for our business and our people. EOE/AA. Minority/Female/Disability/Veteran. Mixing technology, data, and first-in-class innovation, EagleView \xc2\xae is not only leading the property data analytics market, but also changing lives along the way. Come join us and make great things happen EagleView is a fast-growing technology company driving game changing innovation in multibillion-dollar markets such as property insurance, energy, construction, and government. Leveraging 17 years of the most advanced aerial imaging technology in the world, along with the most recent advances in machine learning and AI, EagleView is fundamentally transforming how our customers do business. At EagleView, we believe that making our culture engaging and empowering are keys to success. Our kitchens are stocked 24/7; social, athletic, and wellness opportunities are plentiful; and the growth, education, and potential of employees is a top priority, making EagleView a \xe2\x80\x9cBest Place to Work\xe2\x80\x9d for more than five years running. Job Description As a Software Engineer you will join our image processing applications development team as an individual contributor. As a member you will be responsible for designing and developing the user interface and experience for our internal image processing application pipeline. You will work closely with our image processing teams and operations organizations to translate stakeholder needs into user requirements. We are looking for an individual who will enjoy working as part of a dynamic team and is enthusiastic about making a difference in the future of out company. Skills & Requirements Demonstrate a working knowledge the HTTP stack and Browser limitations Experience with Javascript and common modern UI frameworks (React, Vue, Webpack) as well as HTML/CSS Passion for good modern UI/UX design and engineering Demonstrate software engineering best practices (e.g. unit testing, code reviews, design documentation, and continuous integration). Experience with GIS and Image processing EagleView\xc2\xae offers competitive pay and robust benefit plans along with the opportunity to grow your career in a fast-paced, fun and casual environment. EagleView and its subsidiaries are committed to leveraging the talent of a diverse workforce to create great opportunities for our business and our people. EOE/AA. Minority/Female/Disability/Veteran.'"
