title,company,location,job description
b'Frontend Developer',b'Parts Town',"b'Addison, Illinois, United States'","b""See What We\xe2\x80\x99re All About\nAs the fastest growing distributor of foodservice equipment parts, we like to do things a little differently. We believe our team should be like family. Not like a second cousin, twice removed, but more like the family you choose to be with every day. First, you have to demonstrate our core values and keep safety as your #1 priority, that\xe2\x80\x99s key. But we\xe2\x80\x99re also looking for unique enthusiasm, high integrity, courage to embrace change\xe2\x80\xa6and if you know a few jokes, that puts you on the top of our list.\n Do you have a genius-level knowledge of foodservice equipment parts? If not, no problem! We\xe2\x80\x99re more interested in passionate people with fresh ideas from different backgrounds. That\xe2\x80\x99s what keeps us at the top of our game. We\xe2\x80\x99re proud that our workplace has been recognized for its growth and innovation on the Inc. 5000 list, eleven years in a row and the Crain\xe2\x80\x99s Fast 50 list seven times.\n If you\xe2\x80\x99re ready to roll up your sleeves, go above and beyond and put your ambition to work, all while having some fun, let\xe2\x80\x99s chat \xe2\x80\x93 Apply Today!\n Perks\nParts Town Pride \xe2\x80\x93 check out our culture !\nQuarterly profit sharing bonus\nFitness center, game room and on-site food market\nTeam member appreciation events and recognition programs\nVolunteer opportunities\nCasual dress code\nAll the traditional benefits like health insurance, 401k/401k match, employee assistance programs and time away \xe2\x80\x93 don\xe2\x80\x99t worry, we\xe2\x80\x99ve got you covered.\n\nThe Job at a Glance\nAs a Front End Web Developer (internally known as a Software Ninjaneer) you\xe2\x80\x99ll be responsible for bringing to life the desktop and mobile user experience for our customers. You get to build and fine tune the customer-facing user interface that generates hundreds of millions of dollars in revenue and helped make Parts Town an 11-time Inc. 5000 winner. You will leverage cutting edge UX technologies to develop and deploy never-before-seen capabilities to the foodservice industry. The websites you build and support will help fuel the incredible growth of Parts Town for years to come.\n A Typical Day\nDesign and develop UX features for Partstown.com and other supported websites that target our key customer segments and partners\nContinuously refine our development process to deliver value faster and improve the quality and sustainability of our applications\nAny other duties needed to help drive our Vision, fulfill our Mission and support our Core Values\nWorking from home flexibility is available\n\nTo Land This Opportunity\nYou have a Bachelor's Degree in Computer Science or a related field, or 3+ years relevant work experience\nYou are successfully practicing your skills of HTML, CSS, and JavaScript for more than 3 years\nYou have experience working on React/Angular applications.\nYou are mastering web application code design and architecture for more than 2 years\nYou are a Pro in 1 or more core languages like Java, C++, Python, Ruby, Node.js and version control software platforms like git, Subversion, Mercurial\nYou know all the \xe2\x80\x9chows\xe2\x80\x9d to convert a design document into a working user interface with no loss in fidelity\nYou are a wizard of usability principles, responsive web design, cross-browser compatibility, and HTML document architecture\nYou successfully delivered one or more production web applications (500+ users) using a contemporary JavaScript framework like Angular, React, Backbone, Ember, Meteor, jQuery\nYou\xe2\x80\x99re an all-star communicator and are fluent in English (both written and verbal)\nYou ask A LOT of questions \xe2\x80\x93 And you rarely get discouraged\nYou work well with small teams \xe2\x80\x93 You love collaborating with various teams to come up with the best solution, and people love having you involved in their projects\nYou have some other relevant experience \xe2\x80\x93 E-commerce and/or distribution experience is a plus\n About Your Future Team\nThe Ecommerce team is a highly capable group that embraces the rapid change that comes with incredible growth. We bring our whole selves to work each day - personality and all - in true Parts Town style.\n Parts Town welcomes diversity and as an equal opportunity employer, all qualified applicants will be considered regardless of race, religion, color, national origin, sex, age, sexual orientation, gender identity, disability or protected veteran status."""
b'Web Developer',b'VTEKH',"b'Buffalo Grove, IL, US'","b'Job Description\n\nWe are seeking a Web Developer. The job duties for the web developer include but are not limited to: Collaborate closely with design team to create beautiful, intuitive and effective user interface from scratch. Building custom web applications from scratch. Support and bug-fixing of existing web applications.\n\nThe web developer will possess knowledge of web standards, responsive design, and cross browser compatibility. Expereince with Javascript, jQuery, Ajax, Json is required. Expereince with backend development using PHP/MySql is required. Expereince with VB.Net or .Net is a plus. Working in a team environment is required.\n\nAttention: This is not a consulting or sub contracting position. It is a full time position working from our Buffalo Grove Office IL Strictly no third parties please.\n\nAre you fresh out of college?\n\nIf you have analytical skills, quick learner, love to code, Freshers can also apply for this position.\n\nWe also sponsor for the right candidate.\n\nIdeal candidate can write/ program everything from Scratch and interact with business users.\n\nJob Type: Full-time\n\nWe are working on Mortgage related projects from past 17 years. Our Mortgage IT division url: www.techniecode.com.'"
b'Web Application Developer',b'Keypath Education',"b'Schaumburg, Illinois, United States'","b'We are looking for the right developer to build applications for online learning\n\nThrough this opportunity you\xe2\x80\x99ll have a chance to impact students around the world. Keypath Education is making a global impact in online education. We are looking for a candidate that is passionate about technology with the skills to provide an incredible user experience for students.\n\nResponsibilities Include, But Are Not Limited To: \nWork in a creative team environment to build full stack applications for student engagement\nDevelop responsive html/CSS/JavaScript (jQuery) code to form page templates, prototypes and production code, that is performant and accessible across all common browsers\nProvide diligent user testing and ensure your work delivers an intuitive and memorable user experience\nAdvise on user interface best practices to meet performance and client requirements\nDevelop images for courseware through image creation/manipulation software packages\nDevelop animations and interactive elements to enhance student engagement within the online environment\nMentor Front End Web Developers\nContribute to continuous improvement\n\nThings That Should Be in Your Background:\nBachelor\xe2\x80\x99s degree preferred\nMinimum of 3+ years professional experience with PHP\nMinimum of 1+ years professional experience with Laravel or similar framework\nProficient in client-side technologies including (X)HTML5, CSS3, JavaScript (jQuery)\nDemonstrated experience in server-side development with PHP, Node, and other languages.\nDemonstrated experience in Database development with MySQL, PostgreSQL, MongoDB,  or equivalent\nGood working knowledge of Adobe Creative Suite with expertise in Photoshop and Illustrator in particular\nExperience in working collaboratively with wireframes and technical specifications for interactive websites\nStrong HTML skills, and an ability to create elegant, semantically clean mark-up\nStrong understanding of CSS, its cross-browser quirks and a keen eye for details\nDemonstrated experience in managing maintainable, scalable, cross-browser code that is a delight to experience on any device\nKnowledge of Web Accessibility Standards\nExperience working with learning management systems such as Blackboard, Moodle, Canvas and others is strongly preferred\nAbility to work with multiple deadlines and multiple projects simultaneously in a fast-paced, changing environment\nAbility to adapt and to solve problems proactively and creatively\nUnderstanding of the Higher Education Sector is preferred\n \n About Keypath Education:\n Keypath Education is dedicated to creating global access to high-quality online education by partnering with the world\xe2\x80\x99s best universities to launch and grow high-quality degree programs with its online program management (OPM) services. Through OPM partnerships, Keypath acts as an extension of the university\xe2\x80\x99s team, keeping its brand and academic rigor intact while accelerating the growth and quality of the university program portfolio and providing an exceptional student experience through industry-leading technology. Services provided include market research, capital investment, program development, marketing, student recruitment, retention and course development. The company supports more than 20+ partners and 80+ online programs worldwide via its offices and teams in the United States, Canada, the U.K. and Australia. Learn more at keypathedu.com.\n Why It Is So Great to Work at Keypath Education:\n Keypath offers a high-energy culture that is team-focused, data driven, challenging and exciting. We work hard, but our offices filled with people who like working together. People understand what is expected of them and are empowered to make the right decisions that achieve results in an ethical way.\n Benefits\nKeypath offers a comprehensive benefits package:\nMedical, dental and vision coverage\nLife insurance, disability and 401K\nGenerous paid leave policies\nTuition reimbursement program\nOnsite Fitness Center\n Note: The above statements outline the nature and level of work performed by individuals assigned to this position and are not intended to be an exhaustive list of all responsibilities and skills required. All employees may be required to occasionally perform duties outside of their normal responsibilities as needed.\n Keypath Education is an equal opportunity employer that does not discriminate against applicants or employees and ensures equal employment opportunity for all persons regardless of their race, creed, color, religion, sex, sexual orientation, pregnancy, national origin, age, marital status, disability, citizenship, military or veterans\xe2\x80\x99 status, or any other classifications protected by applicable federal, state or local laws. Keypath\xe2\x80\x99s equal opportunity policy applies to all terms and conditions of employment, including but not limited to recruiting, hiring, training, promotion, job benefits, pay and dismissal.'"
b'Web Developer',b'Zacks Investment Research',b'Greater Chicago Area',"b'Web Developer\nThe ideal candidate would have experience as an engineer and architect for object oriented solutions using PHP and Python, preferably with Oracle/MySQL/Postgres and Linux. Strong experience with engineering, developing and coding sites is a plus.\nThe developer will plan, research, develop logic, code, and test and deploy several web projects with minimal assistance. They will need to know how to build a web application from the ground up, as well as modify and build upon an existing codebase.\nRequirements:\n\n5+ Years in web development using PHP/Python for customer facing and/or commercial websites\n3+ years utilizing objects in PHP/Python\n3+ years utilizing object oriented design and development\n3+ years utilizing web frameworks such as Angular, Node, jQuery or others\nKnowledge of XHTML is required\nExperience in development and maintenance of applications and Web Services using LAMP\nUnderstanding API structures and REST architecture\nExperience interfacing with relational as well as NOSQL databases is a plus\nUnderstanding XML and JSON data structures\nAbility to read and understand database structures\nExperience in e-commerce applications development\nDemonstrated excellent analytical, decision-making skills and willingness to take on big challenges and solve complex problems\nAbility to think strategically about business issues, manage deadlines, drive closure between cross-group teams, and communicate recommendations\nAbility to make strategically-sound decisions with little information in an fast moving environment, and be able to influence change and drive process and structure\nExcellent communication, team-work and problem solving skills\nExperience working with trading and investment data is a plus\n '"
b'WEB API Developer',b'NIC INFOTEK',"b'Chicago, Illinois, United States'","b'Web API Developer\n6+ months\nRosemont, IL\nJob Address:\n8410 W Bryn Mawr Ave\nChicago, IL 60631\n\n\nThe top requirement is 5+ years of api , and ibm controld desk preferably experience.\n\nManger of team \xe2\x80\x9ctools and integration\xe2\x80\x9d\nConfiguration Management \xe2\x80\x93 systems they use to extract configuration data or do planning of the configuration network elements that support US cell wireless network\nFault Management \xe2\x80\x93 IBM net cool, understand what happened in the network and call attention to\n\nNEED: API dev to support product called IBM Control Desk\nOn operations team, entering data into IBM Control Desk \xe2\x80\x9cICD\xe2\x80\x9d\xe2\x80\x93 they want to push data into the system\nCustomized vertical solution using \xe2\x80\x9cIBM Maximal Platform\xe2\x80\x9d\nAPI Development Skills 5+ YEARS\n3 scale API Gateway SQL system platform\nHTML 5, Jython, XML 5\n\nOnsite M-F? In the future, yes\nStart Date: \xe2\x80\x9cyesterday\xe2\x80\x9d\n\nYears of experience: 5+ years API experience'"
b'Web Developer (Geoanalytics)',b'Brooksource',"b'Chicago, Illinois, United States'","b'Web Developer\nRemote\n\nBrooksource in Louisville, KY is seeking a Web Developer for a Fortune 100 client in the healthcare industry. You would be working with one of our best client relationships in a fast paced, high energy agile environment within the clients Integrated Data Engineering Advancement group. We are seeking a web developer that has experience or is willing to learn GeoAnalytics and GeoMapping.\n\nOur client is in the process of building a mobile application that will be a data ingestion tool for internal care managers and sales teams to help generate leads and increase efficiency in their day to day travel. As a web developer on this team you will work closely with BI Engineers and Data Scientists to geographically map out leads and current customers that the sales teams are meeting with. This information will be plugged into Microsoft Dynamics to assign future leads to their sales teams\xe2\x80\x99 calendar. The vision for this role is to help stand up an enterprise center of excellence for GeoMapping and GeoAnalytics.  \n\n\nRole Requirements:\n\xc2\xb7 Experience with HTML, CSS, and Javascript (or other .js languages)\n\xc2\xb7 Familiarity with any of the following is preferred:\n- Mapbox, Leaflet, Sesium, PostGIS, MapServer, Geo Spatial Queries, Turf JS, Gurobi, Alteryx\n\xc2\xb7 Exposure to BI platforms like Qlik or Power BI\n\xc2\xb7 Ability to create dashboards and do basic data visualization work\n\xc2\xb7 Strong communication and problem-solving skills\n\nBenefits of working with Brooksource:\n\xe2\x80\xa2 Direct communication with the hiring manager, which allows us to have a deep understanding of the timeline and move you through the interview process faster.\n\xe2\x80\xa2 Dedication to keep an open line of communication and provide full visibility.\n\xe2\x80\xa2 Brooksource is an equal opportunity employer.'"
b'Salesforce & WordPress Developer',b'Confidential',b'Greater Chicago Area',"b'As a Salesforce & WordPress Developer, you will leverage your business and technical skills to improve overall productivity for our internal customers and external community by improving, enhancing, and maintaining our Salesforce and supporting technology.\nThis is the ideal position for a Salesforce & WordPress Developer excited about an opportunity to play a major role within an organization as their full-time Salesforce and WordPRess expert.\nSalesforce & WordPress Developer Job Description:\n\xc2\xb7        Gathering, developing and analyzing business requirements for solution design on Salesforce.com\nUtilizing object-oriented programming and design concepts to advise on Salesforce.com solutions\nDeveloping custom applications and performing unit testing using Salesforce.com APEX and Lighting pages, as well as on the Fonteva platform\nPerforming data migration using Salesforce.com Data Loader\nDesigning and developing functionalities and web integration using Apex and Zapier\nDesigning user interfaces using Lighting\nUsing Force.com IDE to deploy and migrate applications\nUtilizing Salesforce Sandbox as a platform for development, testing and code deployment\nIntegrate\nDevelop integrations with outside services using web service API\xe2\x80\x99s\nCreating process and business flow diagrams use cases, story boards, training documents and job aids for end users and business users using Visio and PowerPoint\nSupporting and maintaining the applications on Salesforce.com to ensure optimal performance\nSalesforce Administrator Desired Skills and Experience:\n4+ years of experience working within the Salesforce platform on development level.\nSalesforce Developer Certification Required, additional certifications preferred\nLighting experience and APEX knowledge required\nFonteva application experience required\nSalesforce Field Service Lightning experience is preferred\nYou have a strong understanding of Salesforce functionality and can clearly communicate its capabilities and limitations to internal customers.\nAbility to build and demonstrate prototypes in Salesforce Sandbox.\nComfortable with heavy involvement in user acceptance test planning.\nYou are a highly motivated individual with a desire to learn and contribute.'"
b'Web Application Developer',b'Americaneagle.com',"b'Des Plaines, IL, US'","b""We're looking for talented developers to join our team and help us build high-quality, cutting-edge websites. Americaneagle.com was recently named by Built in Chicago as one of the best places to work and to Inc.com's list of 5000 fastest-growing private companies for the past six years. We're looking to expand on our success within the Internet industry.\n\nHere are just some of the reasons why developers enjoy working at our company:\nOur primary focus is software development and technology.\nWe actually look for creative individuals who are not afraid to make constructive recommendations.\nWe have many experienced developers on our staff that you will undoubtedly learn from as you work together with them to build exciting new applications.\nWe have hundreds of active projects and are launching a new website nearly every day. Developers here enjoy seeing their projects get launched to the public and seeing how their work leads to our customers' success.\nIn addition to working on customer projects, developers also have the opportunity to contribute to our idev platform which we have developed in-house. This includes a content management system (CMS), ecommerce platform, search application, and broadcast email application (with more on the way).\nBy working on such high-profile applications, it gives our developers the opportunity to stretch their horizons and learn about things like database partitioning; caching; web farms; working with huge volumes of data; workflow; specialized ecommerce techniques; payment gateways; integration with various external software like ERP systems; AJAX; JSON; advanced programming models based on design patterns; plug-in architecture, etc.\nOur developers enjoy working on the latest versions of development software on fast workstations with dual flat-screen monitors.\nWe cover test fees for developers to take certification tests offered by Microsoft and other vendors.\n\nOur Portfolio Includes Interesting Projects Such As\nCTA TrainTracker\nHigh-revenue ecommerce sites for customers such as Weathertech, Stuart Weitzman, Beretta, MARS and many more\nBuilt a content management system for www.whitehouse.gov and also did a joint project with Google developers to host the first ever online Presidential Town Hall\nThe www.baseballiq.com iPhone application for stat guru Bill James\nBuilt a content management system for USTA which allows them to manage and syndicate content to hundreds of sub-sites through one central location\nHere is a link to more sites in our portfolio: https://www.americaneagle.com/portfolio\n\nRequirements\nBachelor's degree in Computer Science or related field.\nExperience in programming websites. We program in Microsoft ASP.NET/SQL Server and PHP/MySQL. We work with various CMS systems such as Idev, Sitecore, Sitefinity, Kentico, Magento, BigCommerce, WordPress and many more.\nSomeone with a passion for programming, technology and who is always looking to learn more.\nWe offer a generous compensation and benefits package, 401K, and more. The Americaneagle.com office is located 2 miles north of the Rosemont CTA Station (Blue Line) and is served by Pace Bus 221. On-site parking is provided.\n\nAmericaneagle.com, a family owned, privately held company founded in 1978, is truly a one-stop shop offering a full range of solutions for any organization looking to succeed in their online endeavors. As a leader in website design, strategy, development, and hosting, Americaneagle.com has provided thousands of online solutions for a variety of customers, from small and mid-sized businesses to Fortune 500 companies, professional sports teams, and large associations. Some of our clients include Stuart Weitzman, WeatherTech.com, Komatsu, and Portillos.\n\nAs an equal opportunity/affirmative action employer, Americaneagle.com is committed to fostering a diverse, multicultural work environment where our employees respect one another and share a commitment to the company's values, mission, and strategies. All qualified applicants will receive consideration for employment without regard to race, sex, color, religion, sexual orientation, gender identity, national origin, protected veteran status, or on the basis of disability."""
b'Web Developer',b'Bronson Lee Partners',"b'Chicago, IL, US'","b""We are seeking a Web Dev to join our team! You will develop and implement unique web-based applications. You will be required to think like an entrepreneur, and always look at the bigger picture with everything you do. You'll enjoy constant code switching and problem solving in real time for the sake of the team\xe2\x80\x99s current projects. You'll need to understand and play a major part in the entire cycle of software consulting and delivery, from ideation, to project conception, to UX, to code, to testing, to deployment, and around again.\n\nResponsibilities\nYou will be responsible for upkeep on servers, handling our database, and meeting internal requests for information from the server.\nYour daily work will mainly be working on a ruby on rails app with a react front end with postgresql.\nCreate back-end code and interfaces for new web platforms\nAnalyze user needs to implement web site content, graphics, performance, and capacity\nIntegrate web sites with other computer applications\n\nQualifications\nMust be very comfortable learning and using APIs\nBS/BA degree or equivalent experience\nPrevious experience in web development or other related fields\nFamiliarity with with HTML, Javascript, SQL, React, and Ruby on Rails\nStrong problem solving and critical thinking skills\n6.8.0\n\nCompany Description\n\nBronson Lee Partners is a fast growing real estate and distressed tax receivable investment company.\n\nFrom $20 million in 2016, our portfolio will grow to more than $100 million in 2018. We are a fast growing tech enabled company where you'll learn quickly and be pushed to perform your best."""
b'Web Developer',"b'Coilcraft, Inc.'","b'Cary, Illinois, United States'","b""Coilcraft, Inc., founded in 1945, is an established worldwide organization specializing in the manufacturing of magnetic components including high performance RF chip inductors, power magnetics and filters with headquarters located in Cary, Illinois. We are seeking a Web Developer to join our team.\nJob Responsibilities:\n        Develop custom web applications for a global company intranet structure based on user demand.\n        Design, implement and support database development on a SQL server.\n        Program code for mass data conversions during system upgrades.\n        Instruct and answer questions for both technical and non-technical users regarding custom applications and Microsoft Office applications.\nJob Requirements:\n        Bachelor's degree in computer science or equivalent experience.\n        3-5+ years web development experience \n        SQL database development and maintenance using SQL Server Management Software. \n        C#, Visual Basic, SQL, ASP, HTML, Javascript, JQuery, CSS and VBA for MS Office applications experience.\n        Use of OLE and ADO objects a plus.\n        EPPlus and SSRS experience a plus.\n EOE/Minorities/Females/Veterans/Disabled\nThis position may require compliance with ITAR export regulations, applicants must be U.S. citizens or have permanent resident status"""
